url,title,partner,enroll,rating,level,duration,skills,reviews
https://www.coursera.org/learn/introduccion-a-la-inteligencia-emocional,Introducción a la inteligencia emocional,UBITS,"48,175",4.7,Beginner level,1 week at 10 hours a week,"Decision Making, Empathy & Emotional Intelligence, Adaptability, Emotional Intelligence, Persistence, Personal Development, Self-Motivation, Cultural Diversity, Self-Awareness, Interpersonal Communications, Communication, Resilience","1,001"
https://www.coursera.org/learn/xinxi-shehui,信息社会的机遇和挑战,University of Science and Technology of China,"2,383",4.5,,1 week to complete,"digital literacy, Technology Solutions, Adaptability, Open Mindset, Learning Strategies, Willingness To Learn, Social Impact, Emerging Technologies, Trend Analysis, Digital Transformation, Innovation, Personal Development, Social Studies, Lifelong Learning",60
https://www.coursera.org/learn/metacognition,Practical Metacognition for Learning,Rice University,,,Beginner level,2 weeks to complete,"Resourcefulness, Cognitive flexibility, Adaptability",
https://www.coursera.org/learn/speaking-and-presenting-pitches-persuasion,Speaking and Presenting: Pitches and Persuasion,University of Michigan,"11,502",4.6,Beginner level,,"Public Speaking, Cultural Diversity, Creativity, Optimism, Problem Solving, Storytelling, Ingenuity, Cognitive flexibility, Non-Verbal Communication, Resilience, Persuasive Communication, Rapport Building, Communication, Research, Verbal Communication Skills",94
https://www.coursera.org/learn/transferable-skills,Identifying Transferable Skills,University of Minnesota,,,Beginner level,,"Project Management, Intercultural Competence, Goal Setting, Collaboration, Personal Development, Leadership, Self-Awareness, Emotional Intelligence, Professional Development, Cultural Diversity, Communication Strategies, Adaptability",
https://www.coursera.org/learn/managing-data-in-ms-excel,إدارة البيانات في مايكرسوفت إكسل | Managing Data in MS Excel,Alfaisal University | KLD,"1,702",4.6,Beginner level,,"Data Import/Export, Data Cleansing, Data Quality, Data Entry, Data Validation, Data Integrity, Data Management",24
https://www.coursera.org/learn/how-to-write-a-resume,How to Write a Resume (Project-Centered Course),The State University of New York,"233,804",4.5,Take your resume to the next level with Canva,It was a very good course and helped me to update my resume to something fresh that got a callback after months of sending out resumes with no callbacks.  Thank you very much!,"Detail Oriented, Personal Development, Organizational Skills, Keyword Research, Adaptability, Concision, Peer Review, Business Writing","3,894"
https://www.coursera.org/learn/identity-motivation-selfhood,Exploring the Origins of Selfhood,University of Colorado System,"1,791",,Beginner level,2 weeks to complete,"Sociology, Intercultural Competence, World History, Diversity Awareness, Cultural Diversity, Psychology, digital literacy, Culture, Ethical Standards And Conduct, Social Impact, Human Development, Social Sciences",
https://www.coursera.org/learn/pathways-to-civic-engagement-mooc,Pathways to Civic Engagement,University of North Texas,,,,1 week to complete,"Mental Health Diseases and Disorders, Diversity Awareness, Social Impact, Empathy, Community Outreach, Community Development, Student Engagement, Community Organizing, Social Justice, Social and Human Services, Immigration Law, Disabilities, Cultural Diversity, Collaboration, Social Work, Communication, Social Skills, Community and Social Work",
https://www.coursera.org/learn/creatividad,Ser más creativos,Universidad Nacional Autónoma de México,"198,153",4.7,,,"Curiosity, Brainstorming, Creative Thinking, Dealing With Ambiguity, Problem Solving, Design Thinking, Creative Problem-Solving, Cognitive flexibility, Creativity, Innovation, Persona (User Experience)","3,312"
https://www.coursera.org/learn/speaking-presenting-conversation-starters,Speaking and Presenting: Conversation Starters,University of Michigan,"27,629",4.6,Beginner level,1 week at 10 hours a week,"Presentations, Interpersonal Communications, Public Speaking, Driving engagement, Storytelling, Creativity, Active Listening, Ingenuity, Adaptability, Cognitive flexibility, Communication, Verbal Communication Skills, Persuasive Communication",99
https://www.coursera.org/learn/comunicacion-para-equipos-multigeneracionales,Comunicación para equipos multigeneracionales,UBITS,,4.5,Advanced level,,"Diversity Awareness, Workplace inclusivity, Team Management, Communication Strategies, Collaboration, Communication, Interpersonal Communications, Productivity, Empathy, Leadership",11
https://www.coursera.org/learn/womens-leadership-boost-you-skills-and-drive-change,Women's Leadership: Boost your skills and drive change,Banco Interamericano de Desarrollo,,,Beginner level,2 weeks to complete,"Communication, Leadership and Management, Resilience, Leadership, Decision Making, Personal Development, Empathy, Mentorship, Branding, Public Speaking, Professional Development, Self-Awareness, Emotional Intelligence, Social Media",
https://www.coursera.org/learn/design-thinking-resolucion-problemas,Parte 1: Design Thinking para la resolución de problemas,IESE Business School,,,Beginner level,,"Human Centered Design, Needs Assessment, Problem Solving, Creative Problem-Solving, Ideation, Technical Communication, Design Thinking, Customer Analysis, Innovation, Brainstorming",
https://www.coursera.org/learn/personality-development-analyze-apply-transform,"Personality Development: Analyze, Apply & Transform",EDUCBA,,4.7,,,"Applied Behavior Analysis, Case Studies, Resilience, Goal Setting, Emotional Intelligence, Psychology, Persistence, Growth Mindedness, Overcoming Obstacles, Self-Awareness, Personal Attributes, Tenacity, Psychological Evaluations, Empathy & Emotional Intelligence, Personal Development, Cognitive flexibility",13
https://www.coursera.org/learn/pensamiento-sistemico,Pensamiento sistémico,Universidad Nacional Autónoma de México,"94,598",4.7,,,"Systems Analysis, Control Systems, Network Model, Critical Thinking and Problem Solving, Case Studies, Systems Thinking, Cognitive flexibility, Social Studies","1,389"
https://www.coursera.org/learn/uncover-ai-impact-on-consumer-psychology,Uncover AI's Impact on Consumer Psychology,Coursera,,,Beginner level,,"Design Research, Discussion Facilitation, Usability Testing, AI Personalization, Psychology, AI Security, Human Factors, Information Privacy, Record Keeping, Usability, Case Studies, Qualitative Research, User Research, Data Capture, Trustworthiness, Customer Insights, Consumer Behaviour",
https://www.coursera.org/learn/tech-support-career-guide-and-interview-preparation,Tech Support Career Guide and Interview Preparation,IBM,"7,002",4.9,,,"Professionalism, Technical Support, Communication, Technical Communication, System Support, Help Desk Support, Technical Support and Services, Desktop Support, Verbal Communication Skills, Interviewing Skills, Professional Networking, Professional Development, Problem Solving",141
https://www.coursera.org/learn/mulheres-lderes-potencialize-habilidades-para-a-mudanca,Mulheres líderes: potencialize habilidades para a mudança,Banco Interamericano de Desarrollo,,,Beginner level,2 weeks to complete,"Communication, Professional Development, Mentorship, Social Media, Leadership, Empowerment, Presentations, Resilience, Emotional Intelligence, Self-Awareness, Governance, Leadership and Management, Assertiveness, Branding, Professional Networking",
https://www.coursera.org/learn/designing-building-antiracist-spaces,Designing and Building Institutional Anti-Racist Spaces,Wesleyan University,"2,964",4.7,Beginner level,2 weeks to complete,"Storytelling, Social Justice, Workplace inclusivity, Diversity Equity and Inclusion Initiatives, Community Organizing, Policy Analysis, Systems Thinking, Cultural Diversity",10
https://www.coursera.org/learn/fluencia-digital,Fluência Digital,Serviço Nacional de Aprendizagem Industrial - Departamento Nacional,,,Beginner level,3 months to complete,"Events and Conferences, Digital Communications, Data Security, Technology Solutions, Videography, Telecommuting, Computer Literacy, Data Sharing, digital literacy, Digital Transformation, Virtual Teams, Collaboration",
https://www.coursera.org/learn/tinkering-circuits,Tinkering Fundamentals: Circuits,Exploratorium,"10,992",4.7,Beginner level,,"Basic Electrical Systems, Computational Thinking, Driving engagement, Developing Training Materials, Construction, Electronics, Design Thinking, Education Software and Technology, Creative Design, Design, Experimentation, Creativity",48
https://www.coursera.org/learn/liderazgo-mujer-directiva,Parte 1: Construyendo tu liderazgo,IESE Business School,,,Beginner level,,"Overcoming Obstacles, Executive Presence, Diversity Awareness, Cultural Diversity, Strategic Leadership, Leadership, Diversity and Inclusion, Leadership Development, Personal Development, Leadership and Management, Influencing, Workplace inclusivity, Self-Awareness, Business Leadership, Decision Making, Professional Development, Organizational Leadership",
https://www.coursera.org/learn/better-learning,Better Learning,American Psychological Association,"2,385",4.9,Beginner level,2 weeks to complete,"Time Management, Productivity, Critical Thinking, Self-Discipline, Learning Strategies, Self-Awareness, Mental Concentration, Human Learning, Psychology",17
https://www.coursera.org/learn/advanced-goal-setting,SMART Goals And Beyond: Goal Setting Using Latest Research,Alex Genadinik,,,,,"Coaching, Smart Goals, Productivity, Planning, Personal Development, Professional Development, Psychology, Goal Setting, Decision Making, Self-Motivation, Adaptability, Scientific Methods, Empowerment, Time Management, Enthusiasm, Prioritization",
https://www.coursera.org/learn/diversity-equity-inclusion,"Diversity, Equity & Inclusion","Automatic Data Processing, Inc. (ADP)","4,209",4.5,Beginner level,,"Diversity Training, Organizational Change, Adaptability, Diversity Awareness, Safety Culture, Cognitive flexibility, Workplace inclusivity, Employee Training, Diversity and Inclusion, Diversity Equity and Inclusion Initiatives, Open Mindset, Cultural Sensitivity, Self-Awareness, Cultural Responsiveness, Cultural Diversity",48
https://www.coursera.org/learn/tecnicas-disciplina-productividad-para-lograr-metas,Técnicas de disciplina y productividad para lograr metas,UBITS,,,Beginner level,1 week to complete,"Adaptability, Productivity, Cognitive flexibility, Self-Discipline, Goal Setting, Self-Awareness, Personal Development, Goal-Oriented, Mental Concentration, Growth Mindedness, Emotional Intelligence, Coaching",
https://www.coursera.org/learn/wharton-success,Success,University of Pennsylvania,"74,141",4.8,Beginner level,1 week at 10 hours a week,"Strong Work Ethic, Self-Awareness, Optimism, Adaptability, Cultural Diversity, Goal Setting, Personal Development, Self-Motivation, Growth Mindedness","1,218"
https://www.coursera.org/learn/find-your-calling,Find Your Calling: Career Transition Principles for Veterans,Columbia University,,,Beginner level,2 weeks to complete,"Personal Development, Growth Mindedness, Empathy, Professional Networking, Decision Making, Self-Awareness, Relationship Building, Emotional Intelligence, Goal Setting, Professional Development, Branding, Entrepreneurship",
https://www.coursera.org/learn/discapacidad,Comprendiendo a la discapacidad en entornos universitarios,Universidad Nacional Autónoma de México,"7,589",4.9,Beginner level,,"Instructional Design, Educational Materials, Student Engagement, Interpersonal Communications, Case Studies, Special Education, Diversity Awareness, Higher Education, Student Support and Services, Disabilities",95
https://www.coursera.org/learn/career-brand-development-self-coaching,Building and Managing Superior Skills,The State University of New York,"33,313",4.6,Intermediate level,2 weeks at 10 hours a week,"Smart Goals, Performance Appraisal, Goal Setting, Personal Development, Talent Acquisition, Recruitment Strategies, AI Enablement, Job Analysis, Employee Training, Portfolio Management, Constructive Feedback, Professional Development, Self-Awareness, Coaching, Peer Review, Test Tools, Benchmarking",150
https://www.coursera.org/learn/essentials-of-ms-word,أساسيات برنامج مايكروسوفت وورد | Essentials of MS Word,Alfaisal University | KLD,"3,921",4.8,Beginner level,,"File Management, Document Management, Technical Documentation, Computer Literacy",45
https://www.coursera.org/learn/welcome-to-munich,Welcome to Munich,Technical University of Munich (TUM),"14,258",4.3,Beginner level,1 week to complete,"Cultural Sensitivity, Education and Training, Learning Strategies, Cultural Diversity, Student Services, Higher Education, Student Support and Services, Intercultural Competence",35
https://www.coursera.org/learn/personality-types-at-work,Personality Types at Work,University of Florida,"91,242",4.5,Beginner level,2 weeks at 10 hours a week,"Personal Development, Interpersonal Communications, Team Building, Writing, Performance Review, Professional Development, Team Management, Self-Awareness, People Management, Interviewing Skills, Emotional Intelligence, Leadership, Employee Performance Management",776
https://www.coursera.org/learn/hgproyectofinal,Habilidades gerenciales: Proyecto final,Universidad Nacional Autónoma de México,"9,338",4.8,Beginner level,,"Key Performance Indicators (KPIs), Strategic Leadership, Analysis, Professional Networking, Business Strategy, Business Management, Performance Measurement, Business Priorities, People Development, Organizational Strategy, Leadership, Goal Setting, Business Planning",299
https://www.coursera.org/learn/challenges-of-leading-individuals-in-the-tech-industry,Challenges of Leading Individuals in the Tech Industry,University of Colorado Boulder,,,Beginner level,Degree · 24 months,"Culture Transformation, Employee Engagement, Organizational Leadership, Leadership and Management, Delegation Skills, Engineering Management, Empowerment, Employee Performance Management, Organizational Effectiveness, Leadership, Team Leadership, Team Motivation, Technical Management",
https://www.coursera.org/learn/formatting-pages-in-ms-word,تنسيق الصفحات في مايكروسوفت وورد,Alfaisal University | KLD,,,Beginner level,,,
https://www.coursera.org/learn/morning-routine,Ideal Morning Routine For An Improved Quality Of Life,Alex Genadinik,,,,,"Adaptability, Self-Awareness, Mindfulness, Health And Wellness Coaching, Time Management, Nutrition and Diet, Behavior Management, Personal Development, Self-Motivation, Goal Setting, Productivity",
https://www.coursera.org/learn/career-advancement,Successful Career Development,Kennesaw State University,"75,191",4.7,Beginner level,2 weeks at 10 hours a week,"Interviewing Skills, Relationship Building, Personal Development, Influencing, Professional Networking, Professional Development, Mentorship, Adaptability, Collaboration","1,475"
https://www.coursera.org/learn/etkili-konusma,Etkili Konuşma (Effective Speaking),Koç University,"46,646",4.8,,,"Communication, Oral Expression, Public Speaking, Emotional Intelligence, Language Competency, Verbal Communication Skills",438
https://www.coursera.org/learn/race-cultural-diversity-american-life,Race and Cultural Diversity in American Life and History,University of Illinois Urbana-Champaign,"46,848",4.6,Beginner level,1 week at 10 hours a week,"Diversity Awareness, Sociology, Social Justice, Policy Analysis, Cultural Diversity, Immigration Law, Social Studies, Demography, Political Sciences, Culture, World History, Economics, Policy, and Social Studies, Social Sciences",302
https://www.coursera.org/learn/advanced-creative-thinking,Advanced Creative Thinking and AI: Tools for Success,Imperial College London,"8,059",4.7,Advanced level,,"Artificial Intelligence, Prototyping, Innovation, Creative Thinking, Brainstorming, Ideation, Cognitive flexibility, Design Thinking, Creative Problem-Solving, Critical Thinking",120
https://www.coursera.org/learn/writing-editing-words,Writing and Editing: Word Choice and Word Order,University of Michigan,"164,012",4.7,Beginner level,2 weeks at 10 hours a week,"Professionalism, Writing, Storytelling, Time Management, Editing, Detail Oriented, Resourcefulness, Decision Making, Creativity, Communication Strategies","2,023"
https://www.coursera.org/learn/strategic-career-self-management,Strategic Career Self-Management,The State University of New York,"43,463",4.5,Intermediate level,1 week at 10 hours a week,"Adaptability, Dealing With Ambiguity, Gap Analysis, Goal Setting, Smart Goals, Competitive Analysis, Job Analysis, Personal Development, Lifelong Learning, Brand Management, Self-Awareness, Professional Development",304
https://www.coursera.org/learn/overcoming-challenges-in-self-and-society,Overcoming  Challenges in Self and Society,University of Colorado System,,,Beginner level,2 weeks to complete,"Resilience, Persistence, Compassion, Cultural Diversity, Mindfulness, Adaptability, Empowerment, Overcoming Obstacles, Community Development, Personal Development, Growth Mindedness",
https://www.coursera.org/learn/memory-enhancing-skills,مهارات تنشيط الذاكرة | Memory Enhancing Skills,Alfaisal University | KLD,"3,495",4.9,Beginner level,1 week to complete,"Cognitive flexibility, Neurology, Social Skills, Psychology, Mental Health, Mental Health Diseases and Disorders, Learning Strategies, Stress Management, Personal Care, Mental Concentration",27
https://www.coursera.org/learn/comunicacion-experimentacion-aprendizaje,"Comunicación, experimentación y aprendizaje en liderazgo",Universidad de los Andes,"18,912",4.8,Intermediate level,2 weeks at 10 hours a week,"Communication, Leadership, Conflict Management, Systems Thinking, Active Listening, Emotional Intelligence, Teamwork, Empathy, Team Management, Strategic Leadership, Community Organizing, Social Media",568
https://www.coursera.org/learn/autoliderazgo-gestion-emociones,Autoliderazgo y gestión de emociones para avanzar en desafíos complejos,Universidad de los Andes,"45,645",4.9,Intermediate level,2 weeks at 10 hours a week,"Mindfulness, Personal Development, Overcoming Obstacles, Initiative and Leadership, Emotional Intelligence, Adaptability, Decision Making, Empathy & Emotional Intelligence, Self-Awareness, Goal Setting, Stress Management, Leadership","1,761"
https://www.coursera.org/learn/how-to-create-an-online-course,How to Create an Online Course,The University of Edinburgh,"20,776",4.5,Intermediate level,,"Cultural Responsiveness, Instructional Design, Learning Strategies, Digital pedagogy, User Centered Design, Web Content, Education Software and Technology, Educational Materials, Diversity Awareness, Web Content Accessibility Guidelines, Creative Thinking, Content Management",230
https://www.coursera.org/learn/reclaim-your-attention-values-aligned-media-consumption,Reclaim Your Attention: Values-Aligned Media Consumption,University of Colorado Boulder,,,Beginner level,1 week to complete,"Resilience, Self-Discipline, Goal Setting, Behavioral Economics, Growth Mindedness, Creativity, Emotional Intelligence, digital literacy, Decision Making, Stress Management, Self-Awareness, Self-Motivation, Productivity, Critical Thinking, Mindfulness, Mental Concentration, Empowerment, Health And Wellness Coaching, Compassion, Personal Development",
https://www.coursera.org/learn/initiating-a-research-project,Initiating a Research Project,"University of California, Davis",,,Beginner level,,"Research Methodologies, Research and Design, Journals, Research",
https://www.coursera.org/specializations/collaborationforeveryone,Collaboration For Everyone Specialization,Arizona State University,"1,639",4.6,Beginner level,4 weeks to complete,"Brainstorming, Communication, Communication Strategies, Complex Problem Solving, Creative Problem-Solving, Critical Thinking and Problem Solving, Decision Making, Empowerment, Growth Mindedness, Independent Thinking, Lecturing, Optimism, Positivity, Presentations, Problem Solving, Public Speaking, Root Cause Analysis, Storytelling, Strategic Decision-Making, Verbal Communication Skills",197
https://www.coursera.org/learn/psychology-of-the-self,Psychology of the Self,American Psychological Association,"4,915",4.7,Beginner level,2 weeks to complete,"Goal Setting, Emotional Intelligence, Scientific Methods, Cultural Diversity, Psychology, Self-Motivation, Critical Thinking, Cognitive flexibility, Mindfulness, Self-Awareness, Personal Development",21
https://www.coursera.org/learn/university-studies-for-student-veterans,University Studies for Student Veterans,Columbia University,,,Beginner level,1 week to complete,"Writing, Learning Strategies, Higher Education, Literacy, Student Support and Services, Critical Thinking, Time Management, Organizational Skills, Growth Mindedness, Adaptability",
https://www.coursera.org/learn/liderazgo-efectivo-y-colaboracin-con-inteligencia-emocional,Liderazgo efectivo y colaboración con inteligencia emocional,Universidades Anáhuac,"2,747",4.9,Beginner level,,"Conflict Management, Team Motivation, Self-Awareness, Emotional Intelligence, Empathy & Emotional Intelligence, Problem Solving, Overcoming Obstacles, Initiative and Leadership, Team Management, Professional Development, Motivational Skills, Personal Development, Teamwork, Organizational Leadership, Team Leadership, Communication, Team Building, Productivity, Collaboration, Leadership",66
https://www.coursera.org/learn/conflict-management-capstone-project,Conflict Management Project,"University of California, Irvine","7,967",4.8,,,"Organizational Effectiveness, Intercultural Competence, Interpersonal Communications, Analysis, Portfolio Management, Case Studies, Stakeholder Management, Communication Strategies, Conflict Management",177
https://www.coursera.org/learn/teachingscience,Teaching Science at University,University of Zurich,"12,590",4.6,Beginner level,1 week at 10 hours a week,"Student Engagement, Instructional Strategies, Scientific Methods, Pedagogy, Laboratory Experience, Experimentation, Lecturing, Teaching, Drive Engagement, Research Design, Simulations, Course Development, Model Evaluation, Education and Training",196
https://www.coursera.org/learn/introductiontobecomingacna,Introduction to Becoming a CNA,Cinematic Health,"2,425",4.8,Beginner level,,"Patient Observation, Personal Care, Patient Safety, Infection Control, Care Management, Patient Positioning, Rehabilitation, Treatment Planning, Vital Signs, Caregiving, Activities of Daily Living (ADLs), Patient Transfer Equipment, Toileting, Basic Patient Care",15
https://www.coursera.org/learn/gritandgrowthmindset,Grit and Growth Mindset,Arizona State University,"4,176",4.7,,,"Goal Setting, Resilience, Professional Development, Growth Mindedness, Optimism, Persistence, Adaptability, Mindfulness, Personal Development, Courage, Self-Awareness, Overcoming Obstacles",28
https://www.coursera.org/learn/construyendo-organizaciones,Parte 4: Construyendo Organizaciones Sólidas,IESE Business School,,,Beginner level,,"Leadership, Diversity and Inclusion, Decision Making, Organizational Effectiveness, Organizational Leadership, Business Leadership, Strategic Decision-Making, Conflict Management, Quality Management, Team Building, Company, Product, and Service Knowledge, Employee Engagement, Relationship Management",
https://www.coursera.org/learn/ignite-creativity,Ignite Your Everyday Creativity,The State University of New York,"87,643",4.4,,2 weeks to complete,"Cognitive flexibility, Recognizing Others, Open Mindset, Problem Solving, Self-Awareness, Innovation, Dealing With Ambiguity, Adaptability, Ingenuity, Creative Problem-Solving, Curiosity, Creative Thinking, Creativity",310
https://www.coursera.org/learn/inteligencia-emocional-un-enfoque-practico,Inteligencia Emocional: Un enfoque práctico,Universidades Anáhuac,"5,179",4.8,Beginner level,1 week at 10 hours a week,"Composure, Personal Development, Self-Motivation, Critical Thinking, Emotional Intelligence, Self-Awareness, Communication, Decision Making, Problem Solving, Growth Mindedness, Relationship Management, Professional Development, Interpersonal Communications, Empathy, Leadership Studies",56
https://www.coursera.org/learn/mindful-digital-art-5-prompts-for-self-development,Mindful Digital Art: 5 Prompts for Self Development,Skillshare,,,Beginner level,,"Emotional Intelligence, Creativity, Mindfulness, Design Elements And Principles, Creative Thinking, Personal Development, Color Theory, Digital Design, Storytelling, Self-Awareness",
https://www.coursera.org/learn/recherche-documentaire,La recherche documentaire,École Polytechnique,"26,995",4.6,Beginner level,,"Document Management, Investigation, Record Keeping, Research Methodologies, Databases, Intellectual Property, Data Collection, Research",229
https://www.coursera.org/learn/success-intelligence-skills,مهارات ذكاء النجاح | Success Intelligence Skills,Alfaisal University | KLD,,4.9,Beginner level,,"Team Oriented, Growth Mindedness, Collaboration, Goal Setting, Personal Attributes, Organizational Effectiveness, Leadership, Business Leadership, Initiative and Leadership, Strategic Leadership",20
https://www.coursera.org/learn/challenges-of-leading-technical-teams,Challenges of Leading Technical Teams,University of Colorado Boulder,"1,597",4.8,Beginner level,Degree · 24 months,"Delegation Skills, Communication, Meeting Facilitation, Team Building, People Development, Decision Making, Technical Management, Discussion Facilitation, Goal Setting, Team Management, Team Leadership, Recruitment, Leadership, Engineering Management",16
