url,title,partner,enroll,rating,level,duration,skills,reviews
https://www.coursera.org/learn/nanotecnologia-sostenibilitat-matematiques-al-mon-nano,"Nanotecnologia, Sostenibilitat i matemàtiques al món nano",Universitat de Barcelona,,,Beginner level,2 weeks to complete,"Sustainable Technologies, Chemistry, Ethical Standards And Conduct, Applied Mathematics, Biomedical Engineering, Innovation, Sustainable Engineering, Sustainable Development, Robotics, Engineering, Scientific, and Technical Instruments, Electronics, Physics, Safety Standards, Education Software and Technology, Emerging Technologies, Materials science",2026
https://www.coursera.org/learn/mecanica-de-materiales,Mecánica de materiales,Pontificia Universidad Católica de Chile,,,Beginner level,1 week to complete,"Engineering Analysis, Engineering, Materials science, Torque (Physics), Structural Analysis, Mechanical Engineering, Physics, Engineering Calculations, Mechanics, Structural Engineering, Mathematical Modeling",
https://www.coursera.org/learn/ethics-technology-engineering,"Ethics, Technology and Engineering",Eindhoven University of Technology,"38,042",4.6,Beginner level,2 weeks at 10 hours a week,"Engineering Design Process, Social Impact, Business Ethics, Ethical Standards And Conduct, Engineering Practices, Research, Value Engineering",828
https://www.coursera.org/learn/big-data-business-intelligence,A quick tour on Big Data and Business Intelligence,Università di Napoli Federico II,"3,876",4.1,Beginner level,,"Distributed Computing, Data Processing, Data Management, Scalability, Databases, Business Intelligence, Big Data, Artificial Intelligence",26
https://www.coursera.org/learn/kalman-filter-deep-dive-target-tracking,Linear Kalman Filter Deep Dive (and Target Tracking),University of Colorado System,,,Intermediate level,2 weeks to complete,"Applied Mathematics, Control Systems, Predictive Analytics, Estimation, Mathematical Modeling, Linear Algebra, Forecasting, Time Series Analysis and Forecasting, Probability & Statistics, Advanced Mathematics, Statistical Methods",
https://www.coursera.org/learn/engineering-genetic-circuit-design,Engineering Genetic Circuits: Design,University of Colorado Boulder,"4,693",4.6,Beginner level,2 weeks at 10 hours a week,"Cell Biology, Biological Engineering, Biotechnology, Computational Logic, Laboratory Experience, Engineering Design Process, Biochemistry, Research Design, Electrical Engineering, Technical Design, Technical Standard, Biology, Molecular Biology",36
https://www.coursera.org/learn/how-to-plan-green-and-resilient-housing,How to plan green and resilient housing?,Banco Interamericano de Desarrollo,,,Beginner level,,"Building Design, Sustainable Design, Climate Change Mitigation, Environmental Issue, Social Determinants Of Health, Architectural Design, Social Impact",
https://www.coursera.org/specializations/autonomous-vehicle-engineering,Autonomous Vehicle Engineering Specialization,Università di Napoli Federico II,"4,710",4.2,Beginner level,12 weeks to complete,"Artificial Intelligence, Automation, Big Data, Business Intelligence, Computer Vision, Control Systems, Databases, Distributed Computing, Global Positioning Systems, Laboratory Experience, Mechanical Design, Mechanical Engineering, Robotics, Simulation and Simulation Software, Simulations, Systems Architecture",84
https://www.coursera.org/learn/nanophotonics-detectors,Nanophotonics and Detectors,University of Colorado Boulder,"6,461",4.0,Advanced level,2 weeks at 10 hours a week,"Electrical Engineering, Semiconductors, Electronic Components, Electronics, Performance Testing, Mathematical Modeling, Physics",25
https://www.coursera.org/learn/single-phase-pipe-hydraulics-pipe-sizing,Single-Phase Pipe Hydraulics and Pipe Sizing,L&T EduTech,"7,900",4.4,Intermediate level,1 week to complete,"Chemical Engineering, Process Analysis, Mechanical Engineering, Process Flow Diagrams, Engineering Analysis, Engineering Calculations, Mathematical Modeling, Hydraulics",51
https://www.coursera.org/learn/natural-attenuation-of-groundwater-contaminants,"Natural Attenuation of Groundwater Contaminants: New Paradigms, Technologies, and Applications",Rice University,"18,383",4.8,Advanced level,3 weeks at 10 hours a week,"Environmental Engineering, Analytical Chemistry, Chemistry, Hydrology, Environmental Monitoring, Water Quality, Mathematical Modeling, Chemical Engineering, Water Resources, Microbiology, Biochemistry, Laboratory Research, Environmental Science",510
https://www.coursera.org/specializations/construction-practices-in-deep-excavations-and-tunnels,Construction Practices in Deep excavations and Tunnels Specialization,L&T EduTech,,4.7,Advanced level,4 weeks to complete,"Architecture and Construction, Building Codes, Civil Engineering, Construction, Construction Engineering, Construction Management, Engineering Analysis, Engineering Calculations, Engineering Design Process, Engineering Drawings, Engineering Practices, Environmental Monitoring, Failure Analysis, Finite Element Methods, Safety Standards, Simulation and Simulation Software, Structural Analysis, Structural Engineering, System Monitoring",7
https://www.coursera.org/learn/xdesign-advanced-sketching-and-reference-geometry,xDesign Advanced Sketching and Reference Geometry,Dassault Systèmes,,,Beginner level,,"Engineering Drawings, 3D Modeling, Computer-Aided Design, Mechanical Engineering, Technical Drawing",
https://www.coursera.org/learn/practice-catia-generative-wireframe-and-surface,Practice CATIA Generative Wireframe and Surface,Dassault Systèmes,,,Beginner level,,,
https://www.coursera.org/learn/statistical-mechanics,Statistical Mechanics: Algorithms and Computations,École normale supérieure,"39,437",4.8,,2 weeks to complete,"Computational Logic, Integral Calculus, Linear Algebra, Quantitative Research, Simulations, Applied Mathematics, Numerical Analysis, Markov Model, Algorithms, Physics, Sampling (Statistics)",269
https://www.coursera.org/learn/modelling-and-measuring-the-energy-transition,Modelling and measuring the Energy Transition,Politecnico di Milano,"2,916",4.4,Beginner level,,"Sustainable Engineering, Case Studies, Product Lifecycle Management, Systems Thinking, Sustainable Development, Mathematical Modeling, Analysis, Environmental Science, Accounting, Open Source Technology",27
https://www.coursera.org/learn/electrical-properties-and-semiconductors,Electrical Properties and Semiconductors,Arizona State University,"3,612",4.6,Intermediate level,2 weeks to complete,"Electronics, Electrical Engineering, Materials science, Electronics Engineering, Semiconductors, Electronic Components",44
https://www.coursera.org/learn/deep-excavations-and-support-system,Deep Excavations and Support Systems,L&T EduTech,,,Intermediate level,1 week to complete,"Structural Engineering, Simulation and Simulation Software, Engineering Practices, Construction, Engineering Design Process, Building Codes, Engineering Analysis, Structural Analysis, Engineering Calculations, Civil Engineering, Construction Engineering, Finite Element Methods",
https://www.coursera.org/learn/how-things-work,How Things Work: An Introduction to Physics,University of Virginia,"281,866",4.8,Intermediate level,1 week at 10 hours a week,"Experimentation, Energy and Utilities, Physics, Torque (Physics), Mechanics","3,073"
https://www.coursera.org/learn/designing-effective-science-communication,Designing Effective Science Communication,University of Colorado Boulder,"9,831",4.7,Beginner level,1 week to complete,"Photography, Human Learning, Interviewing Skills, Storytelling, Learning Theory, Education Software and Technology, Persuasive Communication, Writing, Infographics, Education and Training, Research, Science and Research, Technical Communication, Media and Communications, Technical Writing, Oral Expression, Program Evaluation, Scientific Methods, Community Outreach",132
https://www.coursera.org/learn/engineering-genetic-circuits-modeling-and-analysis,Engineering Genetic Circuits: Modeling and Analysis,University of Colorado Boulder,,,Intermediate level,3 weeks to complete,"Biotechnology, Simulation and Simulation Software, Engineering Analysis, Simulations, Differential Equations, Algorithms, Biological Engineering, Chemistry, Computer-Aided Design, Bioinformatics, Mathematical Modeling",
https://www.coursera.org/learn/sustainable-transportation-networks-and-streetscapes,Sustainable Transportation Networks and Streetscapes,Johns Hopkins University,"5,127",4.8,Intermediate level,,"Public Works, Architectural Design, Environmental Engineering, Environmental Issue, Community Development, Civil Engineering, Sustainable Design, Stormwater Management, Landscape Architecture, Sustainable Development, Health Equity, Water Resources, Traffic Flow Optimization",84
https://www.coursera.org/learn/climate-change-indigenous-communities,Climate change and Indigenous People and local communities,Universitat Autònoma de Barcelona,"4,317",4.5,Beginner level,2 weeks to complete,"Research Methodologies, Fundraising, Governance, Sustainable Development, Environmental Policy, Environmental Issue, Data Collection, Vulnerability, Cultural Sensitivity, Climate Change Adaptation, Social Impact, Qualitative Research",56
https://www.coursera.org/learn/sanitation,Planning & Design of Sanitation Systems and Technologies,École Polytechnique Fédérale de Lausanne,"37,686",4.8,Intermediate level,2 weeks at 10 hours a week,"Sustainable Technologies, Water Resource Management, Sanitation, Case Studies, Systems Thinking, Civil Engineering, Sustainable Development, Community Development, Process Flow Diagrams, Environmental Engineering","1,191"
https://www.coursera.org/learn/ventilation-life-safety-and-smoke-extraction-in-building,"Ventilation, Life Safety, and Smoke Extraction in Building",L&T EduTech,"2,349",4.9,Intermediate level,,"Engineering Calculations, Health And Safety Standards, Mechanical Engineering, Building Codes, HVAC, Safety Standards, Fire And Life Safety, Building Services Engineering, Mechanical Ventilation",16
https://www.coursera.org/specializations/greenskills,Green Skills for a Sustainable and Just Future Specialization,University of Michigan,"2,760",4.7,Beginner level,2 months to complete,"Collaboration, Critical Thinking, Culture Transformation, Environmental Issue, Environmental Policy, Environmental Regulations, Environmental Social And Corporate Governance (ESG), Financial Analysis, Geospatial Mapping, Leadership, Organizational Change, Organizational Effectiveness, Social Justice, Spatial Data Analysis, Strategic Leadership, Sustainability Reporting, Sustainable Business, Sustainable Development, Sustainable Systems",55
https://www.coursera.org/learn/internet-of-things-sensing-actuation,Internet of Things: Sensing and Actuation From Devices,University of California San Diego,"23,265",4.5,,2 weeks to complete,"Wireless Networks, Prototyping, Embedded Systems, Internet Of Things, Peripheral Devices, Digital Signal Processing, Communication Systems",159
https://www.coursera.org/learn/industry-4-plm-value-chain-and-smart-factory,"Industry 4.0: PLM, Value Chain, and Smart Factory",L&T EduTech,"3,859",4.5,Intermediate level,,"Enterprise Resource Planning, Real Time Data, Facility Management and Maintenance, Product Lifecycle Management, Automation, Plant Operations and Management, Internet Of Things, Manufacturing and Production, Augmented Reality, Robotic Process Automation, Digital Transformation, Production Process, Supply Chain Management",20
https://www.coursera.org/learn/kalman-filter-boot-camp-state-estimation,Kalman Filter Boot Camp (and State Estimation),University of Colorado System,"3,715",4.9,Intermediate level,2 weeks to complete,"Forecasting, Statistical Analysis, Simulations, Probability & Statistics, Numerical Analysis, Linear Algebra, Statistical Modeling, Time Series Analysis and Forecasting",24
https://www.coursera.org/learn/mechanics-1,Mechanics of Materials I: Fundamentals of Stress & Strain and Axial Loading,Georgia Institute of Technology,"142,125",4.8,,2 weeks to complete,"Failure Analysis, Civil Engineering, Mathematical Modeling, Trigonometry, Mechanics, Materials science, Structural Analysis, Engineering Calculations, Engineering Analysis, Mechanical Engineering","3,518"
https://www.coursera.org/learn/advanced-study-of-protection-schemes-and-switchgear,Advanced Study of Protection Schemes and Switchgear,L&T EduTech,"6,566",4.4,,2 weeks to complete,"Artificial Neural Networks, Control Systems, Electrical Power, Electrical Equipment, Automation Engineering, Electrical Engineering, Electrical Substation, Electrical Systems, Electric Power Systems, Electrical Safety, High Voltage",32
https://www.coursera.org/learn/machine-design1,Machine Design Part I,Georgia Institute of Technology,"117,861",4.8,Intermediate level,3 weeks at 10 hours a week,"Mechanics, Failure Analysis, Biomedical Engineering, Engineering Analysis, Mechanical Design, Structural Analysis, Problem Solving, Engineering Design Process, Materials science","2,215"
https://www.coursera.org/learn/electric-utilities,Electric Utilities Fundamentals and Future,University of Colorado System,"31,800",4.7,Beginner level,1 week at 10 hours a week,"Energy and Utilities, Regulatory Affairs, Electrical Safety, Sustainable Systems, Electric Power Systems, Technology Strategies, Environmental Issue, Customer experience strategy (CX), Analysis, Customer Engagement, Financial Regulation, Emerging Technologies",741
https://www.coursera.org/specializations/renewable-energy-power-evacuation,Renewable Energy & Power Evacuation Specialization,L&T EduTech,"1,877",4.5,Beginner level,4 weeks to complete,"Architectural Engineering, Architecture and Construction, Climate Change Mitigation, Corporate Sustainability, Electric Power Systems, Electrical Power, Electrical Systems, Energy and Utilities, Environment, Environmental Social And Corporate Governance (ESG), Innovation, Mechanical Engineering, Power Electronics, Simulation and Simulation Software, Sustainability Reporting, Sustainable Architecture, Sustainable Development, Sustainable Technologies, Thermal Management, Transportation Operations",32
https://www.coursera.org/learn/particle-dynamics,Particle Dynamics,Korea Advanced Institute of Science and Technology(KAIST),"4,335",4.6,Intermediate level,2 weeks to complete,"Calculus, Differential Equations, Engineering Calculations, Integral Calculus, Mechanical Engineering, Physics, Engineering Analysis, Mechanics",37
https://www.coursera.org/learn/geometric-and-traffic-aspects-of-highway,Geometric and Traffic Aspects of Highway,L&T EduTech,,,Intermediate level,2 weeks to complete,"Hydrology, Geometric Dimensioning And Tolerancing, Safety Standards, Engineering Design Process, Construction, Stormwater Management, Civil Engineering, Structural Engineering, Traffic Flow Optimization, Hydraulics",
https://www.coursera.org/learn/ethics-in-engineering,Ethics in Engineering,University of Michigan,"5,974",4.7,Beginner level,1 week to complete,"Engineering, Civil Engineering, Case Studies, Safety Assurance, Ethical Standards And Conduct, Social Impact, Software Engineering, Engineering Practices, Biomedical Engineering, Failure Analysis",81
https://www.coursera.org/specializations/digital-manufacturing-design-technology,Digital Manufacturing & Design Technology  Specialization,The State University of New York,"51,996",4.6,Beginner level,4 months to complete,"Anomaly Detection, Continuous Monitoring, Control Systems, Cybersecurity, Digital Transformation, Incident Response, Intrusion Detection and Prevention, Machine Controls, Manufacturing Operations, Model Based Systems Engineering, Peer Review, Performance Measurement, Product Lifecycle Management, Production Process, Programmable Logic Controllers, Security Controls, Software Development Life Cycle, Systems Engineering, Vulnerability Assessments","7,052"
https://www.coursera.org/specializations/piling-construction-and-practices,Piling Construction and practices Specialization,L&T EduTech,,4.8,Advanced level,4 weeks to complete,"Building Codes, Civil Engineering, Construction, Construction Engineering, Construction Inspection, Construction Management, Design, Engineering Analysis, Engineering Calculations, Engineering Design Process, Engineering Practices, Laboratory Testing, Process Validation, Product Testing, Safety Standards, Simulation and Simulation Software, Structural Analysis, Structural Engineering",32
https://www.coursera.org/learn/ferrous-technology-2,Ferrous Technology II,Pohang University of Science and Technology(POSTECH),"8,477",4.8,Beginner level,,"Process Development, Manufacturing Processes, Mechanical Engineering, Chemistry, Engineering, Materials science, Production Process",321
https://www.coursera.org/learn/solar-energy-and-electrical-system-design,Solar Energy and Electrical System Design,University at Buffalo,"28,497",4.7,Intermediate level,2 weeks at 10 hours a week,"Architectural Design, System Requirements, Engineering Calculations, Building Design, Cost Estimation, Mechanical Design, Electrical Systems, Structural Analysis, Building Codes, Basic Electrical Systems, Electrical Wiring, Construction Inspection, HVAC",729
https://www.coursera.org/learn/advanced-capstone-spacecraft-dynamics-control-project,Advanced Capstone Spacecraft Dynamics and Control Project,University of Colorado Boulder,,,Advanced level,2 weeks to complete,"Mechanical Engineering, Engineering Analysis, Engineering Calculations, Vibrations, Simulation and Simulation Software, Differential Equations, Mathematical Modeling, Torque (Physics), Control Systems, Mechanics",
https://www.coursera.org/learn/fpga-softcore-proccessors-ip,FPGA Softcore Processors and IP Acquisition,University of Colorado Boulder,"9,292",3.9,Intermediate level,1 week at 10 hours a week,"System Design and Implementation, Simulations, Hardware Architecture, Embedded Systems, Verification And Validation, Software Development, Software Development Tools, Debugging, System Configuration, Computer Architecture",97
https://www.coursera.org/learn/battery-management-systems,Introduction to battery-management systems,University of Colorado Boulder,"70,579",4.8,Intermediate level,3 weeks at 10 hours a week,"Chemistry, Electrical Engineering, Requirements Analysis, Control Systems, Basic Electrical Systems, Electrical Systems, Failure Analysis, Energy and Utilities, Safety Standards, Electrical Safety, Manufacturing Processes, Electronic Components, Thermal Management, Chemical Engineering, High Voltage, Materials science","2,188"
https://www.coursera.org/learn/sensor-manufacturing-process-control,Sensor Manufacturing and Process Control,University of Colorado Boulder,"18,597",4.6,Intermediate level,6 weeks at 10 hours a week,"Product Testing, Performance Tuning, Network Protocols, Automation Engineering, Semiconductors, Process Control, Medical Devices, Test Equipment, Electronic Components, Control Systems, Reliability, Electronics, Manufacturing Processes",321
https://www.coursera.org/specializations/natural-disaster-and-climate-change-risk-assessment,Natural Disaster and Climate Change Risk Assessment Specialization,Banco Interamericano de Desarrollo,"8,816",4.6,Advanced level,4 weeks to complete,"Analysis, Business Priorities, Business Risk Management, Climate Change Adaptation, Cost Benefit Analysis, Disaster Recovery, Environment, Failure Analysis, Feasibility Studies, Financial Analysis, Governance, Hazard Analysis, Mitigation, Project Risk Management, Resilience, Risk Analysis, Risk Management, Risk Mitigation, Risk Modeling, Vulnerability Assessments",356
https://www.coursera.org/learn/quimica-alimentos,La química en la producción de alimentos y medicamentos,Universidad Nacional Autónoma de México,"7,372",4.7,Beginner level,2 weeks to complete,"Analytical Chemistry, Experimentation, Drug Development, Chemical Engineering, Laboratory Procedures, Pharmaceuticals, Nutrition and Diet, Research, Biochemistry, Natural Resource Management, Food and Beverage, Environment and Resource Management, Materials science, Chemistry",58
https://www.coursera.org/learn/sensors-circuit-interface,Sensors and Sensor Circuit Design,University of Colorado Boulder,"60,329",4.6,Advanced level,3 weeks at 10 hours a week,"Design Specifications, Thermal Management, Debugging, Embedded Systems, Electronics Engineering, Schematic Diagrams, Hardware Design, Electronic Systems, Electronic Components, Development Environment","1,210"
https://www.coursera.org/learn/basics-of-rocket-science,The Basics of Rocket Science,University of Michigan,"5,279",4.9,Beginner level,1 week to complete,"Mechanics, Chemical Engineering, Calculus, Electrical Power, Trigonometry, Mathematical Modeling, Engineering, Physics",42
https://www.coursera.org/specializations/agile-systems-engineering,Agile Systems Engineering Specialization,University of Colorado System,,4.9,Intermediate level,20 weeks to complete,"Agile Methodology, Configuration Management, Engineering Management, Leadership and Management, Organizational Leadership, Requirements Analysis, Requirements Elicitation, Risk Management, Scaled Agile Framework, Scrum (Software Development), Systems Architecture, Systems Development, Systems Development Life Cycle, Systems Engineering, Team Building, Team Management, Team Motivation, Teamwork, Verification And Validation, Waterfall Methodology",10
https://www.coursera.org/learn/fundamentals-in-electromagnetics,Physics Fundamentals: Electromagnetics,Universitat Politècnica de València,,,Beginner level,1 week to complete,"Integral Calculus, Mechanics",
https://www.coursera.org/learn/natural-gas-production-and-processing,Natural Gas Production and Processing,L&T EduTech,"3,789",4.5,Beginner level,,"Equipment Design, Chemical Engineering, Petroleum Industry, Materials science, Engineering Calculations, Environmental Regulations, Safety Standards, Oil and Gas, Facility Repair And Maintenance, Process Engineering, Production Process",31
https://www.coursera.org/specializations/electrodynamics,Electrodynamics  Specialization,Korea Advanced Institute of Science and Technology(KAIST),"6,700",4.7,Intermediate level,4 weeks to complete,"Advanced Mathematics, Applied Mathematics, Calculus, Differential Equations, Electrical Engineering, Electrical Systems, Electronic Components, Electronics, Energy and Utilities, Engineering Analysis, Engineering Calculations, Materials science, Mathematical Modeling, Mechanics, Physics, Scientific Visualization, Visualization (Computer Graphics)",967
https://www.coursera.org/specializations/construction-techniques-and-practices,Construction Techniques and Practices Specialization,L&T EduTech,,4.6,Advanced level,4 weeks to complete,"Architecture and Construction, Automation Engineering, Building Codes, Civil Engineering, Commercial Construction, Construction, Construction Engineering, Construction Estimating, Construction Inspection, Construction Management, Cost Estimation, Engineering Plans And Specifications, Engineering Practices, Environmental Engineering, Equipment Design, Facility Management and Maintenance, Machine Controls, Plant Operations and Management, Product Lifecycle Management, Structural Engineering",9
https://www.coursera.org/learn/ai-for-design-and-optimization,AI for Design and Optimization,University of Michigan,"10,066",4.3,Intermediate level,1 week to complete,"Algorithms, Technical Design, Artificial Intelligence, Machine Learning, Applied Machine Learning, Data-Driven Decision-Making, Artificial Intelligence and Machine Learning (AI/ML), AI Enablement, Deep Learning",71
https://www.coursera.org/learn/mecanique-quantique,Mécanique quantique,École Polytechnique,"12,528",4.8,Intermediate level,2 weeks at 10 hours a week,"Semiconductors, Linear Algebra, Advanced Mathematics, Differential Equations, Mathematical Modeling, Physics, Mechanics, Probability, Experimentation, Calculus",154
https://www.coursera.org/learn/climate-change-sustainability-and-global-public-health,"Climate Change, Sustainability, and Global Public Health",University of Michigan,"7,975",4.9,Beginner level,2 weeks to complete,"Climate Change Mitigation, Sustainable Development, Environment, Public Health, Climate Change Programs, Environmental Regulations, Environmental Policy, Climate Change Adaptation, Pollution Prevention, Health Assessment, Energy and Utilities",93
https://www.coursera.org/learn/bim-fundamentals-for-engineers,BIM Fundamentals for Engineers,L&T EduTech,"11,367",4.5,Intermediate level,1 week to complete,"Electrical Systems, Facility Management, 3D Modeling, Architectural Engineering, Computer-Aided Design, Building Information Modeling, Structural Engineering, User Interface (UI), HVAC, Engineering Documentation, Technical Standard, Civil Engineering, Drafting and Engineering Design, Plumbing, Architectural Design",114
https://www.coursera.org/learn/introduction-mbse,Introduction to Model-Based Systems Engineering,Siemens,"13,217",4.1,Beginner level,2 weeks to complete,"Systems Design, Systems Engineering, Product Lifecycle Management, Systems Architecture, Cloud Computing, Requirements Analysis, Systems Analysis, Model Based Systems Engineering, Verification And Validation, System Requirements",71
https://www.coursera.org/learn/astronomy-technology,AstroTech: The Science and Technology behind Astronomical Discovery,The University of Edinburgh,"22,831",4.7,Beginner level,,"Engineering, Scientific, and Technical Instruments, Physical Science, Emerging Technologies, Data Analysis Software, Image Analysis, Technical Communication, Physics, Computational Thinking","1,184"
