url,title,partner,enroll,rating,level,duration,skills,reviews
https://www.coursera.org/learn/design-of-transmission-line-modelling-and-performance,Design of Transmission Line: Modelling and Performance,L&T EduTech,"4,646",4.7,Intermediate level,2 weeks to complete,"Environmental Engineering, Electric Power Systems, Electrical Engineering, Design, Mathematical Modeling, Simulation and Simulation Software, Applied Mathematics, High Voltage, Electrical Power, Three-Phase, Environmental Science",39
https://www.coursera.org/learn/environmental-hazards-and-global-public-health,Environmental Hazards and Global Public Health,University of Michigan,"8,941",4.8,Beginner level,2 weeks at 10 hours a week,"Environmental Policy, Community Health, Public Health, Environment, Hazardous Waste Operations And Emergency Response Standard (HAZWOPER), Occupational Health, Environment Health And Safety, Environmental Science, Pollution Prevention, Environmental Regulations, Water Quality, Radiation Protection, Demography",106
https://www.coursera.org/learn/using-rapid-prototyping-in-the-engineering-design-process,Using Rapid Prototyping in the Engineering Design Process,Arizona State University,"2,212",4.8,Beginner level,,"Prototyping, Computer-Aided Design, Technical Drawing, Engineering Drawings, Mechanical Drawings, Robotics, Engineering Design Process, Drafting and Engineering Design",29
https://www.coursera.org/learn/engineering-of-structures-tension-and-compression,Engineering of Structures: Tension and Compression,Dartmouth College,"2,385",4.7,Beginner level,1 week to complete,"Materials science, Engineering Analysis, Civil Engineering, Construction, Mechanics, Structural Engineering, Engineering Calculations",21
https://www.coursera.org/learn/solid-waste-processing-and-treatment,Solid Waste Processing and Treatment,L&T EduTech,,,Intermediate level,1 week to complete,"Thermal Management, Energy and Utilities, Chemical Engineering, Environmental Engineering, Mechanical Engineering, Process Engineering, Land Management, Environmental Regulations, Waste Minimization, Sustainable Engineering",
https://www.coursera.org/learn/digital,Fundamentals of Digital Image and Video Processing,Northwestern University,"147,696",4.6,,4 weeks to complete,"Applied Mathematics, Computer Vision, Visualization (Computer Graphics), Color Theory, Mathematical Modeling, Image Analysis, Digital Signal Processing","1,790"
https://www.coursera.org/learn/solidworks-advanced-sketching-and-reference-geometry,SOLIDWORKS Advanced Sketching and Reference Geometry,Dassault Systèmes,"3,846",4.9,Beginner level,,"Computer-Aided Design, Mechanical Engineering, Product Design",40
https://www.coursera.org/learn/air-conditioning-equipment-selection--design-and-sizing,"Air Conditioning Equipment Selection, Design and Sizing",L&T EduTech,"3,252",4.5,Intermediate level,1 week to complete,"Thermal Management, Facility Repair And Maintenance, Engineering Calculations, Plumbing, Safety Standards, Building Services Engineering, Mechanical Design, Mechanical Engineering, Equipment Design, Materials science, Energy and Utilities, Control Systems, HVAC",13
https://www.coursera.org/learn/global-warming,Global Warming I: The Science and Modeling of Climate Change,The University of Chicago,"69,912",4.6,,4 weeks to complete,"Thermal Management, Chemistry, Climate Change Adaptation, Simulations, Energy and Utilities, Climate Change Mitigation, Physical Science, Sustainable Development, Environment, Mathematical Modeling, Environmental Science, Physics",458
https://www.coursera.org/learn/como-autoconstruir-tu-vivienda,Cómo autoconstruir tu vivienda,Universidad Nacional Autónoma de México,"159,076",4.8,,1 week to complete,"Materials science, Architecture and Construction, Building Design, Construction Engineering, Civil Engineering, Construction, Plumbing, Land Development","3,360"
https://www.coursera.org/learn/user-experience-design-and-testing-part-2,User Experience Design and Testing Part 2,Northeastern University ,,,,1 week to complete,"Wireframing, White-Box Testing, Information Architecture, Usability Testing, Prototyping, User Experience Design, User Interface (UI) Design, Quality Assurance, Design Thinking, Software Testing",
https://www.coursera.org/learn/ferrous-technology-1,Ferrous Technology I,Pohang University of Science and Technology(POSTECH),"14,731",4.7,Beginner level,,"Environmental Issue, Materials science, Sustainable Engineering, Chemistry, Manufacturing and Production, Process Engineering, Manufacturing Processes, Engineering, Chemical Engineering",703
https://www.coursera.org/specializations/human-factors-and-usability-engineering-designing-for-humans,Human Factors & Usability Engineering: Designing for Humans Specialization,Arizona State University,"2,279",4.8,Intermediate level,4 weeks to complete,"Accident Prevention, Computer Displays, Control Systems, Creativity, Critical Thinking and Problem Solving, Data Collection, Decision Making, Human Centered Design, Human Computer Interaction, Human Factors, Human Factors Engineering, Human Machine Interfaces, Human Learning, Problem Solving, Research Design, Usability, Usability Testing, User Experience Design, User Interface (UI), User Research",52
https://www.coursera.org/learn/modernrobotics-course5,"Modern Robotics, Course 5:  Robot Manipulation and Wheeled Mobile Robots",Northwestern University,"11,216",4.7,Intermediate level,4 weeks to complete,"Mechanics, Machine Controls, Robotics, Applied Mathematics, Mathematical Modeling, Mechanical Engineering, Linear Algebra, Control Systems, Torque (Physics), Automation Engineering",96
https://www.coursera.org/specializations/rapid-prototyping-and-tooling,Rapid Prototyping and Tooling Specialization,Arizona State University,"1,779",4.9,Beginner level,4 weeks to complete,"3D Modeling, Basic Electrical Systems, Computer-Aided Design, Drafting and Engineering Design, Electrical Engineering, Electrical Systems, Electrical Wiring, Electronic Components, Electronic Hardware, Electronics, Engineering Design Process, Engineering Drawings, Manufacturing and Production, Manufacturing Processes, Materials science, Mechanical Drawings, Mechanical Engineering, Prototyping, Robotics, Technical Drawing",54
https://www.coursera.org/learn/construction-management-field-operations--admin-tools,Construction Management Field Operations and Admin Tools,"University of Maryland, College Park","1,506",,Intermediate level,,"Contract Management, Project Documentation, Project Planning, Timelines, Scheduling, Construction Management, Safety Assurance, Change Control, Communication Planning, Project Coordination, Arbitration, Construction Estimating, Project Schedules, Occupational Safety And Health, Project Controls, Cost Control",
https://www.coursera.org/learn/user-experience-design-and-testing-part-1,User Experience Design and Testing Part 1,Northeastern University ,,,,2 weeks to complete,"Storyboarding, UI/UX Strategy, Usability, Design Strategies",
https://www.coursera.org/learn/wood-science,Wood Science: Beyond Building,West Virginia University,"24,414",4.6,Beginner level,1 week at 10 hours a week,"Materials science, Environment and Resource Management, Sustainable Engineering, Environmental Science, Sustainable Development, Product Knowledge, Supply And Demand, Climate Change Mitigation, Natural Resource Management, Construction, Economics, Environmental Resource Management",785
https://www.coursera.org/specializations/highway-planning-pavement-design-and-construction,"Highway Planning, Pavement Design and Construction Specialization",L&T EduTech,,4.7,Advanced level,4 weeks to complete,"Building Codes, Civil and Architectural Engineering, Civil Engineering, Construction, Construction Engineering, Construction Inspection, Construction Management, Engineering Design Process, Engineering Plans And Specifications, Engineering Practices, Engineering Software, Hydraulics, Hydrology, Laboratory Testing, Materials science, Plant Operations and Management, Stormwater Management, Structural Analysis, Structural Engineering, Traffic Flow Optimization",13
https://www.coursera.org/specializations/climate-change-leadership-community-resilience,Climate Change Leadership for Community Resilience   Specialization,Duke University,,4.9,Beginner level,12 weeks to complete,"Climate Change Adaptation, Climate Change Programs, Collaboration, Community Development, Community Organizing, Community Outreach, Data Collection, Environment and Resource Management, Environmental Policy, Environmental Science, Ethical Standards And Conduct, Governance, Innovation, Leadership, Personal Development, Professional Development, Social Impact, Sustainable Development, Sustainable Systems, Visionary",26
https://www.coursera.org/learn/fire-and-explosion-hazards-analysis,Fire and Explosion Hazards Analysis,"University of California, Davis","3,065",4.8,Intermediate level,,"Hazard Analysis, Failure Analysis, Chemical Engineering, Risk Management Framework, Estimation, Engineering Analysis, Incident Management, Safety and Security, Engineering Calculations",50
https://www.coursera.org/learn/environmental-science,Environmental Science,Dartmouth College,"22,274",4.7,Beginner level,3 weeks at 10 hours a week,"Systems Thinking, Biology, Sustainable Development, Environmental Issue, Environmental Science, Hydrology, Chemistry, Water Quality, Environment, Physics, Energy and Utilities, Water Resource Management, Climate Change Mitigation",343
https://www.coursera.org/learn/climate-change-carbon-capture-and-storage-chinese,Climate Change: Carbon Capture and Storage (Chinese),The University of Edinburgh,,,Beginner level,4 weeks to complete,"Sustainable Development, Chemical Engineering, Environmental Policy, Research, Scientific Methods, Energy and Utilities, Climate Change Mitigation, Environmental Science, Economics, Policy, and Social Studies, Sustainable Technologies, Environmental Engineering",
https://www.coursera.org/specializations/statistical-thermodynamics-engineering,Statistical Thermodynamics Specialization,University of Colorado Boulder,"15,026",4.5,Advanced level,4 weeks to complete,"Applied Mathematics, Chemical Engineering, Chemistry, Differential Equations, Engineering, Engineering Analysis, Engineering Calculations, Materials science, Mathematical Modeling, Mechanical Engineering, Numerical Analysis, Open Source Technology, Physical Science, Physics, Probability Distribution, Process Engineering, Simulation and Simulation Software, Simulations, Statistical Methods, Thermal Management","1,079"
https://www.coursera.org/learn/knowing-the-universe,Knowing the Universe: History and Philosophy of Astronomy,University of Arizona,"6,797",4.7,Beginner level,3 weeks to complete,"Mechanics, Scientific Methods, Science and Research, World History, Chemistry, Biology, Physics, Research, Physical Science, Ancient History",43
https://www.coursera.org/learn/oscillators-waves,Physics of Oscillators and Waves,Rice University,"3,774",4.8,Intermediate level,2 weeks to complete,"Problem Solving, Advanced Mathematics, Mechanics, Applied Mathematics, Physics, Differential Equations, Vibrations, Calculus, Trigonometry",17
https://www.coursera.org/specializations/semiconductor-devices,Semiconductor Devices Specialization,University of Colorado Boulder,"20,228",4.4,Advanced level,4 weeks to complete,"Applied Mathematics, Electrical and Computer Engineering, Electrical Engineering, Electronic Components, Electronic Hardware, Electronic Systems, Electronics, Electronics Engineering, Materials science, Mathematical Modeling, Physics, Semiconductors",617
https://www.coursera.org/learn/communications-and-high-speed-signals-with-raspberry-pi,Communications and High-Speed Signals with Raspberry Pi,Johns Hopkins University,"2,249",4.9,,1 week to complete,"Digital Communications, Electronics, Hardware Design, Failure Analysis, Telecommunications, Estimation, Network Analysis, Basic Electrical Systems, Simulation and Simulation Software, Digital Signal Processing, Communication Systems, Electrical Engineering, Engineering Analysis, Serial Peripheral Interface, Electronic Systems, Electronic Components",14
https://www.coursera.org/learn/avionics-aircraft-systems-fundamentals,Avionics and Aircraft Systems: Fundamentals,Coursera,"5,362",4.7,Beginner level,,"Test Equipment, Electrical Systems, Basic Electrical Systems, Analysis, Electronic Systems, Engineering, Global Positioning Systems, Operations, Communication Systems, Maintenance, Repair, and Facility Services, Control Systems, Safety Assurance, Display Devices, System Monitoring, Electronic Components, Electronics",76
https://www.coursera.org/specializations/algorithms-for-battery-management-systems,Algorithms for Battery Management Systems Specialization,University of Colorado System,"28,498",4.7,Intermediate level,3 months to complete,"Basic Electrical Systems, Control Systems, Electrical Engineering, Electrical Power, Electrical Safety, Electrical Systems, Electronic Components, Electronic Systems, Engineering Calculations, Estimation, High Voltage, Machine Learning Methods, Mathematical Modeling, Model Evaluation, Power Electronics, Probability, Safety Standards, Simulation and Simulation Software, Simulations, Thermal Management","2,575"
https://www.coursera.org/learn/xdesign-assemblies-and-exam-level-part-modeling,xDesign Assemblies and Exam Level Part Modeling,Dassault Systèmes,,5.0,Beginner level,1 week to complete,"Computer-Aided Design, Assembly Drawing, Mechanical Design, 3D Modeling, Mechanical Engineering, Engineering Design Process",10
https://www.coursera.org/learn/from-wellhead-to-refinery-midstream-oil-and-gas-processing,From Wellhead to Refinery: Midstream Oil and Gas Processing,L&T EduTech,"3,976",4.5,Beginner level,,"Three-Phase, Process Engineering, Oil and Gas, Environmental Engineering, Environmental Regulations, Thermal Management, Pump Stations, Equipment Design, Production Process, Chemical Engineering, Water Quality, Petroleum Industry, Hydraulics",28
https://www.coursera.org/learn/fisica-dimension-movimiento,Física: Dimensión y Movimiento,Tecnológico de Monterrey,"17,637",4.6,,1 week to complete,"Systems Of Measurement, Derivatives, Algebra, Mathematical Modeling, Graphing, Arithmetic, Scientific Methods, Applied Mathematics, Integral Calculus, Physics, Mechanics, Calculus",210
https://www.coursera.org/learn/material-informatics,Materials Data Sciences and Informatics,Georgia Institute of Technology,"19,396",4.5,Intermediate level,Machine learning part and its application to material science was interesting but informative contents like material dev eco system and whole week 1 was more informative than logical,"Data Integration, Data Science, Big Data, Structural Analysis, Materials science, Data Mining, Statistics, Data-Driven Decision-Making, Informatics, Data Processing, Systems Design",351
https://www.coursera.org/learn/design-and-detailing-of-rcc-elements,Design and Detailing of RCC elements,L&T EduTech,"2,225",4.7,Intermediate level,1 week to complete,"Building Codes, Structural Analysis, Structural Engineering, Civil Engineering, Engineering Calculations, Engineering Documentation, Construction Engineering, Construction Estimating, Engineering Drawings, Engineering Practices",14
https://www.coursera.org/learn/first-order-optical-system-design,First Order Optical System Design,University of Colorado Boulder,"24,552",4.3,Advanced level,2 weeks at 10 hours a week,"Performance Tuning, Engineering Analysis, Engineering, Scientific, and Technical Instruments, Computer-Aided Design, Engineering Calculations, Physics, Engineering Design Process, System Configuration, Simulation and Simulation Software",341
https://www.coursera.org/learn/rapid-prototyping-materials-and-tooling,Rapid Prototyping Materials and Tooling,Arizona State University,,5.0,Beginner level,,"Mechanical Engineering, Safety Training, Manufacturing and Production, Prototyping, Personal protective equipment, 3D Modeling, Materials science, Manufacturing Processes",22
https://www.coursera.org/learn/future-of-energy,Our Energy Future,University of California San Diego,"71,143",4.7,,4 weeks to complete,"Climate Change Mitigation, Sustainable Technologies, Environmental Science, Environment, Pollution Prevention, Chemical Engineering, Biological Engineering, Energy and Utilities, Electrical Power, Environmental Policy, Economics, Oil and Gas, Socioeconomics, Sustainable Development","1,176"
https://www.coursera.org/learn/quantum-optics-two-photons,Quantum Optics 2 - Two photons and more,École Polytechnique,"8,808",4.9,,1 week to complete,"Cryptography, Emerging Technologies, Mathematical Modeling, Algorithms, Communication Systems, Computing Platforms, Physics, Telecommunications, Simulations",130
https://www.coursera.org/specializations/aerospace,Digitalisation in Aeronautics and Space Specialization,Technical University of Munich (TUM),"10,271",4.7,Intermediate level,4 weeks to complete,"Aerospace Basic Quality System Standards, Automation, Communication Systems, Control Systems, Cybersecurity, Digital Transformation, Engineering Analysis, Environmental Monitoring, Global Positioning Systems, Human Factors, Human Machine Interfaces, Image Analysis, Industrial Engineering, Leadership, Manufacturing and Production, Manufacturing Processes, Mathematical Modeling, Production Process, Robotics, Structural Engineering",497
https://www.coursera.org/learn/real-time-embedded-theory-analysis,Real-Time Embedded Systems Theory and Analysis,University of Colorado Boulder,"6,827",4.3,Advanced level,6 weeks at 10 hours a week,"Performance Tuning, Algorithms, OS Process Management, Debugging, System Programming, Theoretical Computer Science, Verification And Validation, System Design and Implementation, Embedded Systems, Software Design",20
https://www.coursera.org/learn/sustainability-challenges-for-planet-and-employers,Sustainability Challenges for the Planet and Employers,Arizona State University,"1,974",4.5,Beginner level,1 week to complete,"Sustainable Development, Sustainable Technologies, Business Communication, Sustainability Reporting, Sustainability Standards, Corporate Sustainability, Climate Change Adaptation, Professional Development, Environmental Engineering, Interactive Learning, Sustainable Business, Training Programs, Key Performance Indicators (KPIs), Waste Minimization, Problem Solving, Sustainable Architecture, Student Engagement, Environmental Issue, Construction, Goal Setting",25
https://www.coursera.org/learn/dinosaurs,"Dinosaurs: Evolution, Extinction, and Paleobiology",American Museum of Natural History,"3,101",4.9,Beginner level,,"Timelines, Research Methodologies, Science and Research, Life Sciences, Laboratory Experience, Laboratory Research, Scientific Methods, Biology, Environmental Science, Estimation, Scientific Visualization, Research, Environment, Taxonomy",68
https://www.coursera.org/learn/battery-pack-balancing-power-estimation,Battery Pack Balancing and Power Estimation,University of Colorado Boulder,"12,731",4.9,Intermediate level,2 weeks at 10 hours a week,"Applied Mathematics, Algorithms, Engineering Calculations, Electronic Components, Mathematical Modeling, Electrical Power, Electrical Engineering, Simulations, Estimation, Electronic Systems, Model Evaluation, Control Systems, Power Electronics",105
https://www.coursera.org/specializations/flight-mechanics-fundamentals,Fundamentals of Flight mechanics Specialization,ISAE-SUPAERO,"12,623",4.7,Beginner level,4 weeks to complete,"Applied Mathematics, Control Systems, Energy and Utilities, Engineering, Engineering Analysis, Engineering Calculations, Hazard Analysis, Mathematical Modeling, Mechanics, Physical Science, Physics, Risk Control, Simulations, Systems Of Measurement, Thermal Management, Vibrations",595
https://www.coursera.org/learn/primary-and-secondary-batteries,Primary and Secondary Batteries,Arizona State University,"10,381",4.7,Beginner level,,"Sustainable Technologies, Manufacturing and Production, Electrical Power, Electrical Systems, Chemistry, Engineering Calculations, Performance Testing, Energy and Utilities, Technical Standard, System Requirements",125
https://www.coursera.org/learn/electrodynamics-analysis-of-electric-fields,Electrodynamics: Analysis of Electric Fields,Korea Advanced Institute of Science and Technology(KAIST),"10,775",4.8,Advanced level,1 week to complete,"Scientific Visualization, Engineering Analysis, Applied Mathematics, Engineering Calculations, Electrical Engineering, Differential Equations, Mathematical Modeling, Calculus, Visualization (Computer Graphics), Materials science, Energy and Utilities, Physics",171
https://www.coursera.org/learn/applied-sustainability-engineering,Applied Sustainability Engineering,University of Colorado Boulder,"3,482",4.5,Intermediate level,2 weeks at 10 hours a week,"Sustainable Development, Climate Change Mitigation, Product Lifecycle Management, Product Design, Strategic Leadership, Environmental Management Systems, Product Engineering, Packaging and Labeling, Sustainable Technologies, Sustainable Engineering, Environmental Engineering, Waste Minimization, Sustainable Design",53
https://www.coursera.org/learn/xdesign-feature-patterns-and-sweeps,xDesign Feature Patterns and Sweeps,Dassault Systèmes,,,Beginner level,,"Technical Design, Computer-Aided Design, 3D Modeling",
https://www.coursera.org/specializations/question-reality-science-philosophy,"Question Reality! Science, philosophy, a search for meaning Specialization",Dartmouth College,"2,270",4.7,Beginner level,4 weeks to complete,"Ancient History, Artificial Intelligence, Chemistry, Computational Logic, Computational Thinking, Experimentation, Mathematics and Mathematical Modeling, General Science and Research, Laboratory Equipment, Laboratory Experience, Logical Reasoning, Mechanics, Physical Science, Physics, Psychology, Science and Research, Scientific Methods, Simulations, Theoretical Computer Science, Vibrations",40
https://www.coursera.org/learn/interface-with-arduino,Interfacing with the Arduino,"University of California, Irvine","128,564",4.7,,1 week to complete,"Interactive Learning, Automation Engineering, Embedded Systems, Electrical Wiring, Human Machine Interfaces, Programming Principles, Wireless Networks, Internet Of Things, Electronics, Peripheral Devices, Computer Programming, Basic Electrical Systems, Remote Access Systems, Electronic Components, Systems Engineering, Computer Systems, Electrical and Computer Engineering, Control Systems, Hardware Design, Electronic Hardware","3,958"
https://www.coursera.org/learn/basics-of-fire-protection-detection-and-life-safety-systems,"Basics of Fire Protection, Detection and Life Safety Systems",L&T EduTech,"5,857",4.6,Intermediate level,,"Building Codes, Electrical Systems, Safety Standards, Construction Inspection, Facility Management and Maintenance, Construction, Systems Integration, HVAC, Hazard Analysis, Hydraulics, Safety Assurance, Control Systems, Safety Training, Building Design, Building Services Engineering, Design Specifications",67
https://www.coursera.org/learn/fundamentals-waves-vibrations,Fundamentals of waves and vibrations,École Polytechnique,"18,168",4.5,Intermediate level,,"Structural Analysis, Mechanical Engineering, Civil Engineering, Engineering Analysis, Vibrations, Mechanics, Mathematical Modeling",203
https://www.coursera.org/learn/agroforestry4,"Agroforestry IV: Climate, Carbon Storage and Agroforestry",University of Florida,"2,935",4.5,Intermediate level,,"Natural Resource Management, Research Methodologies, Biology, Water Resource Management, Sustainable Development, Climate Change Adaptation, Environment and Resource Management, Climate Change Mitigation, Land Management, Spatial Analysis, Environmental Science",21
https://www.coursera.org/learn/asme-b31-series-and-pipeline-construction,ASME B31 Series and Pipeline Construction,L&T EduTech,"3,721",4.4,Intermediate level,,"Mechanical Engineering, Engineering Documentation, Design Specifications, Oil and Gas, Construction, Materials science, Energy and Utilities, Safety Standards, Petroleum Industry, Plumbing, Facility Repair And Maintenance, Mechanical Design, Building Codes, Construction Management, Manufacturing Standards, Engineering Design Process, Civil Engineering, Construction Engineering",37
https://www.coursera.org/learn/human-health-risks-health-equity-and-environmental-justice,"Human Health Risks, Health Equity, and Environmental Justice",University of Michigan,"3,794",4.9,Beginner level,2 weeks to complete,"Mitigation, Public Health, Environmental Policy, Social Justice, Health Equity, Policy Development, Health Disparities, Health Assessment, Social Determinants Of Health, Environmental Issue, Risk Management, Risk Analysis",24
https://www.coursera.org/learn/internet-of-things-cloud-services-version2,Internet of Things V2: Setting up and Using Cloud Services,University of California San Diego,"16,386",4.6,,1 week to complete,"Cloud Computing Architecture, Cloud Infrastructure, Linux Administration, Cloud Development, Embedded Systems, Machine Learning, Internet Of Things, Cloud Computing, Cloud Services, Software Installation",42
https://www.coursera.org/learn/dense-gases-liquids-solids,"Dense Gases, Liquids and Solids",University of Colorado Boulder,"5,722",4.5,Advanced level,,"Materials science, Thermal Management, Simulations, Calculus, Engineering Calculations, Estimation, Mechanical Engineering, Mathematical Modeling, Engineering Analysis, Physics, Chemical Engineering",116
https://www.coursera.org/learn/understanding-modern-physics-1-relativity-and-cosmology,Understanding Modern Physics I: Relativity and Cosmology,The Hong Kong University of Science and Technology,"21,383",4.6,Beginner level,1 week to complete,"Physics, Calculus, Mechanics, Thermal Management, Advanced Mathematics, Mathematical Modeling",172
