url,title,partner,enroll,rating,level,duration,skills,reviews
https://www.coursera.org/learn/do-good-feel-good,The Science of Generosity: Do Good...Feel Good,University of Pennsylvania,"2,593",4.3,Beginner level,2 weeks to complete,"Self-Awareness, Philanthropy, Positivity, Cultural Diversity, Empathy, Social Impact, Compassion, Decision Making, Goal Setting, Planning, Cultural Sensitivity, Culture",14
https://www.coursera.org/learn/digitalcreativity,Digital Creativity,Arizona State University,"3,482",4.8,,,"Creativity, Diversity Awareness, Research, Intellectual Property, Electronic Media, Content Creation, Digital Design, Multimedia, digital literacy, Regulation and Legal Compliance, Web Content, Storytelling",18
https://www.coursera.org/learn/finding-purpose-and-meaning-in-life,Finding Purpose and Meaning In Life: Living for What Matters Most,University of Michigan,"284,072",4.8,Beginner level,,"Personal Development, Goal Setting, Mindfulness, Self-Awareness, Decision Making, Stress Management, Mental Health, Lifelong Learning","2,957"
https://www.coursera.org/learn/advanced-information-literacy,Advanced Information Literacy,The State University of New York,"2,685",,Intermediate level,2 weeks to complete,"Content Management, Constructive Feedback, Literacy, Critical Thinking, Lifelong Learning, Reliability, Data Access, digital literacy, Information Management, Intellectual Property, Investigation, Planning, Communication, Style Guides",
https://www.coursera.org/learn/horizontal-feedback,Feedback Loops: Horizontal Feedback,University of Michigan,,,Beginner level,1 week to complete,"Relationship Building, Independent Thinking, Cognitive flexibility, Teamwork, Rapport Building, Diversity and Inclusion, Communication, Cooperation, Constructive Feedback, Emotional Intelligence, Collaboration, Empathy",
https://www.coursera.org/learn/offtheclock,Off the Clock: The Many Faces of Time,Universidade de São Paulo,"2,892",4.7,Beginner level,,"Environmental Science, Biology, Psychology, Timelines, Anthropology, Cultural Diversity, Physics, Liberal Arts",18
https://www.coursera.org/specializations/sfi-leader-of-learning-experiences,Leader of Learning Experiences Specialization,Intel,,,Beginner level,4 weeks to complete,"Artificial Intelligence, Classroom Management, Collaboration, Community Development, Creative Thinking, digital literacy, Digital pedagogy, Education Software and Technology, Innovation, Instructional Design, Instructional Strategies, Learning Strategies, Lesson Planning, Pedagogy, Student-Centred Learning, Student Engagement, Teamwork, Telecommuting, Virtual Environment",
https://www.coursera.org/learn/speaking-and-presenting-tact,Speaking and Presenting: Tact,University of Michigan,"5,651",4.5,Beginner level,1 week to complete,"Communication, Tactfulness, Public Speaking, Empathy, Communication Strategies, Professionalism, Interpersonal Communications, Social Skills, Verbal Communication Skills, Storytelling",44
https://www.coursera.org/learn/establishing-effective-educator-machine-partnerships,Establishing Effective Educator-Machine Partnerships,Intel,,,Beginner level,1 week to complete,"Professional Development, Education Software and Technology, Digital pedagogy, Goal Setting, Innovation, Adult Education, Technology Strategies, Creative Thinking",
https://www.coursera.org/learn/preparing-for-and-passing-technical-certifications,Preparing for and Passing Technical Certifications,ROI Training,"2,693",4.8,Beginner level,,"Technical Documentation, Requirements Analysis, Test Planning, Learning Strategies, Learning Styles",56
https://www.coursera.org/learn/competencias-digitales-herramientas-basicas,Competencias digitales. Conceptos y herramientas básicas,Universitat Autònoma de Barcelona,"31,242",4.7,Beginner level,1 week at 10 hours a week,"digital literacy, Computer Hardware, Email Security, Computer Security Awareness Training, File Management, Information Technology, Computer Literacy, Data Security, Computer Networking, Safety and Security",737
https://www.coursera.org/learn/customer-service-excellence,التميز في خدمة وإسعاد المتعاملين,Alfaisal University | KLD,"5,285",4.9,Beginner level,,"Telephone Skills, Customer experience improvement, Customer Service, Communication, Customer Analysis, Verbal Communication Skills, Non-Verbal Communication, Customer Complaint Resolution, Customer Relationship Building, Active Listening",168
https://www.coursera.org/learn/packt-chatgpt-for-teachers-in-education-fwvha,ChatGPT for Teachers in Education,Packt,,,Intermediate level,,"Student Engagement, digital literacy, Instructional Strategies, Digital pedagogy",
https://www.coursera.org/specializations/zhichang,职场修炼：学习、创新、协作与自我实现 Specialization,University of Science and Technology of China,,4.3,Beginner level,4 weeks to complete,"Adaptability, Adult Education, Brainstorming, Collaboration, Creative Problem-Solving, Creative Thinking, Innovation, Knowledge Transfer, Learning Strategies, Lifelong Learning, Open Mindset, Operational Efficiency, Personal Development, Problem Solving, Productivity, Quick Learning, Resourcefulness, Time Management, Willingness To Learn, Workflow Management",130
https://www.coursera.org/learn/google-manage-your-job-applications-with-ai,Manage Your Job Applications with AI,Google,"3,708",4.8,Beginner level,,AI Enablement,24
https://www.coursera.org/learn/growing-your-influence,Growing your Influence,Coursera,"2,156",4.5,Intermediate level,,"Influencing, Adaptability, Thought Leadership, Personal Development, Social Media Strategy, Leadership, Lifelong Learning, Growth Mindedness, Professional Development, Communication, Branding, Professional Networking, Self-Awareness, Emotional Intelligence",34
https://www.coursera.org/learn/boas-praticas-cientificas,Boas Práticas Científicas,Universidade de São Paulo,,4.9,Intermediate level,,"Data Ethics, Clinical Research Ethics, Research Design, General Science and Research, Experimentation, Science and Research",43
https://www.coursera.org/learn/talk-consent,Let's Talk Consent,Tinder,"2,057",4.9,Beginner level,,"Verbal Communication Skills, Safety and Security, Ethical Standards And Conduct, Recognizing Others, Empathy, Interpersonal Communications, Non-Verbal Communication, Assertiveness, Informed Consent, Communication, Relationship Building",27
https://www.coursera.org/learn/empathic-ai-communication-and-analysis,Empathic AI Communication and Analysis,Coursera,,,Beginner level,,"Customer Support, De-escalation Techniques, Interpersonal Communications, Customer experience improvement, Empathy & Emotional Intelligence, Quality Assessment, Organizational Effectiveness, Active Listening, Responsible AI, Customer Complaint Resolution, Artificial Intelligence, Empathy, Business Communication, Natural Language Processing, Customer and Client Support, Communication",
https://www.coursera.org/learn/effective-time-management-lo097003,Effective Time Management,Logical Operations,,,,,"Productivity, Strategic Prioritization, Planning, Goal Setting, Time Management, Delegation Skills, Scheduling, Goal-Oriented, Benchmarking, Multitasking, Personal Development, Decision Making, Organizational Skills, Resource Allocation, Negotiation, Prioritization, Self-Awareness",
https://www.coursera.org/learn/presentation-skills-,مهارات العرض والتقديم | Presentation Skills,Alfaisal University | KLD,"6,756",4.8,Beginner level,,"Verbal Communication Skills, Target Audience, Presentations, Public Speaking, Communication, Persuasive Communication, Non-Verbal Communication, Social Skills",162
https://www.coursera.org/learn/how-to-series-on-personal-development-topics,How to Series on Personal Development Topics,Coursera,"2,306",4.8,Beginner level,,"Accountability, Self-Awareness, Courage, Emotional Intelligence, Lifelong Learning, Open Mindset, Willingness To Learn, Goal Setting, Empowerment, Personal Development, Assertiveness, Growth Mindedness, Resilience",20
https://www.coursera.org/learn/creativethinking,Creative Thinking,Arizona State University,"1,684",,Beginner level,,"Innovation, Strategic Thinking, Brainstorming, Resourcefulness, Creativity, Decision Making, Collaboration, Curiosity, Creative Problem-Solving, Creative Thinking",
https://www.coursera.org/learn/warrior-scholar-the-veterans-college-success-kit,Warrior-Scholar: The Veteran’s College Success Kit,Yale University,,,Beginner level,1 week to complete,"Decision Making, Goal Setting",
https://www.coursera.org/learn/mindfulness-at-work,Mindfulness at Work: Enhancing Focus and Well-Being,Board Infinity ,,,Beginner level,2 weeks to complete,"Stress Management, Resilience, Professional Development, Organizational Development, Mindfulness, Mental Concentration, Self-Awareness, Emotional Intelligence, Personal Development, Productivity, Leadership Studies, Communication, Collaboration",
https://www.coursera.org/learn/the-art-and-science-of-self-leadership,The Art and Science of Self Leadership,S.P. Jain Institute of Management and Research,,4.8,Beginner level,2 weeks to complete,"Professional Development, Collaboration, Conflict Management, Interpersonal Communications, Communication, Self-Awareness, Empathy, Personal Development, Adaptability, Leadership, Emotional Intelligence, Visionary",10
https://www.coursera.org/learn/modern-meditation-discover-your-potential-power--purpose,"Modern Meditation: Discover Your Potential, Power & Purpose",Skillshare,,,Beginner level,,"Growth Mindedness, Mindfulness, Courage, Goal Setting, Creative Thinking, Resilience, Self-Motivation, Action Oriented, Persistence, Visionary, Journals, Personal Development, Empowerment, Positivity, Self-Awareness",
https://www.coursera.org/learn/less-stress-better-health,"Less Stress, Better Health",American Psychological Association,"2,328",4.9,Beginner level,1 week to complete,"Resilience, Cognitive Behavioral Therapy, Stress Management, Psychology, Social Skills, Self-Awareness, Mental Health Diseases and Disorders, Physiology, Mental Health, Emotional Intelligence, Scientific Methods, Mindfulness",10
https://www.coursera.org/learn/writing-editing-structure,Writing and Editing: Structure and Organization,University of Michigan,"40,050",4.7,Beginner level,2 weeks at 10 hours a week,"Editing, Productivity, Organizational Skills, Concision, Content Creation, Time Management, Writing and Editing, Critical Thinking, Lifelong Learning, Writing, Storytelling, Creativity, Professional Development, Communication Strategies",569
https://www.coursera.org/learn/jobdemand-essentialskills-dementia,"Job Demand, Essential Technical Skills, & Dementia Care",Cinematic Health,,,Beginner level,,"Nursing Care, Chronic Diseases, Basic Patient Care, Patient-centered Care, Long Term Care, Dignity in Care, Cultural Sensitivity, Hand Hygiene, Caregiving, Patient Education And Counseling, Respiratory Care, Patient Communication, Infection Control, Geriatrics, Hospice, Nutrition and Diet, Patient Observation, Patient Safety, Pulmonology, Care Management",
https://www.coursera.org/learn/creative-problem-solving-,حل المشكلات بطريقة إبداعية | Creative Problem Solving,Alfaisal University | KLD,"7,558",4.8,Beginner level,,"Analysis, Root Cause Analysis, Critical Thinking and Problem Solving, Problem Solving, Creativity, Creative Problem-Solving",214
https://www.coursera.org/learn/empoderate-y-cree-en-ti-mismo,Empodérate y cree en ti mismo,UBITS,,4.6,Intermediate level,,"Overcoming Obstacles, Self-Awareness, Empowerment, Positivity, Growth Mindedness, Self-Discipline, Self-Motivation, Goal Setting, Resilience, Adaptability, Personal Development, Persistence",14
https://www.coursera.org/specializations/conflictmanagementforeveryone,Conflict Management For Everyone  Specialization,Arizona State University,"2,229",4.5,Beginner level,4 weeks to complete,"Active Listening, Brainstorming, Collaboration, Communication, Communication Strategies, Composure, Conflict Management, Contingency Planning, De-escalation Techniques, Emotional Intelligence, Empathy, Expectation Management, Follow Through, Interpersonal Communications, Interviewing Skills, Negotiation, Problem Solving, Tactfulness, Teamwork, Verbal Communication Skills",72
https://www.coursera.org/learn/sfi-intro-to-learning-remotely,Introduction to Learning Remotely,Intel,,,Beginner level,1 week to complete,"Telecommuting, Driving engagement, Organizational Skills, Stress Management, Communication, Education Software and Technology, Digital pedagogy, Active Listening, Relationship Building, Student Engagement, Collaboration, Instructional Design, Virtual Environment, Emotional Intelligence, Empathy",
https://www.coursera.org/learn/how-self-motivation-shapes-personal-success,How Self-Motivation Shapes Personal Success,University of Colorado System,"1,519",,Beginner level,2 weeks to complete,"Mindfulness, Curiosity, Goal Setting, Self-Awareness, Smart Goals, Emotional Intelligence, Self-Motivation, Creativity, Resilience, Adaptability, Courage, Innovation, Willingness To Learn, Personal Development, Overcoming Obstacles, Growth Mindedness, Productivity, Lifelong Learning",
https://www.coursera.org/learn/aprender,Aprendendo a aprender: ferramentas mentais poderosas para ajudá-lo a dominar assuntos difíceis (em Português) [Learning How to Learn],Deep Teaching Solutions,"227,003",4.9,Beginner level,2 weeks at 10 hours a week,"Time Management, Problem Solving, Planning, Persistence, Mental Concentration, Creative Thinking, Learning Strategies, Willingness To Learn, Stress Management, Cognitive flexibility, Productivity, Lifelong Learning, Overcoming Obstacles","4,168"
https://www.coursera.org/learn/human-needs,The Arts and Science of Relationships: Understanding Human Needs,University of Toronto,"251,775",4.5,Beginner level,3 weeks at 10 hours a week,"Psychology, Communication, Relationship Building, Assertiveness, Cultural Diversity, Empathy, Active Listening, Emotional Intelligence, Needs Assessment, Self-Awareness, Interpersonal Communications, Social Skills","1,827"
https://www.coursera.org/learn/sleepdeprivation,"Sleep Deprivation: Habits, Solutions, and Strategies Teach-Out",University of Michigan,"19,650",4.6,Beginner level,,"Health Care, Social Impact, Mental Health, Health Promotion, Cultural Diversity, Health Technology, Productivity, Public Health, Biology, Stress Management, Physiology, Community Health",56
https://www.coursera.org/learn/reflective-thinking-skills,مهارات التفكير التأملي | Reflective Thinking Skills,Alfaisal University | KLD,"8,855",4.9,Beginner level,,"Creative Thinking, Personal Development, Self-Awareness, Professional Development, Decision Making, Problem Solving, Lifelong Learning, Open Mindset, Critical Thinking","1,092"
https://www.coursera.org/learn/managing-debt,Managing Debt,SoFi,"5,837",4.7,Beginner level,,"Budget Management, Financial Analysis, Goal Setting, Financial Planning, Mortgage Loans, Consumer Lending, Loans, Credit Risk, Cost Benefit Analysis, Consolidation",28
https://www.coursera.org/learn/delega-tareas-sin-sentir-que-pierdes-el-control,Delega tareas sin sentir que pierdes el control,UBITS,,,Advanced level,,"Team Management, Leadership, Performance Analysis, Delegation Skills, Strategic Leadership, Organizational Leadership, Prioritization, Verification And Validation, Trustworthiness, Productivity, Team Leadership, Employee Training, Organizational Effectiveness, Empowerment, Team Building",
https://www.coursera.org/learn/leading-oneself-with-self-knowledge,Leading Oneself with Self-Knowledge,University of Colorado Boulder,"7,121",4.8,Beginner level,4 weeks at 10 hours a week,"Time Management, Cognitive flexibility, Personal Development, Engineering Management, Adaptability, Self-Awareness, Psychology, Decision Making, Leadership, Critical Thinking, Emotional Intelligence",73
https://www.coursera.org/learn/communicatingyourbestself,Communicating Your Best Self,Arizona State University,"10,299",4.4,Beginner level,,"Public Speaking, Interpersonal Communications, Business Communication, Virtual Teams, Communication, Verbal Communication Skills, Business Correspondence, Self-Awareness, Adaptability, Writing, Non-Verbal Communication, Strategic Communication",88
https://www.coursera.org/learn/present-with-purpose,Present with Purpose: Create/Deliver Effective Presentations,IBM,"49,441",4.6,Beginner level,,"Verbal Communication Skills, Communication, Non-Verbal Communication, Public Speaking, Goal Setting, Composure, Target Audience, Persuasive Communication, Presentations, Storytelling",416
https://www.coursera.org/learn/military-transition,Making Your Military Transition a Transformation,USO,"2,889",4.3,Beginner level,3 weeks to complete,"Planning, Decision Making, Goal Setting, Interviewing Skills, Resilience, Community Development, Professional Development, Professional Networking, Adaptability, Personal Development, Self-Awareness, Communication Strategies, Entrepreneurship",17
https://www.coursera.org/learn/managingconflict,Managing Conflict,Arizona State University,"2,153",4.5,Beginner level,,"Communication Strategies, De-escalation Techniques, Interpersonal Communications, Self-Awareness, Active Listening, Conflict Management, Empathy, Tactfulness, Composure, Verbal Communication Skills, Emotional Intelligence, Communication",22
https://www.coursera.org/learn/fandom-social-media-authenticity-digital-age,"Fandom, Social Media, and Authenticity in the Digital Age",University of Colorado Boulder,"3,360",4.6,Beginner level,2 weeks to complete,"Content Creation, Electronic Media, Social Sciences, Personal Development, Critical Thinking, Blogs, Writing, Social Media, Media and Communications, Culture, Literacy, digital literacy, Diversity Awareness, Analysis, Sociology, Self-Awareness, Instagram, Case Studies, Social Studies, Cultural Responsiveness",13
https://www.coursera.org/learn/nlp-,البرمجة اللغوية العصبية | NLP,Alfaisal University | KLD,"4,177",4.7,Beginner level,,"Communication, Persuasive Communication, Rapport Building, Active Listening, Relationship Building, Self-Awareness, Personal Development, Interpersonal Communications, Emotional Intelligence, Social Skills",59
https://www.coursera.org/learn/personal-change-management-skills,مهارات إدارة التغيير الذاتي,Alfaisal University | KLD,"5,513",4.9,Beginner level,,"Cognitive flexibility, Adaptability, Personal Development, Growth Mindedness, Stress Management, Self-Awareness, Change Management, Overcoming Obstacles",197
https://www.coursera.org/learn/a-blueprint-for-success-your-video-pre-production,A Blueprint for Success – Your Video Pre-Production,University of Colorado Boulder,"25,967",4.5,Beginner level,1 week at 10 hours a week,"Cinematography, Storyboarding, Editing, Video Editing, Video Production, Storytelling, Writing, Videography",77
https://www.coursera.org/specializations/workplacecultureforeveryone,Workplace Culture for Everyone Specialization,Arizona State University,"1,588",4.6,Beginner level,4 weeks to complete,"Accountability, Compassion, Conflict Management, Decision Making, Digital Communications, digital literacy, Emotional Intelligence, Empathy, Empathy & Emotional Intelligence, Independent Thinking, Influencing, Initiative and Leadership, Interpersonal Communications, Leadership, Media and Communications, Open Mindset, Self-Awareness, Social Skills, Team Building, Team Leadership",123
https://www.coursera.org/learn/how-to-network,How to Network: Leading Yourself to Lead Others,University of Michigan,"9,800",4.6,Beginner level,3 weeks at 10 hours a week,"General Networking, Relationship Building, Strategic Leadership, Business, Initiative and Leadership, Goal Setting, Personal Development, Leadership, Branding, Self-Awareness, Professional Development, Growth Mindedness",66
https://www.coursera.org/learn/how-to-create-video-for-online-courses,How to Create Video for Online Courses,The University of Edinburgh,"32,542",4.7,Beginner level,,"Media Production, Developing Training Materials, Video Production, Storytelling, Course Development, Editing, Creativity, Storyboarding, Content Creation, Post-Production, Web Content Accessibility Guidelines, Cinematography, Videography, Video Editing, Writing",236
https://www.coursera.org/learn/ready-to-roll-the-video-production-process,Ready to Roll – The Video Production Process,University of Colorado Boulder,"6,633",4.8,Beginner level,6 weeks to complete,"Media Production, Videography, Storytelling, Video Production, Editing, Cinematography",33
https://www.coursera.org/specializations/feedbackandcoachingforeveryone,Feedback and Coaching For Everyone Specialization,Arizona State University,"1,716",4.7,Beginner level,4 weeks to complete,"Accountability, Active Listening, Collaboration, Compassion, Conflict Management, Constructive Feedback, Decision Making, Empathy, Empowerment, Growth Mindedness, Independent Thinking, Interpersonal Communications, Leadership, Mentorship, Open Mindset, Rapport Building, Recognizing Others, Relationship Building, Social Skills, Teamwork",168
https://www.coursera.org/learn/personal-productivity-time-management-and-prioritization,"Personal Productivity, Time Management and Prioritization",Starweaver,"34,851",4.7,Intermediate level,,"Prioritization, Personal Development, Ability To Meet Deadlines, Strategic Prioritization, Productivity, Workflow Management, Goal Setting",385
https://www.coursera.org/learn/learning-how-to-learn-th,เรียนแบบนี้แต่แรก ก็เก่งไปนานแล้ว,Deep Teaching Solutions,,,Beginner level,1 week to complete,,
https://www.coursera.org/learn/thinkglobal-idp-ub,THINK GLOBAL:  TEACHERS TRAINING COURSE (IDP-ICE),Universitat de Barcelona,"4,030",4.7,Beginner level,3 weeks to complete,"Teaching, Pedagogy, Student Engagement, Education and Training, Diversity Awareness, Research Methodologies, Student-Centred Learning, Research, Training Programs, Cultural Diversity, Culture, Intercultural Competence, Curriculum Planning, Sustainable Development, Instructional Strategies, International Relations",163
https://www.coursera.org/learn/team-feedback,Feedback Loops: Team Feedback,University of Michigan,,,Beginner level,1 week to complete,"Teamwork, Team Performance Management, Team Management, Innovation, Communication, Resource Allocation, Team Building, Collaboration, People Management, Constructive Feedback, Diversity and Inclusion, Professional Development",
https://www.coursera.org/learn/social-psychology-of-attraction-and-relationships,Social Psychology of Attraction and Relationships,American Psychological Association,"4,200",4.6,Beginner level,1 week to complete,"Research, Human Relations Movement, Relationship Management, Behavioral Management, Psychology, Interpersonal Communications, Relationship Building, Cultural Diversity",17
https://www.coursera.org/learn/digitalsafetyandsecurity,Digital Safety and Security,Arizona State University,"3,805",4.6,,1 week to complete,"Incident Response, Patch Management, digital literacy, Security Strategy, Cyber Attacks, Safety and Security, Data Storage, Computer Security Awareness Training, Data Security, Cybersecurity, Vulnerability Assessments, Data Loss Prevention, Security Controls, Information Systems Security",70
https://www.coursera.org/learn/theology-forming-christ-shaped-leaders,Forming Christ-Shaped Leaders,Duke University,,,Beginner level,,"Compassion, Personal Integrity, Innovation, Initiative and Leadership, Relationship Building, Lifelong Learning, Formal Learning, Leadership, Empathy, Professionalism, Diversity Awareness, Creativity",
https://www.coursera.org/learn/study-in-usa,Applying to U.S. Universities,University of Pennsylvania,"125,236",4.7,Beginner level,3 weeks at 10 hours a week,"Cultural Diversity, Decision Making, Higher Education, Interviewing Skills, Planning, Student Services, Research, Detail Oriented, Self-Awareness",523
https://www.coursera.org/specializations/communicationforeveryone,Communication For Everyone  Specialization,Arizona State University,"4,723",4.5,Beginner level,4 weeks to complete,"Active Listening, Communication, Communication Strategies, Discussion Facilitation, Influencing, Initiative and Leadership, Interpersonal Communications, Leadership, Lecturing, Meeting Facilitation, Non-Verbal Communication, Presentations, Public Speaking, Storytelling, Team Building, Team Leadership, Team Management, Teamwork, Verbal Communication Skills, Virtual Teams",219
https://www.coursera.org/learn/presentaciones-de-alto-impacto-ia,Presentaciones de Alto Impacto con IA,Tecnológico de Monterrey,"3,461",4.9,Intermediate level,2 weeks to complete,"Storytelling, Graphic Design, Design Elements And Principles, Public Speaking, Graphic and Visual Design, Technical Documentation, Prompt Engineering Tools, Oral Expression, Communication, Scripting, Presentations",34
https://www.coursera.org/learn/resolvingandtransformingconflict,Resolving and Transforming Conflict,Arizona State University,,4.6,Beginner level,,"Problem Solving, Expectation Management, Teamwork, Honesty, Brainstorming, Communication, Collaboration, Follow Through, Negotiation, Conflict Management",14
https://www.coursera.org/specializations/identity-motivation-resilience,"Personal Journeys: Identity, Motivation, and Resilience Specialization",University of Colorado System,,4.4,Beginner level,12 weeks to complete,"Adaptability, Community Development, Creativity, Cultural Diversity, Culture, digital literacy, Diversity Awareness, Emotional Intelligence, Goal Setting, Growth Mindedness, Intercultural Competence, Lifelong Learning, Overcoming Obstacles, Persistence, Personal Development, Productivity, Resilience, Self-Awareness, Self-Motivation, Smart Goals",9
