url,title,partner,enroll,rating,level,duration,skills,reviews
https://www.coursera.org/learn/healing-with-the-arts,Healing with the Arts,University of Florida,"112,920",4.6,,1 week to complete,"Music, Liberal Arts, Journals, Mindfulness, Storytelling, Emotional Intelligence, Performing Arts, Writing, Self-Awareness, Personal Development, Empowerment","1,007"
https://www.coursera.org/learn/leading-oneself-with-purpose-and-meaning,Leading Oneself with Purpose and Meaning,University of Colorado Boulder,"3,411",4.8,Beginner level,3 weeks at 10 hours a week,"Visionary, Resilience, Accountability, Self-Awareness, Growth Mindedness, Leadership, Social Impact, Goal Setting, Personal Development, Initiative and Leadership, Personal Attributes",40
https://www.coursera.org/learn/potencia-tu-comunicacion-como-lider,Potencia tu comunicación como líder,UBITS,"1,916",4.8,Beginner level,,"Strategic Communication, Empathy, Leadership, Persuasive Communication, Conflict Management, Verbal Communication Skills, Active Listening, Influencing, Negotiation, Communication, Assertiveness, Emotional Intelligence",34
https://www.coursera.org/learn/storying-the-self-telling-our-stories,Storying the Self: Telling our Stories,University of Colorado Boulder,,,Beginner level,,"Creativity, Empathy, Leadership, Relationship Building, Oral Expression, Storytelling, Emotional Intelligence, Constructive Feedback, Communication, Public Speaking, Media Production, Writing and Editing, Content Creation",
https://www.coursera.org/learn/google-prepare-and-practice-for-interviews-with-ai,Prepare and Practice for Interviews with AI,Google,"2,611",4.8,Beginner level,,"AI Enablement, Professional Networking",17
https://www.coursera.org/learn/suicide-prevention,Suicide Prevention,Wesleyan University,"27,711",4.7,Beginner level,,"Mental Health, Research, Psychotherapy, Research Methodologies, Crisis Intervention, Behavioral Health, Mental Health Diseases and Disorders, Public Health, Demography, Medical Terminology, Epidemiology",323
https://www.coursera.org/specializations/self-care-essentials-embrace-and-nurture-the-real-you,Self-Care Essentials: Embrace & Nurture the Real You Specialization,Skillshare,,,Beginner level,4 weeks to complete,"Action Oriented, Color Theory, Courage, Creative Thinking, Creativity, Digital Design, Emotional Intelligence, Empowerment, Goal Setting, Growth Mindedness, Mindfulness, Overcoming Obstacles, Persistence, Personal Development, Positivity, Resilience, Self-Awareness, Self-Motivation, Visionary",
https://www.coursera.org/learn/fostering-engagement-in-the-age-of-digital-distraction,Fostering Engagement in the Age of Digital Distraction,Intel,,,Beginner level,1 week to complete,"Teamwork, Creativity, Creative Problem-Solving, Education Software and Technology, Classroom Management, Innovation, Digital pedagogy, Collaboration, Motivational Skills",
https://www.coursera.org/learn/theology-rediscovering-wesleyan-mission,Rediscovering Wesleyan Mission,Duke University,,,Beginner level,,"Research, Social Impact, Innovation, Social Justice, Compassion, Storytelling, Initiative and Leadership, Adaptability, Leadership, Community Outreach",
https://www.coursera.org/learn/design-thinking-para-formulacion-de-problemas,Parte 2: Design Thinking para la formulación de problemas,IESE Business School,,,Beginner level,,"Human Centered Design, Customer Insights, Customer experience improvement, User Research, Empathy, Problem Solving, Persona Development, Design Thinking, Interviewing Skills, Qualitative Research",
https://www.coursera.org/learn/equitable-stage-makeup-and-hair,Equitable Stage Makeup and Hair,University of Michigan,"3,820",,Beginner level,3 weeks to complete,"Storytelling, Color Theory, Performing Arts, Detail Oriented, Creativity, Design, Diversity Awareness, Cultural Sensitivity",
https://www.coursera.org/learn/design-thinking-de-la-idea-al-prototipo,Parte 3: Design Thinking de la idea al prototipo,IESE Business School,,,Beginner level,,"Brainstorming, Collaboration, Creative Thinking, Ideation, Innovation, Design Thinking, Problem Solving, Meeting Facilitation, Human Centered Design, Strategic Thinking, Creative Problem-Solving, Solution Design",
https://www.coursera.org/learn/formatting-in-ms-excel,التنسيق في مايكروسوفت إكسل | Formatting in MS Excel,Alfaisal University | KLD,,5.0,Beginner level,,Spreadsheet Software,19
https://www.coursera.org/learn/assertiveness-with-emotional-intelligence,Being Assertive with Emotional Intelligence,Ei4Change,"2,855",4.9,Beginner level,,"Assertiveness, Emotional Intelligence, Self-Awareness, Interpersonal Communications, Overcoming Obstacles, Conflict Management, Social Skills, Composure, Empathy, Leadership Development, Non-Verbal Communication, Communication, Personal Attributes, Team Building, Verbal Communication Skills, Personal Development, Business Communication",44
https://www.coursera.org/learn/szemleletvaltas,Szemléletváltás,McMaster University,"4,919",4.9,Beginner level,1 week to complete,"Learning Strategies, Mentorship, Social Studies, Creativity, Overcoming Obstacles, Adaptability, Open Mindset, Productivity, Time Management, Cultural Diversity, Lifelong Learning, Learning Styles, Personal Development, Stress Management, Growth Mindedness, Willingness To Learn, Professional Development",73
https://www.coursera.org/learn/investing-fundamentals,Fundamentals of Investing,SoFi,"25,941",4.3,Beginner level,,"Financial Planning, Investment Management, Risk Management, Equities, Derivatives, Tax, Investments, Risk Analysis, Securities (Finance), Return On Investment, Portfolio Management",121
https://www.coursera.org/learn/analyze-and-develop-core-personality-skills-for-beginners,Analyze and Develop Core Personality Skills for Beginners,EDUCBA,,,Beginner level,,"Resilience, Self-Awareness, Relationship Building, Human Development, Professionalism, Growth Mindedness, Analytical Skills, Personal Attributes, Personal Development, Emotional Intelligence, Psychosocial Assessments, Conflict Management, Ethical Standards And Conduct, Psychology, Persistence, Tenacity, Psychological Evaluations, Communication, Applied Behavior Analysis, Self-Discipline",
https://www.coursera.org/learn/givingfeedback,Giving Feedback,Arizona State University,"2,837",4.7,Beginner level,,"Leadership Development, Active Listening, Motivational Skills, Growth Mindedness, Constructive Feedback, Communication, Coaching, Mentorship, Empowerment",24
https://www.coursera.org/learn/career-path-essentials-iese,Career Path Essentials,IESE Business School,,4.7,Beginner level,4 weeks to complete,"Communication Strategies, Adaptability, Professional Networking, Spreadsheet Software, Presentations, Market Trend, Trend Analysis, Interviewing Skills, Relationship Building, Sales, Professional Development, Business Marketing",19
https://www.coursera.org/learn/study-in-japan,Studying at Japanese Universities,The University of Tokyo,"55,908",4.8,Beginner level,1 week at 10 hours a week,"Program Development, Student Support and Services, International Relations, Culture, Mentorship, English Language, Education and Training, Project Planning",455
https://www.coursera.org/learn/playingtoyourstrengths,Playing to Your Strengths by StandOut®,"Automatic Data Processing, Inc. (ADP)",,,Beginner level,2 weeks to complete,"Emotional Intelligence, Optimism, Adaptability, Collaboration, Problem Solving, Self-Awareness, Growth Mindedness, Positivity, Resilience, Communication, Personal Development",
https://www.coursera.org/learn/brilliant-passionate-you,"Brilliant, Passionate You",University of Michigan,"38,949",4.6,Beginner level,2 weeks at 10 hours a week,"Empathy, Mental Health, Storytelling, Positivity, Resilience, Relationship Building, Personal Development, Goal Setting, Overcoming Obstacles, Community Development, Self-Awareness",289
https://www.coursera.org/learn/research-inquiry-discovery,Research Design: Inquiry and Discovery,University of North Texas,"24,191",4.8,Beginner level,1 week at 10 hours a week,"Business Research, Sample Size Determination, Analysis, Ethical Standards And Conduct, Data Collection, Scientific Methods, Qualitative Research, Research Design, Research Methodologies, Surveys, Decision Making, Probability & Statistics, Research, Research Reports",459
https://www.coursera.org/learn/risk-management-in-personal-finance,Risk Management in Personal Finance,SoFi,"13,036",4.7,Beginner level,,"Risk Management, Asset Protection, Insurance, Needs Assessment, Estate Planning, Financial Planning",62
https://www.coursera.org/specializations/principles-of-leadership-leading-oneself,Principles of Leadership: Leading Oneself Specialization,University of Colorado Boulder,"4,013",4.8,Beginner level,3 months to complete,"Accountability, Decision Making, Emotional Intelligence, Engineering Management, Goal Setting, Growth Mindedness, Initiative and Leadership, Mental Concentration, Optimism, Overcoming Obstacles, Persistence, Personal Attributes, Personal Development, Positivity, Productivity, Resilience, Self-Awareness, Self-Motivation, Stress Management, Time Management",126
https://www.coursera.org/learn/gaoxiao-xiezuo,高效协作,University of Science and Technology of China,,4.0,,,"Process Optimization, Team Oriented, Smart Goals, Collaboration, Information Management, Productivity, Operational Efficiency, Workflow Management, Knowledge Transfer, Learning Strategies",10
https://www.coursera.org/learn/control-of-tension-and-anxiety,كيفية السيطرة على التوتر والقلق,Alfaisal University | KLD,"3,769",4.9,Beginner level,,"Physiology, Behavioral Health, Personal Development, Stress Management, Self-Awareness, Emotional Intelligence, Professional Development, Physical Therapy, Composure, Mindfulness, Mental Health",64
https://www.coursera.org/learn/networking-with-accelerate,Networking,University of Minnesota,,,Beginner level,,"Communication Strategies, Public Speaking, Professional Networking, General Networking, Smart Goals, Relationship Building, Emotional Intelligence, Stress Management, Interviewing Skills, Professional Development, Verbal Communication Skills, Communication",
https://www.coursera.org/learn/the-science-of-well-being,The Science of Well-Being,Yale University,"5,001,300",4.9,,1 week to complete,"Goal Setting, Health And Wellness Coaching, Psychology, Growth Mindedness, Social Skills, Positive Behavior Support, Resilience, Behavioral Health, Cognitive Behavioral Therapy, Mindfulness","40,210"
https://www.coursera.org/specializations/good-with-words-speaking-and-presenting,Good with Words: Speaking and Presenting Specialization,University of Michigan,"28,540",4.6,Beginner level,4 weeks to complete,"Active Listening, Cognitive flexibility, Communication, Communication Strategies, Composure, Creativity, Driving engagement, Empathy, Ingenuity, Interpersonal Communications, Non-Verbal Communication, Optimism, Persuasive Communication, Presentations, Professionalism, Public Speaking, Social Skills, Storytelling, Tactfulness, Verbal Communication Skills",363
https://www.coursera.org/specializations/wharton-success,Achieving Personal and Professional Success Specialization,University of Pennsylvania,"74,204",4.7,Beginner level,4 weeks to complete,"Active Listening, Business Communication, Communication, Communication Strategies, Contract Negotiation, Growth Mindedness, Influencing, Initiative and Leadership, Innovation, Interpersonal Communications, Leadership, Negotiation, Optimism, Personal Development, Persuasive Communication, Professional Networking, Relationship Building, Strategic Communication, Trustworthiness, Verbal Communication Skills","3,217"
https://www.coursera.org/learn/collaborate-effectively,Collaborate Effectively for Professional Success,IBM,"83,248",4.6,Beginner level,,"Cross-Functional Collaboration, Virtual Teams, Teamwork, Meeting Facilitation, Collaboration, Team Management, Communication, Professional Development, Critical Thinking",999
https://www.coursera.org/learn/airs-effective-onboarding,Effective Onboarding,"Automatic Data Processing, Inc. (ADP)",,4.5,Intermediate level,,"Continuous Improvement Process, Communication, Relationship Building, Process Development, Performance Metric, Performance Management, Employee Onboarding, Leadership Development, Employee Retention, Internal Communications, Drive Engagement, New Hire Orientations, Talent Acquisition",15
https://www.coursera.org/learn/mindfulness,De-Mystifying Mindfulness,Universiteit Leiden,"228,099",4.8,Beginner level,4 weeks at 10 hours a week,"Social Justice, Self-Awareness, Social Sciences, Cultural Diversity, Mental Health, Stress Management, Psychology, Trauma Care, Ethical Standards And Conduct, Environment and Resource Management, Mindfulness, Mental and Behavioral Health Specialties","1,595"
https://www.coursera.org/learn/effective-time-manangemen,الإدارة الفعالة للوقت | Effective Time Management,Alfaisal University | KLD,"16,893",4.8,Beginner level,,"Decision Making, Planning, Strong Work Ethic, Productivity, Organizational Skills, Scheduling, Professional Development, Time Management, Personal Development, Prioritization, Goal Setting",446
https://www.coursera.org/learn/salud-fisica-mental-tecnicas-psicocorporales,Mejora tu salud física y mental con técnicas psicocorporales,UBITS,,,Intermediate level,1 week to complete,"Pain Management, Self-Awareness, Stress Management, Personal Care, Physiology, Neurology, Exercise Therapy, Mental Health, Mindfulness, Anatomy, Behavioral Health, Resilience",
https://www.coursera.org/learn/saving-money-future,Saving Money for the Future,SoFi,"7,849",4.5,Beginner level,,"Goal Setting, Finance, Prioritization, Financial Planning, Estate Planning, Budgeting, Higher Education, Investments",38
https://www.coursera.org/specializations/design-thinking,Design Thinking  Specialization,IESE Business School,,5.0,Beginner level,4 weeks to complete,"Brainstorming, Creative Problem-Solving, Creative Thinking, Culture Transformation, Customer experience improvement, Customer Insights, Design Thinking, Empathy, Human Centered Design, Ideation, Innovation, Leadership, Organizational Change, Problem Solving, Qualitative Research, Solution Design, Strategic Thinking, Systems Thinking, Thought Leadership, User Research",6
https://www.coursera.org/specializations/personal-development,Personal Development And Business Productivity Specialization,Alex Genadinik,,,Beginner level,12 weeks to complete,"Growth Mindedness, Ingenuity, Mental Concentration, Organizational Skills, Personal Development, Productivity, Resilience, Self-Discipline, Self-Motivation, Strategic Decision-Making, Strategic Prioritization, Stress Management, Time Management, Business Leadership, Creativity, Critical Thinking, Data-Driven Decision-Making, Emotional Intelligence, Empathy, Empathy & Emotional Intelligence",
https://www.coursera.org/learn/ai-for-everyday-life,AI for Everyday Life,Kennesaw State University,"10,996",4.7,Beginner level,,"Responsible AI, Communication, Social Skills, Artificial Intelligence, Predictive Modeling",139
https://www.coursera.org/learn/mindsets,Research On Mindsets From Top Scientists And Universities,Alex Genadinik,,,,,"Personal Development, Psychology, Willingness To Learn, Research, Cognitive flexibility, Self-Awareness, Growth Mindedness, Resilience, Goal Setting, Science and Research, Professional Development, Stress Management, Mental Health, Physiology",
https://www.coursera.org/learn/the-art-of-negotiation,فن التفاوض | The Art of Negotiation,Alfaisal University | KLD,"6,214",4.7,Beginner level,,"Communication, Influencing, Planning, Interpersonal Communications, Persuasive Communication, Active Listening, Negotiation, Relationship Building",91
https://www.coursera.org/learn/interculturalidade,Compreender as dimensões interculturais na vida cotidiana,Universidad de los Andes,,,Intermediate level,2 weeks to complete,"Cultural Diversity, Culture, Language Competency, Social Justice, Cultural Sensitivity, Language Learning, Diversity Awareness, Intercultural Competence, Multilingualism, Non-Verbal Communication",
https://www.coursera.org/learn/management-de-eventos,Management de Eventos,Universidad de Palermo,"3,525",4.1,Beginner level,2 weeks to complete,"Hospitality, Event Planning, Budgeting, Program Evaluation, Target Audience, Stakeholder Management, Scheduling, Organizational Skills, Communication Strategies, Event Management, Advertising, Marketing Communications, Resource Allocation",47
https://www.coursera.org/learn/gestion-del-estres-y-mindfulness,Gestión del estrés y Mindfulness,Universidades Anáhuac,"4,079",4.8,Beginner level,1 week at 10 hours a week,"Positivity, Emotional Intelligence, Resilience, Respiratory Care, Mental Concentration, Self-Awareness, Creativity, Personal Development, Mindfulness, Physiology, Stress Management",94
https://www.coursera.org/learn/technical-managerial-written-skills,Technical Managerial Written Skills,University of Colorado Boulder,"3,236",4.6,Beginner level,2 weeks at 10 hours a week,"Editing, Proposal Writing, Writing, Technical Management, Proofreading, Concision, Grammar, Business Writing, Communication, Engineering Management, Technical Writing, Technical Communication, Business Correspondence, Target Audience, Persuasive Communication",23
https://www.coursera.org/learn/the-job-hunt,The Hunt: Job-Searching and Career-Building with Purpose,Yale University,"1,796",,,1 week to complete,"Professional Networking, Relationship Building, Professional Development, Storytelling, Goal Setting, Personal Development, Interviewing Skills, Self-Motivation, Communication, Self-Awareness",
https://www.coursera.org/learn/empowerment-and-wellness-a-mindfulness-journey-for-women,Empowerment and Wellness: A Mindfulness Journey for Women,Board Infinity ,,,Beginner level,2 weeks to complete,"Personal Care, Resilience, Persistence, Interpersonal Communications, Communication, Self-Awareness, Personal Development, Mental Health, Goal Setting, Empowerment, Stress Management, Mindfulness, Emotional Intelligence",
https://www.coursera.org/specializations/habilidades,Habilidades Gerenciales  Specialization,Universidad Nacional Autónoma de México,"36,046",4.8,Beginner level,4 weeks to complete,"Brainstorming, Business Planning, Coaching, Cognitive flexibility, Creative Problem-Solving, Creative Thinking, Delegation Skills, Emotional Intelligence, Empathy & Emotional Intelligence, Leadership, Leadership Development, Management Training And Development, Organizational Skills, Organizational Strategy, Problem Solving, Productivity, Strategic Planning, Supervision, Team Leadership, Time Management","6,724"
https://www.coursera.org/learn/the-science-of-well-being-for-teens,The Science of Well-Being for Teens,Yale University,"192,373",4.8,Beginner level,1 week at 10 hours a week,"Productivity, Stress Management, Resilience, Growth Mindedness, Goal Setting, Compassion, Behavioral Health, Mindfulness, Self-Awareness, Psychology, Decision Making, Social Impact, Mental Health, Positivity",811
https://www.coursera.org/learn/competencias-en-negociacion,Parte 3: Negocia con Impacto - Habilidades Clave,IESE Business School,,,Beginner level,,"Critical Thinking and Problem Solving, Team Management, Talent Management, Negotiation, Influencing, Collaboration, Conflict Management, Communication, Meeting Facilitation, Diversity Awareness, Leadership, People Management, Creativity, Decision Making, Leadership and Management, Delegation Skills",
https://www.coursera.org/learn/hablar-bien-en-publico,Cómo hablar bien en público,Universitat Autònoma de Barcelona,"251,130",4.8,Beginner level,1 week at 10 hours a week,"Drive Engagement, User Feedback, Customer Engagement, Non-Verbal Communication, Verbal Communication Skills, Communication, Target Audience, Time Management, Persuasive Communication, Strategic Communication, Assertiveness, Public Speaking, Adaptability, Presentations","2,870"
https://www.coursera.org/learn/lidera-tu-vida-estrategias,Parte 5: Lidera tu Vida - Estrategias y Conciliación,IESE Business School,,,Beginner level,,"Adaptability, Self-Awareness, Professional Development, Emotional Intelligence, Communication, Leadership Studies, Productivity, Organizational Skills, Time Management, Goal Setting, Collaboration, Personal Development, Prioritization",
https://www.coursera.org/learn/pensamiento-sistemico-en-el-siglo-xxi,Pensamiento Sistémico en el Siglo XXI,Universidad de los Andes,"2,199",4.9,Beginner level,2 weeks to complete,"Systems Analysis, Adaptability, Systems Thinking, Critical Thinking, Decision Making, Problem Solving, Complex Problem Solving",43
https://www.coursera.org/specializations/the-art-of-visual-storytelling,The Art of Visual Storytelling Specialization,University of Colorado Boulder,"21,783",4.6,Beginner level,2 months to complete,"Adobe Premiere, Cinematography, Creativity, Editing, File Management, Graphic and Visual Design, Media Production, Multimedia, Post-Production, Quality Assurance, Scripting, Storyboarding, Storytelling, Timelines, Video Editing, Video Production, Videography, Writing",136
https://www.coursera.org/learn/sobrevive-doctorado,Sobrevive a tu doctorado con salud y éxito,Universitat Autònoma de Barcelona,,,Beginner level,,"Adaptability, Mindfulness, Stress Management, Mental Health, Communication, Productivity, Resilience, Emotional Intelligence, Personal Development, Persistence, Time Management, Positive Behavior Support, Overcoming Obstacles, Self-Awareness",
https://www.coursera.org/learn/accelerate-your-job-search-with-ai,Accelerate Your Job Search with AI,Google,"344,435",4.8,Beginner level,,"Communication, Personal Attributes, Professional Development, Problem Solving, Interviewing Skills, AI Enablement","4,263"
https://www.coursera.org/learn/grok-comprehensive-guide,Grok Comprehensive Guide: From Basics to Advanced Features,SkillsBooster Academy,,,Beginner level,,"Responsible AI, Critical Thinking, Natural Language Processing, Innovation, Prompt Patterns, Complex Problem Solving, Information Technology, Digital Assets, Artificial Intelligence and Machine Learning (AI/ML), AI Personalization, Artificial Intelligence, Productivity, AI Security, digital literacy, Creative Problem-Solving, Automation, Critical Thinking and Problem Solving",
https://www.coursera.org/learn/yingyuyanjiang,Essentials for English Speeches and Presentations  英语演讲与演示,Peking University,"29,682",4.6,,2 weeks to complete,"Grammar, Business Communication, Interviewing Skills, Presentations, Verbal Communication Skills, Public Speaking, Communication Strategies, Intercultural Competence, Oral Expression, Cultural Diversity, Vocabulary, English Language, Non-Verbal Communication",159
https://www.coursera.org/learn/avoidingbias,Avoiding Bias,Arizona State University,,4.7,Beginner level,,"Accountability, Diversity Awareness, Leadership, Self-Awareness, Conflict Management, Decision Making, Open Mindset, Advocacy, Independent Thinking, Critical Thinking",18
https://www.coursera.org/learn/academic-research-types-and-methods,Academic Research Types and Methods,"University of California, Davis",,,Beginner level,,"Safety and Security, Intellectual Property, Higher Education, Research Methodologies, Science and Research, Student Engagement, Research Design, Research, Ethical Standards And Conduct",
https://www.coursera.org/learn/retorik,Etkili Konuşmada Retorik (Rhetoric in Effective Speaking),Koç University,"7,713",4.6,,,"Public Speaking, Critical Thinking, Liberal Arts, Persuasive Communication, Communication, Verbal Communication Skills, Storytelling, Cognitive flexibility, Creative Thinking",53
https://www.coursera.org/specializations/decisionmakingforeveryone,Decision-Making for Everyone Specialization,Arizona State University,"1,885",4.6,Beginner level,4 weeks to complete,"Analysis, Analytical Skills, Brainstorming, Business Ethics, Complex Problem Solving, Creative Problem-Solving, Creative Thinking, Creativity, Critical Thinking and Problem Solving, Curiosity, Decision Making, Ethical Standards And Conduct, Innovation, Problem Solving, Resourcefulness, Risk Analysis, Root Cause Analysis, Social Impact, Strategic Decision-Making, Strategic Thinking",127
https://www.coursera.org/learn/tgnc-gender-identity-social-change,What does it mean to identify as Transgender or Gender Non-Conforming (TGNC)?,University of Minnesota,"11,721",4.4,Beginner level,3 weeks at 10 hours a week,"Diversity Equity and Inclusion Initiatives, Cultural Diversity, Social Justice, Cultural Sensitivity, Health Disparities, Advocacy, Workplace inclusivity, Public Policies, Diversity Awareness",109
https://www.coursera.org/specializations/storying-the-self-for-leadership-and-creativity,Storying the Self for Leadership and Creativity Specialization,University of Colorado Boulder,,3.7,Beginner level,4 weeks to complete,"Active Listening, Cognitive flexibility, Communication, Constructive Feedback, Creativity, Cultural Diversity, Emotional Intelligence, Empathy, Initiative and Leadership, Leadership, Media and Communications, Oral Expression, Personal Development, Public Speaking, Relationship Building, Self-Awareness, Social Justice, Social Skills, Storytelling, Writing and Editing",11
https://www.coursera.org/learn/the-authentic-communicator-building-presence-and-trust,The Authentic Communicator: Building Presence and Trust,University of London,,,Beginner level,2 weeks to complete,"Rapport Building, Interpersonal Communications, Adaptability, Self-Awareness, Executive Presence, Public Speaking, Growth Mindedness, Emotional Intelligence, Personal Development, Non-Verbal Communication, Relationship Building, Personal Attributes, Communication, Verbal Communication Skills",
