url,title,partner,enroll,rating,level,duration,skills,reviews
https://www.coursera.org/learn/introduccion-al-mantenimiento-de-activos-fisicos,Introducción al mantenimiento de activos físicos,Universidad de los Andes,"3,478",4.9,Beginner level,3 weeks at 10 hours a week,"Product Lifecycle Management, Key Performance Indicators (KPIs), Data-Driven Decision-Making, Maintainability, Decision Making, Facility Management and Maintenance, Performance Measurement, Capacity Management, Failure Analysis, Asset Management, Scheduling, Reliability, Continuous Monitoring, Cost Benefit Analysis",136
https://www.coursera.org/learn/engineering-of-structures-response-of-structures,Engineering of Structures: Response of Structures,Dartmouth College,"2,617",4.9,Beginner level,2 weeks to complete,"Building Design, Structural Analysis, Mechanics, Engineering Analysis, 3D Modeling, Engineering, Architectural Engineering, Design, Construction, Structural Engineering, Engineering Design Process, Simulation and Simulation Software, Vibrations, Civil Engineering, Mathematical Modeling",47
https://www.coursera.org/learn/taknulujia-alnnanu1,التقانة والمستشعرات النانوية - الجزء الاول,Technion - Israel Institute of Technology,"3,685",4.2,,1 week to complete,"Electronics Engineering, Medical Devices, Creative Design, Chemical Engineering, Emerging Technologies, Manufacturing Processes, Biochemistry, Chemistry, Materials science, Biomedical Engineering",27
https://www.coursera.org/learn/bim-fundamentals,BIM Fundamentals for Engineers,National Taiwan University,"113,093",4.7,Beginner level,2 weeks at 10 hours a week,"Construction, Engineering Practices, Construction Management, Building Information Modeling, Data Modeling, Computer-Aided Design, Civil Engineering, Mechanical Engineering, 3D Modeling","1,995"
https://www.coursera.org/learn/robotics-engineering--applications,Robotics Engineering & Applications,L&T EduTech,"6,115",4.4,Intermediate level,,"Control Systems, Internet Of Things, Programmable Logic Controllers, Image Analysis, Computer Vision, Industrial Engineering, Automation, Robotics, Equipment Design, Mechanical Design",30
https://www.coursera.org/learn/electric-vehicle-operation-and-diagnosis,Electric Vehicle Operation and Diagnosis,Starweaver,"2,187",4.7,Beginner level,,"Test Tools, Electronic Systems, Power Electronics, Failure Analysis, Emerging Technologies, Test Equipment, Electrical Systems, Electrical Safety, Basic Electrical Systems, Electric Power Systems, Energy and Utilities, Thermal Management, Hardware Troubleshooting, Control Systems, Wiring Diagram, Sustainable Technologies, Electrical Equipment, High Voltage",22
https://www.coursera.org/learn/robotics1,機器人學一 (Robotics (1)),National Taiwan University,"14,807",4.7,Beginner level,2 weeks to complete,"Applied Mathematics, Robotics, Automation Engineering, Mechanical Engineering, Mathematical Modeling, Spatial Analysis, Linear Algebra, Control Systems",64
https://www.coursera.org/learn/global-climate-change-policies-and-analysis,Global Climate Change Policies and Analysis,University of Colorado Boulder,"1,684",,Beginner level,2 weeks to complete,"International Relations, Climate Change Mitigation, Emerging Technologies, Climate Change Adaptation, Energy and Utilities, Environmental Regulations, Environment, Sustainable Technologies, Environmental Policy, Policy Analysis, Forecasting",
https://www.coursera.org/learn/design-basics-of-rcc-buildings,Design Basics of RCC Buildings,L&T EduTech,"7,149",4.8,Intermediate level,1 week to complete,"Architectural Engineering, Engineering Documentation, Structural Engineering, Architectural Drawing, Engineering Drawings, Structural Analysis, Engineering Calculations, Engineering Practices, Construction, Building Design, Civil Engineering, Blueprint Reading, Building Codes",62
https://www.coursera.org/learn/fire-effect,"The Effect of Fires on People, Property and the Environment","University of Maryland, College Park","11,733",4.7,Great course highlighting the fundamentals involved in fire engineering. Rather high level overview but gets you wanting to know more.,1 week to complete,"Emergency Response, Safety Standards, Hazard Analysis, Environmental Science, Property Maintenance, Accident Prevention, Risk Management, Environmental Issue, Building Design, Fire And Life Safety",578
https://www.coursera.org/learn/microscopy,Transmission electron microscopy for materials science,École Polytechnique Fédérale de Lausanne,"16,213",4.6,Intermediate level,5 weeks at 10 hours a week,"Mathematical Modeling, Engineering, Scientific, and Technical Instruments, Scientific Visualization, Image Analysis, Electronics, Physics, Laboratory Equipment, Materials science, Analytical Testing",124
https://www.coursera.org/learn/fundamentals-of-materials-science,Fundamentals of Materials Science,Shanghai Jiao Tong University,"17,237",4.6,Intermediate level,2 weeks to complete,"Chemical Engineering, Chemistry, Physics, Physical Science, Mechanical Engineering, Materials science, Semiconductors, Thermal Management, Manufacturing Processes",201
https://www.coursera.org/specializations/introduction-to-electricity-magnetism,Introduction to Electricity and Magnetism Specialization,Rice University,"10,926",4.7,Intermediate level,2 months to complete,"Advanced Mathematics, Applied Mathematics, Basic Electrical Systems, Calculus, Differential Equations, Electrical Engineering, Electrical Systems, Electronic Components, Electronics, Engineering Analysis, Engineering Calculations, Integral Calculus, Mathematical Theory & Analysis, Mathematical Modeling, Mechanics, Physics, Problem Solving, Torque (Physics), Trigonometry",267
https://www.coursera.org/learn/mastering-bitumen,Mastering bitumen for better roads and innovative applications,École Nationale des Ponts et Chaussées,"33,051",4.7,Intermediate level,,"Manufacturing Processes, Construction Engineering, Performance Testing, Oil and Gas, Occupational Safety and Health Administration (OSHA), Chemical Engineering, Technical Standard, Construction, Materials science, Transportation Operations, Civil Engineering, Safety Assurance, Environment Health And Safety, Petroleum Industry, Sustainable Design, Production Process, Chemistry, Energy and Utilities, Environmental Engineering, Sustainable Engineering","1,315"
https://www.coursera.org/learn/electrification-of-building-energy-systems,Electrification of Building Energy Systems,University of Colorado Boulder,,,Intermediate level,3 weeks to complete,"Control Systems, Architectural Engineering, Electrical Systems, Energy and Utilities, Building Design, Construction, HVAC, Climate Change Mitigation, Electric Power Systems, Building Services Engineering, Thermal Management, Sustainable Technologies",
https://www.coursera.org/learn/modernrobotics-course3-ko,"현대 로봇공학, 강좌 3: 로봇 동역학",Northwestern University,,,Intermediate level,2 weeks to complete,"Mechanics, Applied Mathematics, Algorithms, Differential Equations, Mathematical Modeling, Simulation and Simulation Software, Robotics, Torque (Physics), Computer Programming Tools, Linear Algebra",
https://www.coursera.org/specializations/optical-engineering,Optical Engineering Specialization,University of Colorado Boulder,"15,196",4.3,Advanced level,2 months to complete,"Applied Mathematics, Computer-Aided Design, Electrical Engineering, Electronic Components, Engineering Analysis, Engineering Calculations, Engineering Design Process, Engineering, Scientific, and Technical Instruments, Human Factors, Image Analysis, Image Quality, Numerical Analysis, Performance Tuning, Physics, Simulation and Simulation Software, System Configuration, System Design and Implementation, Systems Design",377
https://www.coursera.org/learn/urban-nature,"Urban Nature: Connecting Cities, Sustainability and Innovation",Lund University,"24,774",4.7,Beginner level,1 week at 10 hours a week,"Sustainable Technologies, Business Modeling, Climate Change Mitigation, Water Sustainability, Environment, Case Studies, Governance, Systems Thinking, Sustainable Development, Environmental Science, Stakeholder Engagement, Water Resources, Climate Change Adaptation, Sustainable Design",475
https://www.coursera.org/learn/course-3-environmental-protection-and-sustainability,Environmental Protection and Sustainability,Khalifa University,"4,536",4.9,Beginner level,,"Hazard Analysis, Waste Minimization, Environmental Management Systems, Environmental Regulations, Environmental Science, Environmental Monitoring, Environment Health And Safety, Environmental Engineering, Risk Management, Sustainability Standards, Regulatory Compliance, Emergency Response, Hazardous Waste Operations And Emergency Response Standard (HAZWOPER)",72
