url,title,partner,enroll,rating,level,duration,skills,reviews
https://www.coursera.org/learn/experiments-with-sound,Art of the MOOC:  Experiments with Sound,Duke University,"8,684",4.8,Beginner level,1 week to complete,"Creativity, Performing Arts, Electronic Media, Music History, Cultural Diversity, Aesthetics, World Music, Music, Interactive Learning, Public Affairs, Research, Culture, Multimedia, Media and Communications, Music Theory, Music Performance, Experimentation, Musical Composition",77
https://www.coursera.org/learn/kickstartyourcreativitywithprocreatedrawanimals,Kickstart Your Creativity with Procreate: Draw Animals,Skillshare,,,,,"Color Theory, Design Elements And Principles, Creativity, Peer Review, Digital Design",
https://www.coursera.org/learn/touring-101-for-musicians,Touring 101 for Musicians,Berklee,,,Beginner level,1 week to complete,"Marketing Planning, Travel Arrangements, Scheduling, Instagram, Marketing Strategies, Performance Metric, Business Metrics, Marketing, Music Performance, Sales Presentations, Customer Engagement, Booking (Sales), Event Marketing, Business Planning, Professional Networking, Content Marketing, Goal Setting, Proposal Writing, Talent Management",
https://www.coursera.org/learn/ukraine-history-culture-and-identities,"Ukraine: History, Culture and Identities",University of Washington,"10,469",4.7,Beginner level,,"Art History, Economic Development, Community Development, Ancient History, International Relations, Policty Analysis, Research, and Development, Cultural Responsiveness, Cultural Diversity, Culture, Social Studies, Political Sciences, World History, European History",337
https://www.coursera.org/learn/question-reality-mind,Question Reality: Mind,Dartmouth College,"1,758",4.4,Beginner level,,"Mathematics and Mathematical Modeling, Simulations, Theoretical Computer Science, Computational Logic, Psychology, Science and Research, Artificial Intelligence, Logical Reasoning, Experimentation, Computational Thinking",14
https://www.coursera.org/learn/human-spaceflight,A Brief History of Human Spaceflight,University of Houston,"18,158",4.4,,2 weeks to complete,"Failure Analysis, Human Factors, International Relations, Engineering, Safety Assurance, Ancient History",436
https://www.coursera.org/learn/tango,So You Think You Know Tango?,Emory University,"4,764",4.6,Beginner level,"How well do you think you know tango? This two-week mini-course is designed for music lovers, musicians, and dancers who are interested in learning more about the Argentine Tango. It will explore the many dimensions of the Argentine Tango music, including its origins, popularization during the Golden Age, dissemination abroad, evolution into an artistic music-dance form, and adoption by Argentine and international art-music composers to date. The goal is to provide learners with an authentic and holistic tango experience by intersecting scholarly studies of the history, theory, and culture of tango with knowledge of instrumental performance practices. Learners can also learn more about basic tango gestures and steps that embody the music, as well as the poetry of tango.","World Music, Music Performance, Music History, Instrumental Music, Performing Arts, Music Theory, Music",111
https://www.coursera.org/learn/womens-spirituality,A Voice of Their Own. Women's Spirituality in the Middle Ages.,Universitat de Barcelona,"16,612",4.4,Beginner level,1 week at 10 hours a week,"Cultural Diversity, Writing, Music History, European History",112
https://www.coursera.org/learn/affinity-photo-beyond-the-basics--retouching-skills,Affinity Photo: Beyond the Basics – Retouching Skills,Skillshare,,,Intermediate level,,"Computer Graphic Techniques, Photo Editing, Image Quality, Photography",
https://www.coursera.org/learn/holodomor,Famine as Genocide: The Holodomor in Ukraine,University of Alberta,,,Beginner level,3 weeks to complete,"Culture, Socioeconomics, Economics, Political Sciences, International Relations, European History, Media and Communications, World History, Sociology, Case Studies, Social Studies, Social Sciences, Policy Analysis",
https://www.coursera.org/learn/premium-logo-animation-in-adobe-after-effects-3d--fx,Premium Logo Animation in Adobe After Effects: 3D & FX,Skillshare,,,Intermediate level,,"Logo Design, Computer Graphics, File Management, Animations, Cinematography, 3D Modeling, Motion Graphics",
https://www.coursera.org/learn/4-day-creative-reset-reduce-stress--boost-productivity,4 Day Creative Reset: Reduce Stress & Boost Productivity,Skillshare,,,Beginner level,,"Mental Concentration, Mindfulness, Self-Awareness, Resilience, Personal Development, Stress Management, Goal Setting, Creativity, Planning, Growth Mindedness, Prioritization, Productivity",
https://www.coursera.org/learn/rolling-stones,"The Music of the Rolling Stones, 1962-1974",University of Rochester,"12,464",4.8,Beginner level,1 week at 10 hours a week,"Music History, Music, Instrumental Music, Musical Composition",172
https://www.coursera.org/learn/blender-for-filmmakers-3d-set-extension--camera-tracking,Blender for Filmmakers: 3D Set Extension & Camera Tracking,Skillshare,,,Intermediate level,,"Cinematography, Virtual Environment, Animations, 3D Modeling, Computer Graphics, Photo/Video Production and Technology, Video Editing, Post-Production, 3D Assets",
https://www.coursera.org/learn/craft-of-character,Creative Writing: The Craft of Character,Wesleyan University,"97,695",4.5,,,"Storytelling, Writing and Editing, Content Creation","1,956"
https://www.coursera.org/learn/east-asian-religions-ecology,East Asian Religions & Ecology,Yale University,"2,812",4.8,Beginner level,2 weeks to complete,"Sustainable Development, Cultural Diversity, Ancient History, Environment, Culture, Liberal Arts, Natural Resource Management, Environment and Resource Management, Climate Change Programs, Political Sciences, Ethical Standards And Conduct",30
https://www.coursera.org/specializations/intermediate-after-effects,Intermediate After Effects Specialization,Skillshare,,,Intermediate level,4 weeks to complete,"Animations, Media Production, Motion Graphics, Musical Composition, Performance Tuning, Post-Production, Scripting, Timelines, Typography, Video Editing, Video Production",
https://www.coursera.org/learn/multimedia-content-creation,Multimedia Content Creation,Adobe,"15,982",4.8,,2 weeks to complete,"Video Production, Graphic and Visual Design, Digital Media Strategy, Animations, Storytelling, Communication, Content Creation, Multimedia, Infographics, Design, Editing, Web Content, Visual Design",128
https://www.coursera.org/learn/introclassicalmusic,Introduction to Classical Music,Yale University,"262,648",4.9,,7 weeks to complete,"Musical Composition, Music Performance, Classical Music, Art History, Instrumental Music, Performing Arts, Music, Liberal Arts, Music History, Music Theory","4,078"
https://www.coursera.org/learn/fundamentals-of-graphic-design-ru,Основы графического дизайна,California Institute of the Arts,"65,027",4.9,Beginner level,2 weeks at 10 hours a week,"Graphic Design, Creativity, Layout Design, Color Theory, Graphic and Visual Design Software, Image Quality, Typography, Design Elements And Principles",533
https://www.coursera.org/learn/premiere-pro-pt-1--getting-started-editing-basics,Premiere Pro Pt. 1 — Getting Started & Editing Basics,Skillshare,"3,488",4.9,Beginner level,,"Adobe Premiere, Post-Production, Timelines, Editing, Video Editing, File Management",17
https://www.coursera.org/learn/religion-thought-modern-china,"Religion and Thought in Modern China: the Song, Jin, and Yuan",The Chinese University of Hong Kong,"6,880",4.5,,3 weeks to complete,"Governance, Ancient History, Economics, Art History, Political Sciences, Cultural Diversity, World History, Anthropology, Policy Analysis, Sociology",49
https://www.coursera.org/learn/master-raw-editing-in-affinity-photo,Master RAW Editing in Affinity Photo,Skillshare,,,Beginner level,,"Image Quality, Photography, Photo Editing, Post-Production",
https://www.coursera.org/learn/ai-basics-and-tools-for-creativity,AI Basics and Tools for Creativity,University of Michigan,"5,728",4.5,Beginner level,,"Music, Creative Design, Responsible AI, Image Analysis, Artificial Intelligence, Problem Solving, Critical Thinking, Creativity",64
https://www.coursera.org/learn/palatine-hill-archaeology-history,The Changing Landscape of Ancient Rome. Archaeology and History of the Palatine Hill,Sapienza University of Rome,"15,737",4.4,Beginner level,,"Data Collection, European History, Storytelling, Ancient History, Scientific Methods, Governance, Social Sciences, Investigation, Political Sciences, Research, Public History, Culture, Art History, World History",323
https://www.coursera.org/learn/max-weber,《新教伦理与资本主义精神》导读,Fudan University,"10,029",4.6,,1 week to complete,"Culture, Research Methodologies, European History, World History, Qualitative Research, Social Sciences, Political Sciences, Economics, Sociology, Ethical Standards And Conduct",132
https://www.coursera.org/learn/chinese-philosophy,中国哲学经典著作导读,Xi'an Jiaotong University,"39,994",4.5,,2 weeks to complete,"Systems Thinking, World History, Ethical Standards And Conduct, Liberal Arts, Ancient History, Culture, Human Learning",276
https://www.coursera.org/learn/mythology,Greek and Roman Mythology,University of Pennsylvania,"278,726",4.8,,3 weeks to complete,"Ancient History, Art History, Psychology, Liberal Arts, Cultural Diversity, Sociology, World History, Performing Arts, Anthropology","2,555"
https://www.coursera.org/learn/introduccion-arte-sonoro,Introducción al Arte Sonoro,Universitat de Barcelona,"10,074",4.8,Beginner level,,"Music Theory, Musical Composition, Liberal Arts, Art History, Vibrations, Experimentation, Psychology, Performing Arts, Music History, Aesthetics, Electronic Media, Music, Instrumental Music, Multimedia, Music Performance",286
https://www.coursera.org/learn/grabacion-musical,Grabación y postproducción musical dentro y fuera del estudio,Universidad Nacional Autónoma de México,"4,239",4.7,Intermediate level,,"Post-Production, Media Production, Musical Composition, Instrumental Music, Music, Editing",80
https://www.coursera.org/learn/bian-ju,编剧：像导演一样编剧,Fudan University,"5,219",4.8,,1 week to complete,"Creativity, Storytelling, Storyboarding, Content Creation, Writing",63
https://www.coursera.org/specializations/nomad-sculpt-for-beginners,Nomad Sculpt for Beginners Specialization,Skillshare,,,Beginner level,4 weeks to complete,"3D Assets, 3D Modeling, Animation and Game Design, Animations, Color Theory, Computer Graphic Techniques, Computer Graphics, Creative Design, Data Import/Export, Design Elements And Principles, Image Quality, User Interface (UI), Visualization (Computer Graphics)",
https://www.coursera.org/learn/music-and-social-action,Music and Social Action,Yale University,"25,701",4.7,,3 weeks to complete,"Case Studies, Public Affairs, Art History, Performing Arts, Social Impact, Cultural Diversity, Social Justice, Music, Liberal Arts, Community Development, Music History, Aesthetics, Classical Music, Education and Training",181
https://www.coursera.org/learn/advanced-videography-documentary-and-promo-editing,Advanced Videography: Documentary and Promo Editing,Skillshare,,,Intermediate level,,"Video Production, Design Reviews, Cinematography, Videography, Peer Review, Creativity, Photography, Post-Production, Video Editing",
https://www.coursera.org/learn/curanderismo-plants,Curanderismo: Traditional Healing Using Plants,University of New Mexico,"29,835",4.7,Beginner level,2 weeks at 10 hours a week,"Preventative Care, Health Education, Health Care, Pain Management, Cultural Diversity, Stress Management, Nutrition and Diet",232
https://www.coursera.org/learn/ethics-and-ai-a-philosophical-guide-to-responsible-use,Ethics and AI: A Philosophical Guide to Responsible Use,Northeastern University ,,,,2 weeks to complete,"Regulation and Legal Compliance, Research Methodologies, Governance, General Data Protection Regulation (GDPR), Scientific Methods, Ethical Standards And Conduct, Law, Regulation, and Compliance, Data Ethics, Oral Expression, Artificial Intelligence, Responsible AI, Computational Logic, Research",
https://www.coursera.org/specializations/grammygo-music-production-award-worthy-songs,Music Production: Crafting Award-Worthy Songs  Specialization,GRAMMY GO,"4,545",4.3,Beginner level,12 weeks to complete,"Creativity, Editing, Instrumental Music, Media Production, Music, Music Performance, Music Theory, Musical Composition, Post-Production, System Configuration",10
https://www.coursera.org/learn/personal-essay,Writing a Personal Essay,Wesleyan University,"14,235",4.5,,,"Storytelling, Detail Oriented, Organizational Skills, Writing, Personal Development, Overcoming Obstacles, Editing, Self-Awareness",89
https://www.coursera.org/learn/xila-zhexue,活用希臘哲學 (Understanding the Greek Philosophy),National Taiwan University,"14,958",4.9,Beginner level,2 weeks to complete,"Political Sciences, Ethical Standards And Conduct, Cultural Diversity, Liberal Arts, Research, Ancient History, European History, Scientific Methods, Social Studies",248
