url,title,partner,enroll,rating,level,duration,skills,reviews
https://www.coursera.org/learn/asian-american-history-identity-antiracism-toolkit,Asian American History and Identity: An Anti-Racism Toolkit,University of Colorado Boulder,,,Beginner level,2 weeks to complete,"Media and Communications, Social Justice, World History, Cultural Diversity, Intercultural Competence, Cultural Sensitivity, Diversity Awareness, Immigration Law, Community Organizing",
https://www.coursera.org/learn/korean-music-a-philosophical-exploration,"Korean Music, A Philosophical Exploration",Sungkyunkwan University,"1,552",4.8,Intermediate level,1 week to complete,"World Music, Music Theory, Music History, Music, Culture, Aesthetics, Cultural Diversity",11
https://www.coursera.org/learn/game-character-design,Character Design for Video Games,California Institute of the Arts,"55,968",4.7,Beginner level,,"Storytelling, Game Design, Animation and Game Design, Design, Design Elements And Principles, Video Game Development, Technical Design, Creative Design, Animations, Conceptual Design","1,003"
https://www.coursera.org/learn/make-comic-books,How to Make a Comic Book (Project-Centered Course),High Tech High Graduate School of Education,"67,388",4.6,,2 weeks to complete,"Peer Review, Graphic and Visual Design, Storytelling, Storyboarding, Layout Design, Creativity, Typography",282
https://www.coursera.org/specializations/blender-for-filmmakers-bring-your-vision-to-life,Blender for Filmmakers: Bring Your Vision to Life Specialization,Skillshare,,,Intermediate level,4 weeks to complete,"3D Assets, 3D Modeling, Animation and Game Design, Animations, Cinematography, Computer Graphics, File Management, Motion Graphics, Photo/Video Production and Technology, Post-Production, Video Editing, Video Production, Virtual Environment",
https://www.coursera.org/learn/english-composition,English Composition I,Duke University,"463,925",4.6,Beginner level,3 weeks at 10 hours a week,"Research, Case Studies, Editing, Research Methodologies, Report Writing, Peer Review, English Language, Literacy, Persuasive Communication, Ethical Standards And Conduct, Proofreading, Grammar, Style Guides","1,302"
https://www.coursera.org/learn/egitto,L’Egitto prima e dopo i faraoni. Dalla nascita dello Stato (3000 a.C. ca.) alle prime comunità cristiane (IV secolo d.C.),Sapienza University of Rome,"2,637",4.7,Beginner level,,"Cultural Diversity, Culture, Art History, World History, Ancient History",118
https://www.coursera.org/learn/launching-your-music-career,Launching Your Music Career,University of Colorado Boulder,,,Intermediate level,,"Business Management, Business Strategy, Performing Arts, Recruitment Strategies, Relationship Building, Business Modeling, Branding, Event Management, Portfolio Management, Recruitment, Entrepreneurship, Professional Networking, Growth Strategies, Value Propositions, Target Market, Music Performance, Marketing Strategies, Business Planning",
https://www.coursera.org/learn/introancientegypt,Introduction to Ancient Egypt and Its Civilization,University of Pennsylvania,"137,436",4.6,Intermediate level,,"Research Methodologies, Timelines, Ancient History, Anthropology, Art History, Social Studies, World History, Storytelling, Cultural Diversity, Investigation","2,900"
https://www.coursera.org/learn/daojiao,品读道家的智慧,Xi'an Jiaotong University,"3,980",4.7,Advanced level,2 weeks to complete,"Cultural Diversity, Ancient History, Social Sciences, Liberal Arts, Governance, Systems Thinking, Culture",72
https://www.coursera.org/learn/the-american-renaissance-and-mark--twain,The American Renaissance and Mark Twain,Dartmouth College,,,,,"Diversity Awareness, Culture, Storytelling, Research, Liberal Arts, Writing, Cultural Diversity",
https://www.coursera.org/learn/the-basics-of-libertarian-free-will,The Basics of Libertarian Free Will,Dartmouth College,"2,149",4.8,,,"Science and Research, Liberal Arts, Psychology, Research, Systems Thinking",11
https://www.coursera.org/learn/how-to-make-money-with-your-music-copyrights,How to Make Money with Your Music Copyrights,Berklee,"2,821",4.9,Intermediate level,,"Payment Processing and Collection, Revenue Recognition, Intellectual Property, Digital Assets, Registration, Entrepreneurship, Regulation and Legal Compliance, Revenue Management, Music",37
https://www.coursera.org/learn/historia-asia-oriental-japon-corea-china-taiwan,Asia Oriental en el s. XX: introducción desde la Historia,Universitat Autònoma de Barcelona,,4.7,Beginner level,2 weeks to complete,"Cultural Diversity, Economics, International Relations, Political Sciences, Economic Development, Diplomacy, Social Sciences, World History, Cultural Sensitivity, Governance",31
https://www.coursera.org/learn/write-a-feature-length-screenplay-for-film-or-television,Write A Feature Length Screenplay For Film Or Television,Michigan State University,"92,796",4.6,Beginner level,2.5 months at 10 hours a week,"Storytelling, Writing, Peer Review, Storyboarding, Writing and Editing",301
https://www.coursera.org/learn/el-holocausto,El Holocausto: el abismo de la humanidad,Yad Vashem ,"2,796",5.0,Beginner level,2 weeks at 10 hours a week,"Political Sciences, European History, Pedagogy, Teaching, Instructional Strategies, Educational Materials, Demography, Social Studies, World History, Lesson Planning, Cultural Diversity",41
https://www.coursera.org/learn/antisemitisme,L’antisémitisme : De ses origines à nos jours,Yad Vashem ,,,Beginner level,2 weeks to complete,"World History, International Relations, Cultural Diversity, Political Sciences, Social Justice, Ancient History, Anthropology, Social Studies, European History, Sociology",
https://www.coursera.org/specializations/creative-essay-writing-explore-the-personal-and-powerful,Creative Essay Writing: Explore the Personal & Powerful Specialization,Skillshare,"1,528",4.7,Beginner level,4 weeks to complete,"Content Creation, Creativity, Editing, Honesty, Investigation, Journalism, Journals, Lifelong Learning, Mindfulness, Peer Review, Persistence, Personal Development, Proofreading, Resilience, Self-Awareness, Self-Discipline, Self-Motivation, Storytelling, Writing, Writing and Editing",9
https://www.coursera.org/learn/in-depth-capcut-video-editing-masterclass-core-editing,In Depth CapCut Video Editing Masterclass: Core Editing,Skillshare,"5,682",4.5,Beginner level,,"Storytelling, Video Editing, Video Production, Timelines, Editing, Productivity",17
https://www.coursera.org/learn/the-red-chamber-dream-daguan-garden,又見大觀：《紅樓夢》中的烏托邦 (The Red Chamber Dream (3): Daguan Garden),National Taiwan University,"2,502",,Beginner level,2 weeks to complete,"Design, Design Elements And Principles, Aesthetics, Art History, Storytelling, Ancient History, Creativity",
https://www.coursera.org/learn/blender-for-filmmakers-turn-2d-photos-into-3d-scenes,Blender for Filmmakers: Turn 2D Photos into 3D Scenes,Skillshare,,,Intermediate level,,"Post-Production, 3D Modeling, Video Production, Animation and Game Design, Cinematography, Motion Graphics, Computer Graphics",
https://www.coursera.org/specializations/fashionasdesign,Fashion As Design Specialization,The Museum of Modern Art,,,Beginner level,4 weeks to complete,"Aesthetics, Creative Thinking, Creativity, Cultural Diversity, Design Elements And Principles, Ethical Standards And Conduct, Non-Verbal Communication, Performing Arts, Photography, Social Impact, Sustainability Standards",
https://www.coursera.org/learn/tecnica-violino-viola,PRINCÍPIOS GERAIS DA TÉCNICA DO VIOLINO E DA VIOLA DE ARCO,Universidade Estadual de Campinas,"3,776",4.9,Intermediate level,,"Classical Music, Coordination, Music Performance",77
https://www.coursera.org/learn/chinese-garden-literature-1,中國園林文學 (一) (Chinese Garden Literature (1)),National Taiwan University,"2,718",,Beginner level,2 weeks to complete,"Liberal Arts, Ancient History, Writing, Aesthetics, Creativity, Art History",
https://www.coursera.org/learn/surface-pattern-design-by-hand-repeat-patterns-on-paper,Surface Pattern Design by Hand: Repeat Patterns on Paper,Skillshare,,,Beginner level,,"Design, Creativity, Digital Design, Design Elements And Principles",
https://www.coursera.org/learn/modern-world-2,"The Modern World, Part Two: Global History since 1910",University of Virginia,"85,255",4.8,Beginner level,2 weeks at 10 hours a week,"Culture, Economics, Social Sciences, Governance, European History, International Relations, World History, Political Sciences","1,666"
https://www.coursera.org/learn/architettura-contemporanea,Introduzione alla Storia dell'Architettura Contemporanea,Politecnico di Milano,"8,563",4.8,Beginner level,,"Art History, Design Elements And Principles, European History, Architectural Design, Design, Architecture and Construction, Aesthetics",185
https://www.coursera.org/learn/accessibility-scenic-arts,Accessibility to the Scenic Arts,Universitat Autònoma de Barcelona,"3,494",4.7,Intermediate level,2 weeks to complete,"Coordination, Disabilities, Performing Arts, Needs Assessment, Diversity Equity and Inclusion Initiatives, Communication Strategies, Planning, Cultural Diversity, Web Content Accessibility Guidelines, Law, Regulation, and Compliance",34
https://www.coursera.org/learn/moneyball-and-globalization,Moneyball and Globalization,University of Colorado Boulder,,,Beginner level,,"Labor Relations, International Relations, Economic Development, Market Opportunities, Cultural Diversity, Governance, Global Marketing, Labor Law, Culture, Business Economics, Demography, Socioeconomics, Economics, World History",
https://www.coursera.org/learn/old-norse-mythology-sources,Old Norse Mythology in the Sources,University of Colorado Boulder,"22,549",4.6,Beginner level,,"Culture, Research, Storytelling, World History, Ancient History, European History, Language Interpretation, Translation, and Studies",370
https://www.coursera.org/learn/western-religions-ecology,Western Religions & Ecology,Yale University,"1,857",4.9,Beginner level,2 weeks to complete,"Intercultural Competence, Environmental Science, Ethical Standards And Conduct, Social Justice, Culture, Cultural Diversity, Environmental Issue, Sustainable Development, Advocacy, Liberal Arts",18
https://www.coursera.org/learn/mastering-natural-light-in-portrait-photography,Mastering Natural Light in Portrait Photography,Skillshare,,,Beginner level,,"Editing, Photo Editing, Photography, Image Quality",
https://www.coursera.org/learn/improvisacao-no-jazz,Improvisação no Jazz,Berklee,,4.6,Intermediate level,1 week to complete,"Music, Storytelling, Oral Expression, Music Theory, Creativity, Music Performance, Instrumental Music, Musical Composition",17
https://www.coursera.org/learn/metaphysics,Reality Bites: Introduction to metaphysics,Erasmus University Rotterdam,"4,171",4.5,Intermediate level,,Aesthetics,18
https://www.coursera.org/learn/inquiry-into-confucius-and-mencius,深扣孔孟 (An Inquiry into Confucius and Mencius),National Taiwan University,"2,030",,Beginner level,2 weeks to complete,"Education and Training, Social Sciences, Interpersonal Communications, Human Learning, Culture, Ethical Standards And Conduct, Human Development, Sociology, Family Support, Ancient History, Cultural Diversity, Political Sciences, Governance",
https://www.coursera.org/learn/what-is-news,What is news?,Michigan State University,"45,588",4.7,,2 weeks to complete,"Photo/Video Production and Technology, Blogs, Ethical Standards And Conduct, Content Creation, Driving engagement, Electronic Media, Journalism, Storytelling, Media and Communications, Multimedia","1,183"
https://www.coursera.org/learn/indigenous-canada,Indigenous Canada,University of Alberta,"643,576",4.8,Beginner level,2 weeks at 10 hours a week,"Civil Law, Natural Resource Management, Political Sciences, Environment and Resource Management, Sustainable Development","23,738"
https://www.coursera.org/learn/knowledge-first-social-epistemology,Knowledge-First Social Epistemology,University of Glasgow ,,,Intermediate level,1 week to complete,"Social Impact, Social Sciences, Investigation, Peer Review, Probability & Statistics, Research, Media and Communications, Cultural Responsiveness",
https://www.coursera.org/learn/wonders-ancient-egypt,Wonders of Ancient Egypt,University of Pennsylvania,"42,467",4.8,Intermediate level,1 week at 10 hours a week,"World History, Ancient History, Anthropology, Research Methodologies, Art History","1,045"
https://www.coursera.org/learn/fashion-silhouettes-icons,Fashion as Design: Silhouettes and Icons,The Museum of Modern Art,,,Beginner level,,"Storytelling, Design Elements And Principles",
https://www.coursera.org/learn/freelance-editing-launch--build-your-video-editing-career,Freelance Editing: Launch & Build Your Video Editing Career,Skillshare,"2,392",,,,"Post-Production, Self-Motivation, Video Production, Adaptability, Client Services, Price Negotiation, Video Editing, Entrepreneurship, Professional Networking, Customer Relationship Building, Goal Setting, Business Systems",
https://www.coursera.org/learn/visual-elements-user-interface-design,Visual Elements of User Interface Design,California Institute of the Arts,"289,313",4.7,Beginner level,2 weeks at 10 hours a week,"Design Elements And Principles, Graphic and Visual Design, User Experience Design, Graphic Design, Human Computer Interaction, Design, User Interface (UI) Design, Interaction Design, Layout Design, Information Architecture, Typography, Application Design","6,386"
https://www.coursera.org/learn/gabriel-garcia-marquez-poder-historia-amor,"Gabriel García Márquez entre el poder, la historia y el amor",Universidad de los Andes,"23,442",4.8,Beginner level,3 weeks at 10 hours a week,"Aesthetics, Timelines, Art History, Spanish Language, Literacy, World History, Writing, Storytelling",178
https://www.coursera.org/learn/ecologie-politique,Ecologie Politique: défi de la durabilité pour les démocraties,University of Lausanne,"7,543",4.8,Beginner level,1 week to complete,"Social Studies, Political Sciences, Governance, Environmental Policy, European History, Environmental Science, Environmental Issue, Sustainable Development, Public Policies, Economics",210
https://www.coursera.org/learn/cultura-maya-en-yucatan,Cultura Maya en Yucatán,Universidades Anáhuac,,,Beginner level,2 weeks to complete,"Social Sciences, Ancient History, Anthropology, Cultural Diversity, World History, Sociology, Art History",
https://www.coursera.org/learn/musicianship-final-project,Developing Your Musicianship: Final Project,Berklee,"3,658",4.9,Intermediate level,,"Music, Musical Composition, Music Theory, Music Performance, Peer Review",115
https://www.coursera.org/learn/interactive-media-gaming,"Online Games: Literature, New Media, and Narrative",Vanderbilt University,"23,213",4.6,Beginner level,2 weeks at 10 hours a week,"Interactive Learning, Psychology, Multimedia, Animation and Game Design, Art History, Game Design, Storytelling, Media and Communications, Video Game Development",203
https://www.coursera.org/learn/fl-studio-basics,FL Studio Basics,Berklee,"8,920",4.5,Intermediate level,1 week to complete,"Automation, File Management, Music, Electronic Media, Editing, Creativity, System Configuration, Media Production, Musical Composition, Music Performance, Music Theory",15
https://www.coursera.org/specializations/music-career-toolbox-managing-your-portfolio-career,Musician’s Professional Toolbox: Your Portfolio Career Specialization,University of Colorado Boulder,,4.9,Intermediate level,4 weeks to complete,"Brand Strategy, Branding, Business Modeling, Business Planning, Business Strategy, Competitive Analysis, Goal Setting, Market Research, Marketing, Marketing Materials, Photo/Video Production and Technology, Presentations, Prioritization, Productivity, Professional Networking, Promotional Materials, Recruitment, Social Media, Target Audience, Time Management",17
https://www.coursera.org/learn/youtube-video-editing-in-fcpx---from-beginner-to-pro,YouTube Video Editing in FCPX - From beginner to Pro,Skillshare,,,Beginner level,,"Photo/Video Production and Technology, Content Creation, Timelines, Video Production, File Management, Motion Graphics, Storytelling, Post-Production, Video Editing",
https://www.coursera.org/learn/activism-sports-culture,Activism in Sports and Culture,Morehouse College,"2,083",4.9,Beginner level,2 weeks to complete,"Social Studies, Media and Communications, Social Justice, Writing, Social Sciences, Cultural Responsiveness, Sociology, Oral Expression, Journalism",17
https://www.coursera.org/learn/elements-and-principles-of-visual-communication,Elements and Principles of Visual Communication,University of Colorado Boulder,,,Intermediate level,1 week to complete,"Color Theory, Creativity, Psychology, Media and Communications, Art History, Visual Design, Design Elements And Principles, Typography, Design, Graphic and Visual Design",
https://www.coursera.org/learn/know-thyself-the-unconscious,Know Thyself - The Value and Limits of Self-Knowledge: The Unconscious,The University of Edinburgh,"92,398",4.7,Intermediate level,2 weeks at 10 hours a week,"Behavioral Economics, Child Development, Scientific Methods, Decision Making, Psychology, Self-Awareness",824
https://www.coursera.org/learn/cinematic-video-editing--master-exciting-youtube-intros,Cinematic Video Editing : Master Exciting Youtube Intro's,Skillshare,,,Intermediate level,,"Image Quality, Post-Production, Timelines, Cinematography, Motion Graphics, Color Theory, Adobe Premiere, Video Editing",
https://www.coursera.org/learn/conspiracy-planet,Conspiracy Planet,"University of California, Santa Cruz","3,141",4.4,Beginner level,1 week to complete,"Political Sciences, Social Sciences, World History, Research, Systems Thinking, Investigation, Content Creation, Social Impact, Peer Review, Storytelling, Discussion Facilitation",41
https://www.coursera.org/learn/intellectual-humility-practice,Intellectual Humility: Practice,The University of Edinburgh,"14,985",4.7,Beginner level,2 weeks at 10 hours a week,"Open Mindset, Empathy, Diversity Awareness, Decision Making, Critical Thinking, Research, Emotional Intelligence",153
https://www.coursera.org/learn/mind-of-the-universe-science-in-progress,Mind of the Universe: Science in Progress,Erasmus University Rotterdam,"6,285",4.4,Beginner level,,"Research, Critical Thinking, Innovation, Scientific Methods, Research Methodologies, Interpersonal Communications, Creative Thinking",16
https://www.coursera.org/learn/music-production-capstone,Music Production Capstone,Berklee,"5,650",4.8,Intermediate level,,"Music Performance, Post-Production, Musical Composition, Peer Review, Editing, Media Production, Coordination, Music",126
https://www.coursera.org/learn/cinematography--videography-guide-camera-basics,Cinematography & Videography Guide: Camera Basics,Skillshare,"1,513",,Beginner level,,"Photography, Video Production, Cinematography, Image Quality, Videography, Photo/Video Production and Technology",
https://www.coursera.org/learn/zhongri-jiaoliushi,中日文化交流史,Peking University,"3,055",4.7,Beginner level,2 weeks to complete,,41
https://www.coursera.org/learn/inteligencia-artificial-aplicada-a-la-produccion-musical,Inteligencia Artificial aplicada a la Producción Musical,Universidad de Palermo,,,Beginner level,1 week to complete,"Automation, Creativity, Music History, Artificial Intelligence, Post-Production, Musical Composition, AI Enablement, Music",
https://www.coursera.org/learn/disenarconconciencia-innovacionartesanaldesdelossaberesancestrales,Diseñar con Conciencia: Innovación Artesanal desde los Saberes Ancestrales,Pontificia Universidad Católica del Perú,,,Beginner level,,"Collaboration, Sustainability Standards, Cultural Sensitivity, Ethical Standards And Conduct, Cultural Diversity, Design Thinking, Innovation, Community Development, Sustainable Development, Research and Design, Creativity",
https://www.coursera.org/learn/the-american-renaissance-and-herman-melville,The American Renaissance and Herman Melville,Dartmouth College,,,,,"Storytelling, Liberal Arts, Writing, World History, Culture",
https://www.coursera.org/specializations/photography-basics,Photography Basics and Beyond: From Smartphone to DSLR Specialization,Michigan State University,"151,828",4.7,Beginner level,3 months to complete,"Content Creation, Copywriting, Creative Design, Creativity, Design Elements And Principles, Digital Publishing, File Management, Graphic and Visual Design, Image Quality, Information Privacy, Peer Review, Photo Editing, Photo/Video Production and Technology, Photography, Social Media, Storytelling, Web Design and Development, Writing","6,676"
https://www.coursera.org/specializations/video-editing-filmmaking-masterclass,Video Editing & Filmmaking Masterclass Specialization,Skillshare,,4.3,Beginner level,4 weeks to complete,"Animations, Cinematography, Color Matching, Color Theory, Content Creation, Data Storage, File Management, Ideation, Image Quality, Motion Graphics, Multimedia, Post-Production, Storyboarding, Storytelling, Timelines, Video Editing, Video Production, Videography",31
https://www.coursera.org/learn/blender-for-filmmakers-create-floating-3d-objects,Blender for Filmmakers: Create Floating 3D Objects,Skillshare,,,Intermediate level,,"Computer Graphics, Post-Production, Animation and Game Design, Video Editing, 3D Assets, Motion Graphics, 3D Modeling, Virtual Environment",
https://www.coursera.org/learn/archoftitus,Arch of Titus: Rome and the Menorah,Yeshiva University,"12,027",4.5,,1 week to complete,"Art History, Timelines, Color Theory, Research, World History, Ancient History, Cultural Diversity, Storytelling",123
https://www.coursera.org/learn/the-making-of-modern-ukraine,The Making of Modern Ukraine,Yale University,"2,862",4.7,Beginner level,2 weeks to complete,"Economics, Social Justice, Political Sciences, Sociology, Social Sciences, Socioeconomics, Ancient History, World History, European History, Governance, Culture, International Relations, Public Safety and National Security",16
https://www.coursera.org/learn/aristotle,Ancient Philosophy: Aristotle and His Successors,University of Pennsylvania,"74,469",4.8,,2 weeks to complete,"Research, World History, European History, Political Sciences, Psychology, Ethical Standards And Conduct, Anthropology, Ancient History, Liberal Arts",776
https://www.coursera.org/learn/intellectual-humility-theory,Intellectual Humility: Theory,The University of Edinburgh,"31,934",4.5,Beginner level,2 weeks at 10 hours a week,"Software Testing, Open Mindset, Psychological Evaluations, Self-Awareness, Ethical Standards And Conduct, Psychology, Learning Theory, Emotional Intelligence, Surveys, Cognitive flexibility, Curiosity",374
https://www.coursera.org/learn/revolutionary-ideas-utility-justice-equality-freedom,"Revolutionary Ideas: Utility, Justice, Equality, Freedom",Rutgers the State University of New Jersey,"29,433",4.7,Beginner level,2 weeks at 10 hours a week,"Governance, Social Sciences, Social Justice, Law, Regulation, and Compliance, Economics, Ethical Standards And Conduct, Political Sciences, Research, Policy Analysis",360
https://www.coursera.org/learn/wei-dian-ying-chuang-zuo,创作吧！微影人！,Fudan University,,,,2 weeks to complete,"Video Editing, Creativity, Editing, Writing, Storytelling, Peer Review, Writing and Editing, Scripting, Storyboarding, Content Creation, Cinematography, Video Production",
https://www.coursera.org/learn/modern-middle-east-2,The Emergence of the Modern Middle East - Part II,Tel Aviv University,"20,272",4.8,,1 week to complete,"Political Sciences, Governance, Policy Analysis, International Relations, World History, Culture, Socioeconomics",519
https://www.coursera.org/learn/affinity-photo-beyond-the-basics--pro-compositing,Affinity Photo: Beyond the Basics – Pro Compositing,Skillshare,,,Intermediate level,,"Photo Editing, Photography, Graphic and Visual Design, Color Matching, Image Quality",
https://www.coursera.org/learn/concept-art-video-games,Concept Art for Video Games,Michigan State University,"11,618",4.6,"In this course we will talk about Concept Art. As a final project we will create a fully finished environment concept, ready for presentation. Throughout the 4 week modules will dive deeply into composition and digital painting techniques to bring your art skills to the next level! So, let's get started!","In this course we will talk about Concept Art. As a final project we will create a fully finished environment concept, ready for presentation. Throughout the 4 week modules will dive deeply into composition and digital painting techniques to bring your art skills to the next level! So, let's get started!","Video Game Development, Conceptual Design, 3D Assets, Computer Graphics, Animation and Game Design, Graphic and Visual Design, Data Import/Export, Design Elements And Principles, 3D Modeling",113
https://www.coursera.org/learn/holocaust-introduction-1,"The Holocaust - An Introduction (I): Nazi Germany: Ideology, The Jews and the World",Tel Aviv University,"68,135",4.8,,I always week when I read or study about the Holocaust but I am happy it got over once for all. Learned so much about how the world shunned them away into darkness. Thank you.,"Social Impact, Policy Analysis, World History, Cultural Diversity, Teaching, Research Methodologies, Research, Social Justice, European History, Student Engagement","1,430"
https://www.coursera.org/learn/animated-storytelling-emotive-animation-in-procreate-dreams,Animated Storytelling: Emotive Animation in Procreate Dreams,Skillshare,,,Beginner level,,"Musical Composition, Motion Graphics, Storytelling, Animations, Video Editing, Storyboarding",
