url,title,partner,enroll,rating,level,duration,skills,reviews,category
https://www.coursera.org/specializations/ai-for-mechanical-engineers,AI for Mechanical Engineers Specialization,University of Michigan,"8,346",4.4,Intermediate level,4 weeks to complete,"AI Enablement, Artificial Intelligence, Artificial Intelligence and Machine Learning (AI/ML), Bioinformatics, Biomedical Engineering, Computer Vision, Control Systems, Deep Learning, Electric Power Systems, Energy and Utilities, Machine Learning, Machine Learning Algorithms, Machine Learning Methods, Medical Imaging, Precision Medicine, Reinforcement Learning, Robotics, Technical Design, Transfer Learning",143,Physical Science and Engineering
https://www.coursera.org/learn/mechanics-particles-planets,"Mechanics: Motion, Forces, Energy and Gravity, from Particles to Planets",UNSW Sydney (The University of New South Wales),"75,127",4.7,Beginner level,2 weeks at 10 hours a week,"Physical Science, Experimentation, Mechanics, Mathematical Modeling, Physics, Engineering Analysis, Estimation, Applied Mathematics, Engineering Calculations","1,079",Physical Science and Engineering
https://www.coursera.org/learn/crystal-structures-and-properties-of-metals,Crystal Structures and Properties of Metals,Arizona State University,"3,961",4.8,Beginner level,2 weeks to complete,"Engineering, Failure Analysis, Materials science, Structural Analysis, Engineering Calculations, Chemical Engineering, Semiconductors, Laboratory Testing, Mechanical Engineering",39,Physical Science and Engineering
https://www.coursera.org/specializations/industrial-power-systems-analysis-and-stability,Industrial Power Systems Analysis and Stability Specialization,L&T EduTech,"2,596",4.5,Intermediate level,4 weeks to complete,"Control Systems, Differential Equations, Electric Power Systems, Electrical Engineering, Electrical Equipment, Electrical Power, Electrical Systems, Engineering Analysis, Graph Theory, High Voltage, Low Voltage, Mathematical Modeling, Network Analysis, Numerical Analysis, Power Electronics, Simulation and Simulation Software, Simulations, Systems Analysis, Three-Phase, Wiring Diagram",46,Physical Science and Engineering
https://www.coursera.org/learn/statistical-thermodynamics,Statistical Molecular Thermodynamics,University of Minnesota,"26,318",4.9,Beginner level,2 weeks at 10 hours a week,"Physics, Molecular, Cellular, and Microbiology, Engineering Calculations, Mathematical Modeling, Chemistry",367,Physical Science and Engineering
https://www.coursera.org/learn/intro-chemistry,Introduction to Chemistry:  Reactions and Ratios,Duke University,"138,429",4.7,Beginner level,2 weeks at 10 hours a week,"Physics, Chemistry, Materials science, Analytical Chemistry, Systems Of Measurement, Scientific Methods, Laboratory Research","1,381",Physical Science and Engineering
https://www.coursera.org/learn/our-earth,"Our Earth: Its Climate, History, and Processes",University of Manchester   ,"35,197",4.7,Beginner level,1 week at 10 hours a week,"Biology, Climate Change Adaptation, Environment, Mathematical Modeling, Simulations, Environmental Science, Chemistry, Hydrology, Physical Science, Scientific Methods, Water Resources",471,Physical Science and Engineering
https://www.coursera.org/learn/systems-engineering-fundamentals,Systems Engineering Fundamentals,University of Colorado System,,,Intermediate level,,"Requirements Elicitation, System Requirements, Functional Design, Risk Management, Configuration Management, Systems Analysis, Waterfall Methodology, Systems Development Life Cycle, Systems Engineering, Engineering Management, Systems Architecture, Project Management, Requirements Analysis",,Physical Science and Engineering
https://www.coursera.org/specializations/renewable-energy,Renewable Energy Specialization,University of Colorado Boulder,"26,875",4.8,Beginner level,4 weeks to complete,"Basic Electrical Systems, Climate Change Mitigation, Construction Management, Electric Power Systems, Electrical Power, Emerging Technologies, Energy and Utilities, Engineering, Environmental Issue, Feasibility Studies, Financial Analysis, Market Dynamics, Mechanical Engineering, Plant Operations and Management, Project Finance, Project Implementation, Project Management, Project Management Life Cycle, Sustainable Technologies, Systems Of Measurement","1,321",Physical Science and Engineering
https://www.coursera.org/learn/averagedswitchmodelingandsimulation,Averaged-Switch Modeling and Simulation,University of Colorado Boulder,"11,091",4.7,Intermediate level,2 weeks at 10 hours a week,"Control Systems, Electronics Engineering, Model Based Systems Engineering, Systems Design, Engineering Analysis, Simulations, Electronics, Power Electronics, Electronic Systems, Systems Analysis, Mathematical Modeling, Verification And Validation, Electrical Engineering",88,Physical Science and Engineering
https://www.coursera.org/learn/batteries-and-electric-vehicles,Batteries and Electric Vehicles,Arizona State University,"9,397",4.6,Beginner level,,"Safety Standards, Electrical Power, Materials science, Manufacturing and Production, Energy and Utilities, Environmental Regulations, Emerging Technologies, Reliability, Environmental Issue, Sustainable Technologies",116,Physical Science and Engineering
https://www.coursera.org/learn/converter-circuits,Converter Circuits,University of Colorado Boulder,"55,169",4.8,Intermediate level,2 weeks at 10 hours a week,"Electrical Engineering, Simulation and Simulation Software, Semiconductors, Power Electronics, Electronics Engineering, Electrical Power, Electronic Components, Electronics","1,391",Physical Science and Engineering
https://www.coursera.org/learn/microwave-antenna,Microwave engineering and antennas,Eindhoven University of Technology,"26,950",4.6,Intermediate level,4 weeks at 10 hours a week,"Telecommunications, Process Design, Engineering Calculations, Engineering Analysis, Engineering Design Process, Wireless Networks, Electronic Systems, Simulation and Simulation Software, Electrical Engineering, Electronics Engineering",154,Physical Science and Engineering
https://www.coursera.org/learn/fire-detection--fire-alarm-systems-and-safety-signages,Fire Detection & Fire Alarm Systems and Safety Signages,L&T EduTech,"2,519",4.6,Intermediate level,,"Building Codes, Construction Inspection, Systems Integration, Safety and Security, Safety Standards, Continuous Monitoring, System Monitoring, Safety Training, Control Systems, Fire And Life Safety, Technical Standard, Electrical Systems, Building Services Engineering, Communication Systems",36,Physical Science and Engineering
https://www.coursera.org/learn/sustainability-social-ecological-systems,"Sustainability of Social-Ecological Systems: the Nexus between Water, Energy and Food",Universitat Autònoma de Barcelona,"18,244",4.5,Intermediate level,2 weeks at 10 hours a week,"Water Resource Management, Social Impact, Policy Analysis, Environment and Resource Management, Data Storytelling, Data Literacy, Dealing With Ambiguity, Environmental Science, Quantitative Research, Analysis, Case Studies, Energy and Utilities, Sustainable Development, Complex Problem Solving, Systems Thinking, Sustainability Standards",107,Physical Science and Engineering
https://www.coursera.org/learn/nanotechnology1,"Nanotechnology and Nanosensors, Part1",Technion - Israel Institute of Technology,"77,139",4.6,,1 week to complete,"Emerging Technologies, Biomedical Engineering, Laboratory Testing, Semiconductors, Electronics, Chemical Engineering, Analytical Testing, Materials science, Innovation","1,216",Physical Science and Engineering
https://www.coursera.org/learn/requirements-writing,Requirements Writing,UNSW Sydney (The University of New South Wales),"23,787",4.6,Beginner level,,"Technical Communication, Requirements Management, Editing, Technical Writing, Engineering Documentation, Project Documentation, Verification And Validation, Requirements Analysis, Business Writing, Functional Specification, System Requirements, Business Requirements, Systems Engineering, Product Requirements",355,Physical Science and Engineering
https://www.coursera.org/learn/energy-and-environment,Energy and Environment,Dartmouth College,"7,706",4.8,Beginner level,2 weeks to complete,"Oil and Gas, Environmental Engineering, Sustainable Technologies, Physics, Climate Change Mitigation, Sustainable Development, Electric Power Systems, Environment, Energy and Utilities, Environmental Science",101,Physical Science and Engineering
https://www.coursera.org/learn/explore-the-mechanical-designer-role,Explore the Mechanical Designer Role,Dassault Systèmes,,,Beginner level,,"Mechanical Engineering, Product Engineering, Technical Drawing, Engineering Drawings, Engineering Design Process, Mechanical Design, Computer-Aided Design, Assembly Drawing, 3D Modeling, Product Development, Manufacturing and Production",,Physical Science and Engineering
https://www.coursera.org/specializations/wetland-science-and-conservation,Wetland Science and Conservation Specialization,University of Illinois Urbana-Champaign,,4.9,Intermediate level,2 months to complete,"Case Studies, Climate Change Adaptation, Community Outreach, Cultural Diversity, Cultural Sensitivity, Environment and Resource Management, Environmental Engineering, Environmental Engineering and Restoration, Environmental Laws, Environmental Monitoring, Environmental Resource Management, Hydrology, Land Management, Natural Resource Management, Policy Analysis, Social Sciences, Stakeholder Engagement, Water Quality, Water Resource Management, Water Resources",17,Physical Science and Engineering
https://www.coursera.org/learn/high-voltage-schottky-and-p-n-diodes,High Voltage Schottky and p-n Diodes,University of Colorado Boulder,,,Intermediate level,2 weeks to complete,"Electronics, Power Electronics, Electronic Components, High Voltage, Electronics Engineering, Simulation and Simulation Software, Semiconductors",,Physical Science and Engineering
https://www.coursera.org/learn/fisica-sperimentale-meccanica-termodinamica,"Introduzione alla fisica sperimentale: meccanica, termodinamica",Politecnico di Milano,"3,120",4.6,Beginner level,2 weeks to complete,"Engineering Analysis, Physics, Physical Science, Mechanics, Systems Of Measurement, Hydraulics, Calculus, Experimentation, Engineering Calculations, Thermal Management",27,Physical Science and Engineering
https://www.coursera.org/learn/new-fermentation-markets-and-how-they-scale,New Fermentation Markets and How They Scale,University of Illinois Urbana-Champaign,,,Beginner level,,"Process Engineering, Innovation, Food and Beverage, Scalability, Biotechnology, Global Marketing, Chemical Engineering, Sustainability Standards, Manufacturing and Production, Product Development, Market Trend, Sustainable Technologies, Market Analysis, Microbiology, Workforce Development",,Physical Science and Engineering
https://www.coursera.org/learn/material-behavior,Material Behavior,Georgia Institute of Technology,"45,831",4.8,,3 weeks to complete,"Semiconductors, Chemical Engineering, Materials science, Structural Analysis, Physical Science, Mechanical Engineering, Chemistry","1,309",Physical Science and Engineering
https://www.coursera.org/learn/introduction-to-engineering-design,Introduction to Engineering Design,Starweaver,"2,518",4.9,Beginner level,,"Engineering, Engineering Design Process, Sustainable Design, Problem Solving, Product Engineering, Mechanical Design, Automation, Emerging Technologies, Analytical Skills, Artificial Intelligence and Machine Learning (AI/ML), Prototyping, Simulation and Simulation Software, Computer-Aided Design, Innovation, Conceptual Design, Creativity",12,Physical Science and Engineering
https://www.coursera.org/learn/thermodynamics-and-phase-equilibria,Thermodynamics and Phase Equilibria,Korea Advanced Institute of Science and Technology(KAIST),,,Intermediate level,1 week to complete,"Physics, Engineering Calculations, Physical Science, Materials science, Thermal Management, Engineering, Mechanics, Applied Mathematics",,Physical Science and Engineering
https://www.coursera.org/learn/rfmicrowave-design---antenna-design,RF/Microwave Design - Antenna Design,Coursera,,,Intermediate level,,"Business Workflow Analysis, Engineering Design Process, Communication Systems, Verification And Validation, Prototyping, Electrical Engineering, Wireless Networks, Electronics, Radiation Protection, Electronics Engineering, Simulations, Digital Communications, Technical Design, Network Troubleshooting, Simulation and Simulation Software, Workflow Management, Telecommunications",,Physical Science and Engineering
https://www.coursera.org/learn/astro,Astronomy: Exploring Time and Space,University of Arizona,"264,805",4.8,Beginner level,5 weeks at 10 hours a week,"Global Positioning Systems, Scientific Visualization, Research, Chemistry, Ancient History, Physics, Simulations, Biology, Physical Science, Engineering, Scientific, and Technical Instruments, Scientific Methods","3,971",Physical Science and Engineering
https://www.coursera.org/learn/aiml-applications-in-oil-and-gas-industry,AI & ML Applications in Oil and Gas Industry,L&T EduTech,"5,448",4.8,Beginner level,,"Image Analysis, Artificial Intelligence, Production Process, Natural Resource Management, Oil and Gas, Geostatistics, Big Data, Process Engineering, Anomaly Detection, Data Management, Exploratory Data Analysis, Machine Learning, Petroleum Industry, Physical Science, Data Processing, Artificial Intelligence and Machine Learning (AI/ML)",60,Physical Science and Engineering
https://www.coursera.org/learn/physical-modeling-with-simscape,Designing and Simulating Physical Models,MathWorks,"1,597",4.8,Beginner level,,"Model Based Systems Engineering, Mathematical Modeling, Engineering Design Process, Control Systems, Engineering, Engineering Software, Engineering Analysis, Robotics, Mechanical Engineering, Simulation and Simulation Software",11,Physical Science and Engineering
https://www.coursera.org/learn/xdesign-foundations-sketching-and-extrusion,xDesign Foundations: Sketching and Extrusion,Dassault Systèmes,"1,745",4.2,Beginner level,,"Mechanical Engineering, Mechanical Design, Engineering Design Process, Computer-Aided Design, 3D Modeling",12,Physical Science and Engineering
https://www.coursera.org/learn/medical-image-processing,Medical Image Processing,MathWorks,"6,978",4.7,Beginner level,,"X-Ray Computed Tomography, Data Import/Export, Deep Learning, Biomedical Engineering, Magnetic Resonance Imaging, Image Analysis, Medical Imaging, Scientific Visualization",27,Physical Science and Engineering
https://www.coursera.org/specializations/design-and-construction-of-hydropower-structures,Design and Construction of Hydropower Structures Specialization,L&T EduTech,,,Advanced level,4 weeks to complete,"Civil Engineering, Construction, Construction Engineering, Construction Management, Electric Power Systems, Electrical Equipment, Electrical Power, Energy and Utilities, Engineering Analysis, Environmental Engineering, Geospatial Mapping, Hydraulics, Hydrology, Mechanical Design, Mechanical Engineering, Safety Standards, Structural Analysis, Structural Engineering, Water Quality, Water Resource Management",,Physical Science and Engineering
https://www.coursera.org/learn/water-treatment,Introduction to Household Water Treatment and Safe Storage,École Polytechnique Fédérale de Lausanne,"29,775",4.8,Intermediate level,1 week at 10 hours a week,"Environmental Engineering, Sanitation, Water Quality, Water Resource Management, Public Health, Governance, Microbiology, Economics, Chemistry","1,092",Physical Science and Engineering
https://www.coursera.org/specializations/image-processing,Image Processing for Engineering and Science Specialization,MathWorks,"9,198",4.7,Beginner level,4 weeks to complete,"Algorithms, Anomaly Detection, Automation, Computer Vision, Data Preprocessing, Data Store, Digital Signal Processing, Geospatial Information and Technology, Image Analysis, Image Quality, Medical Imaging, Quantitative Research, Spatial Analysis, Spatial Data Analysis, Traffic Flow Optimization",249,Physical Science and Engineering
https://www.coursera.org/learn/shape-and-property-control-of-metals-1-and-2,Shape and Property Control of Metals I & II,Arizona State University,"1,944",4.9,Beginner level,2 weeks to complete,"Thermal Management, Semiconductors, Manufacturing Processes, Materials science, Failure Analysis, Mechanical Engineering, Reliability, Engineering Calculations",22,Physical Science and Engineering
https://www.coursera.org/learn/engineering-of-structures-compression,Engineering of Structures: Compression,Dartmouth College,"2,625",4.8,Beginner level,1 week to complete,"Materials science, Structural Analysis, Engineering Analysis, Architectural Engineering, Construction, Engineering Design Process, Civil Engineering, Mechanics, Building Design, Structural Engineering",30,Physical Science and Engineering
https://www.coursera.org/learn/how-can-we-measure-and-study-human-error,How Can We Measure and Study Human Error?,Arizona State University,,4.8,Intermediate level,,"User Experience Design, Research Methodologies, Human Computer Interaction, Experimentation, Case Studies, Research Design, Usability Testing, Data Collection, Human Centered Design, Usability, User Interface (UI), Qualitative Research, User Research",10,Physical Science and Engineering
https://www.coursera.org/learn/general-chemistry,General Chemistry: Concept Development and Application,Rice University,"101,403",4.7,,2 weeks to complete,"Chemistry, Experimentation, General Science and Research, Materials science, Laboratory Research, Scientific Methods, Estimation, Analytical Chemistry, Physical Science","1,265",Physical Science and Engineering
https://www.coursera.org/learn/modernrobotics-course2-ko,"현대 로봇공학, 강좌 2: 로봇 기구학",Northwestern University,,,Intermediate level,2 weeks to complete,"Machine Controls, Linear Algebra, Engineering Calculations, Mechanics, Torque (Physics), Engineering Analysis, Automation Engineering, Robotics, Mechanical Design, Structural Analysis, Control Systems, Mathematical Modeling, Spatial Analysis",,Physical Science and Engineering
https://www.coursera.org/learn/being-researcher,Being a researcher (in Information Science and Technology),Politecnico di Milano,"19,543",4.8,Beginner level,,"Technical Writing, Scientific Methods, Informed Consent, Intellectual Property, Data Integrity, Research, Data Sharing, Ethical Standards And Conduct, Data Ethics, Innovation",208,Physical Science and Engineering
https://www.coursera.org/learn/transistor-field-effect-transistor-bipolar-junction-transistor,Transistor - Field Effect Transistor and Bipolar Junction Transistor,University of Colorado Boulder,"14,118",4.3,Advanced level,1 week at 10 hours a week,"Electronic Components, Electrical and Computer Engineering, Electronics Engineering, Electronics, Electrical Engineering, Semiconductors",91,Physical Science and Engineering
https://www.coursera.org/learn/ingenieria-trafico,Ingeniería de Tráfico,Pontificia Universidad Católica de Chile,"12,459",4.8,Beginner level,,"Mathematical Modeling, Simulations, Engineering Analysis, Traffic Flow Optimization, Transportation Operations, Network Analysis",456,Physical Science and Engineering
https://www.coursera.org/learn/materials-science,Materials Science: 10 Things Every Engineer Should Know,"University of California, Davis","109,985",4.7,,,"Electrical Engineering, Electronic Components, Failure Analysis, Engineering, Mechanical Engineering, Electronics Engineering, Semiconductors, Structural Analysis, Thermal Management, Materials science, Chemical Engineering","4,523",Physical Science and Engineering
https://www.coursera.org/learn/pet-politics-and-pandemics,"Pets, Politics and Pandemics",Columbia University,,,Beginner level,1 week to complete,"Policy Analysis, Scientific Methods, Social Justice, Persuasive Communication, Political Sciences, Personal Development, Systems Thinking, Complex Problem Solving, Social Sciences, Economics, Policy, and Social Studies, Critical Thinking, Culture, Human Learning",,Physical Science and Engineering
https://www.coursera.org/learn/modernrobotics-course4,"Modern Robotics, Course 4:  Robot Motion Planning and Control",Northwestern University,"15,489",4.9,Intermediate level,3 weeks to complete,"Simulation and Simulation Software, Linear Algebra, Robotics, Automation, Mathematical Modeling, Data Structures, Virtual Environment, Artificial Intelligence, Control Systems, Graph Theory, Algorithms",139,Physical Science and Engineering
https://www.coursera.org/learn/getting-there-and-going-beyond,Getting There and Going Beyond,University of Colorado Boulder,,5.0,Beginner level,3 weeks to complete,"Automation, Engineering, Systems Integration, Systems Engineering, Physical Science, Thermal Management, System Testing, Robotics, Human Factors, Control Systems, Mechanics, Structural Engineering, Environmental Monitoring, Communication Systems, Electric Power Systems, Aerospace Basic Quality System Standards, Global Positioning Systems, Engineering Design Process",10,Physical Science and Engineering
https://www.coursera.org/learn/engineering-foundation-for-building-energy-systems,Engineering Foundation for Building Energy Systems,University of Colorado Boulder,,,Advanced level,4 weeks to complete,"Building Design, Engineering Calculations, Energy and Utilities, Engineering, Building Services Engineering, Architectural Engineering, Sustainable Engineering, Engineering Analysis, Thermal Management, Climate Change Mitigation, HVAC",,Physical Science and Engineering
https://www.coursera.org/specializations/managing-major-engineering-projects,Managing Major Engineering Projects Specialization,University of Leeds,"18,901",4.7,Intermediate level,2 months to complete,"Business Risk Management, Contract Management, Engineering Management, Financial Analysis, Governance, Program Management, Project Design, Project Finance, Project Implementation, Project Management, Project Management Life Cycle, Project Performance, Project Risk Management, Project Scoping, Return On Investment, Risk Management, Scope Management, Stakeholder Analysis, Stakeholder Engagement, Stakeholder Management","1,232",Physical Science and Engineering
https://www.coursera.org/learn/energy-environment-life,"Energy, Environment, and Everyday Life",University of Illinois Urbana-Champaign,"23,888",4.7,Beginner level,5 weeks at 10 hours a week,"Climate Change Mitigation, Emerging Technologies, Environment, Sustainable Technologies, Economics, Oil and Gas, Energy and Utilities, Physics, Environmental Science, Electrical Power, Chemistry",221,Physical Science and Engineering
https://www.coursera.org/learn/abc-sostenibilidad,El ABC de la sostenibilidad,Campus BBVA,"8,406",4.8,Beginner level,1 week at 10 hours a week,"Sustainability Reporting, Stakeholder Engagement, Environment and Resource Management, Diversity Awareness, Economic Development, Socioeconomics, Sustainable Systems, Environmental Social And Corporate Governance (ESG), Sustainable Development, Health Equity, Sustainable Business, Corporate Sustainability, Climate Change Adaptation, Environment, Social Justice, Environmental Science, Water Sustainability",360,Physical Science and Engineering
https://www.coursera.org/learn/foundation-systems-monitoring-and-erection-methods,"Foundation Systems, Monitoring and Erection Methods",L&T EduTech,,,Advanced level,2 weeks to complete,"Structural Engineering, Engineering, Continuous Monitoring, Structural Analysis, Civil Engineering, Maintenance, Repair, and Facility Services, Engineering Design Process, Property Maintenance, Engineering Practices, Failure Analysis, Engineering Calculations, Construction, Architecture and Construction, Construction Engineering, Environmental Monitoring",,Physical Science and Engineering
https://www.coursera.org/learn/da-xue-hua-xue,大学化学,Peking University,"10,487",4.9,,3 weeks to complete,"Experimentation, Engineering, Scientific, and Technical Instruments, Materials science, Chemistry, Physical Science, Energy and Utilities, Physics",139,Physical Science and Engineering
https://www.coursera.org/specializations/chemical-hazards-and-process-safety,Chemical Hazards and Process Safety Specialization,"University of California, Davis","8,457",4.8,Advanced level,16 weeks to complete,"Accident Prevention, Chemical Engineering, Engineering Analysis, Environment Health And Safety, Failure Analysis, Hazard Analysis, Hazard Communication (HazCom), Incident Management, Occupational Health, Personal protective equipment, Process Control, Process Engineering, Risk Analysis, Risk Management, Risk Management Framework, Risk Mitigation, Safety and Security, Safety Assurance, Safety Standards, Safety Training",315,Physical Science and Engineering
https://www.coursera.org/specializations/fpga-design,FPGA Design for Embedded Systems Specialization,University of Colorado Boulder,"30,899",4.5,Intermediate level,2 months to complete,"Application Specific Integrated Circuits, Computer Architecture, Debugging, Electrical and Computer Engineering, Electronic Hardware, Electronic Systems, Electronics Engineering, Embedded Systems, Engineering Documentation, Hardware Architecture, Hardware Design, Laboratory Experience, Software Development, Software Development Tools, Systems Design, Test Case, Verification And Validation","1,734",Physical Science and Engineering
https://www.coursera.org/learn/tesoros-de-la-fisica,Tesoros de la Física y sus Descubridores I,Universidad de los Andes,"38,218",4.8,Beginner level,4 weeks at 10 hours a week,"Scientific Methods, Experimentation, Mechanics, General Science and Research, European History, World History, Physics, Ancient History, Energy and Utilities",859,Physical Science and Engineering
