url,title,partner,enroll,rating,level,duration,skills,reviews,category
https://www.coursera.org/specializations/wetland-science-and-management-fundamentals-to-conservation,Wetland Science & Management: Fundamentals to Conservation Specialization,University of Illinois Urbana-Champaign,,4.9,Intermediate level,4 weeks to complete,"Biology, Climate Change Adaptation, Environment, Environment and Resource Management, Environmental Engineering and Restoration, Environmental Monitoring, Environmental Science, Geospatial Information and Technology, Hydrology, Laboratory Testing, Land Management, Microbiology, Natural Resource Management, Research Reports, Technical Documentation, Water Quality, Water Resource Management, Water Resources",15,Physical Science and Engineering
https://www.coursera.org/learn/physics-102-electric-potential-and-dc-circuits,Physics 102 - Electric Potential and DC Circuits,Rice University,"6,206",4.8,Intermediate level,2 weeks to complete,"Physics, Electronic Components, Calculus, Problem Solving, Basic Electrical Systems, Electronics, Linear Algebra, Electrical Systems, Integral Calculus, Mechanics, Electrical Engineering",33,Physical Science and Engineering
https://www.coursera.org/learn/structural-scheme-setting-and-etabs-analysis-of-rcc-building,Structural scheme setting and ETABS Analysis of RCC Building,L&T EduTech,"3,552",4.7,Intermediate level,1 week to complete,"Engineering Calculations, Building Design, Engineering Software, Construction, Structural Engineering, Architectural Engineering, Structural Analysis, Civil and Architectural Engineering, Architectural Drawing, Building Codes, Engineering Design Process",22,Physical Science and Engineering
https://www.coursera.org/learn/modeling-and-control-of-single-phase-rectifiers-and-inverters,Modeling and Control of Single-Phase Rectifiers and Inverters,University of Colorado Boulder,"8,339",4.6,Intermediate level,1 week at 10 hours a week,"Power Electronics, Electronics Engineering, Electrical Engineering, Simulations, Mathematical Modeling, Electric Power Systems, Electronics, Control Systems",34,Physical Science and Engineering
https://www.coursera.org/learn/financing-major-engineering-projects,Financing and Initiating Major Engineering Projects,University of Leeds,"8,564",4.7,Intermediate level,2 weeks at 10 hours a week,"Case Studies, Financial Analysis, Governance, Project Design, Stakeholder Management, Engineering Management, Finance, Return On Investment, Risk Management, Cost Benefit Analysis, Project Finance, Contract Management, Procurement, Project Management, Project Implementation",271,Physical Science and Engineering
https://www.coursera.org/learn/physics-101-energy-momentum,Physics 101 - Energy and Momentum,Rice University,"9,183",4.5,Intermediate level,2 weeks to complete,"Mechanics, Engineering Analysis, Engineering Calculations, Physical Science, Mathematical Modeling, Physics, Problem Solving, Mechanical Engineering, Calculus",44,Physical Science and Engineering
https://www.coursera.org/learn/solar-energy-system-design,Solar Energy System Design,The State University of New York,"35,342",4.7,Intermediate level,2 weeks at 10 hours a week,"Wiring Diagram, Estimation, Electronic Components, Electric Power Systems, Equipment Design, Electrical Power, Performance Testing, Sustainable Design, System Requirements, Basic Electrical Systems, Engineering Calculations, Electrical Safety, Energy and Utilities, Physical Science",473,Physical Science and Engineering
https://www.coursera.org/specializations/iot,An Introduction to Programming the Internet of Things (IOT) Specialization,"University of California, Irvine","181,192",4.7,Beginner level,2 months to complete,"Automation Engineering, Basic Electrical Systems, Debugging, Electronic Components, Electronics, Embedded Systems, Functional Requirement, Internet Of Things, Network Protocols, Operating System Administration, Requirements Analysis, Systems Design, TCP/IP, Test Planning, User Requirements Documents","20,440",Physical Science and Engineering
https://www.coursera.org/learn/agile-systems-engineering-leadership,Agile Systems Engineering Leadership,University of Colorado System,,,Intermediate level,,"Team Building, Team Management, Motivational Skills, Organizational Structure, Leadership, Team Motivation, Employee Engagement, Engineering Management, Agile Methodology, Leadership and Management, Teamwork, Organizational Leadership, Conflict Management, Systems Engineering",,Physical Science and Engineering
https://www.coursera.org/learn/climate-science-everyone,Climate Science for Everyone,Duke University,"2,900",4.9,Beginner level,,"Climate Change Mitigation, Environment, International Relations, Natural Resource Management, Environmental Policy, Community Development, Mathematical Modeling, Pollution Prevention, Sustainable Development, Climate Change Programs, Trend Analysis, Mental Health, Social Impact, Data Collection, Simulations, Environmental Science, Climate Change Adaptation",22,Physical Science and Engineering
https://www.coursera.org/learn/thermodynamics-intro,Introduction to Thermodynamics: Transferring Energy from Here to There,University of Michigan,"149,442",4.8,Beginner level,2 weeks at 10 hours a week,"Thermal Management, Systems Of Measurement, Process Analysis, Physical Science, Engineering, Energy and Utilities, Mechanical Engineering, Environmental Issue, Engineering Analysis, Physics","3,485",Physical Science and Engineering
https://www.coursera.org/specializations/environmental-science,Introduction to Environmental Science Specialization,Dartmouth College,"9,994",4.7,Beginner level,2 months to complete,"Biology, Chemistry, Climate Change Mitigation, Demography, Electric Power Systems, Energy and Utilities, Environment, Environmental Engineering, Environmental Issue, Environmental Science, Hydrology, Natural Resource Management, Nutrition and Diet, Oil and Gas, Physics, Sustainable Development, Sustainable Technologies, Systems Thinking, Water Quality, Water Resource Management",445,Physical Science and Engineering
https://www.coursera.org/learn/systems-biology-capstone,Systems Biology and Biotechnology Capstone,Icahn School of Medicine at Mount Sinai,,4.5,,,"Systems Engineering, Bioinformatics, Systems Integration, Biotechnology, Data Integration, Biology, Research, Data Synthesis, Simulation and Simulation Software, Laboratory Testing, Mathematical Modeling, Network Analysis",12,Physical Science and Engineering
https://www.coursera.org/learn/transferencia-de-momentum-calor-y-masa-computacional,"Transferencia de momentum, calor y masa computacional",Pontificia Universidad Católica de Chile,,,Intermediate level,3 weeks to complete,"Mathematical Modeling, Differential Equations, Chemical Engineering, Plot (Graphics), Engineering Calculations, Finite Element Methods, Linear Algebra, Simulation and Simulation Software, Applied Mathematics, Numerical Analysis, Algorithms, Scientific Visualization, Engineering Analysis",,Physical Science and Engineering
https://www.coursera.org/learn/basis-flight-mechanics,Flight mechanics - The basis,ISAE-SUPAERO,"26,908",4.7,Beginner level,,"Applied Mathematics, Simulations, Engineering Analysis, Engineering Calculations, Physics, Systems Of Measurement, Mechanics",494,Physical Science and Engineering
https://www.coursera.org/learn/zn-and-ni-based-batteries,Zn and Ni Based Batteries,Arizona State University,"4,134",4.6,Beginner level,,"Electronics, Materials science, Market Trend, Energy and Utilities, Chemical Engineering, Electrical Systems, Chemistry, Manufacturing Processes",26,Physical Science and Engineering
https://www.coursera.org/learn/origins-universe-solarsystem,"Origins - Formation of the Universe, Solar System, Earth and Life",University of Copenhagen,"36,418",4.7,,2 weeks to complete,"Anthropology, Climate Change Adaptation, Taxonomy, Environment, Ancient History, Chemistry, Environmental Science, Microbiology, Physical Science, Biochemistry, Biology, Scientific Methods, World History",643,Physical Science and Engineering
https://www.coursera.org/specializations/solar-energy,"Solar Energy for Engineers, Architects and Code Inspectors Specialization",University at Buffalo,"19,420",4.7,Beginner level,4 weeks to complete,"Architectural Design, Architectural Engineering, Basic Electrical Systems, Building Codes, Building Design, Construction Inspection, Cost Benefit Analysis, Design Reviews, Electrical Power, Electrical Safety, Electrical Systems, Electrical Wiring, Energy and Utilities, Engineering Calculations, HVAC, Land Development, Mechanical Design, Semiconductors, Submittals (Construction), System Requirements","1,467",Physical Science and Engineering
https://www.coursera.org/learn/disaster-risk-management-korean-policies,Disaster Risk Management and Korean Policies,Yonsei University,"4,879",4.7,Intermediate level,2 weeks to complete,"Disaster Recovery, World History, Systems Thinking, Risk Management Framework, Case Studies, Public Policies, Policty Analysis, Research, and Development, Geospatial Information and Technology, Mitigation, Environmental Policy, Emergency Response",91,Physical Science and Engineering
https://www.coursera.org/learn/image-segmentation,"Image Segmentation, Filtering, and Region Analysis",MathWorks,"11,519",4.8,Beginner level,,"Image Quality, Image Analysis, Algorithms, Computer Vision, Spatial Analysis, Medical Imaging, Digital Signal Processing, Spatial Data Analysis",54,Physical Science and Engineering
https://www.coursera.org/learn/introduction-to-hse-engineering,Introduction to HSE Engineering,Khalifa University,"7,606",4.7,Beginner level,,"Risk Management, Accident Prevention, Regulatory Compliance, Legal Risk, Safety Standards, Hazard Analysis, Environment Health And Safety, Occupational Health, Safety Audits, Safety Training",113,Physical Science and Engineering
https://www.coursera.org/learn/ciencia-de-datos-energticos,Ciencia de datos energéticos,Universidad Nacional de Colombia,"2,883",4.9,Intermediate level,3 weeks to complete,"Electric Power Systems, Data Science, Data Preprocessing, Data Visualization Software, Artificial Neural Networks, Time Series Analysis and Forecasting, Regression Analysis, Statistical Methods, Data Mining, Classification And Regression Tree (CART), Data Manipulation",33,Physical Science and Engineering
https://www.coursera.org/learn/object-tracking-and-motion-computer-vision,Object Tracking and Motion Detection with Computer Vision,MathWorks,"10,389",4.7,Beginner level,1 week to complete,"Machine Learning Methods, Computer Vision, Deep Learning, Convolutional Neural Networks, Image Analysis, Transfer Learning, Traffic Flow Optimization",34,Physical Science and Engineering
https://www.coursera.org/specializations/modernrobotics,"Modern Robotics:  Mechanics, Planning, and Control Specialization",Northwestern University,"43,838",4.7,Intermediate level,4 months to complete,"Applied Mathematics, Artificial Intelligence, Automation, Automation Engineering, Control Systems, Engineering, Engineering Analysis, Engineering Calculations, Graph Theory, Machine Controls, Mathematical Modeling, Mechanical Engineering, Mechanics, Robotics, Simulation and Simulation Software, Torque (Physics), Vibrations, Virtual Environment","1,220",Physical Science and Engineering
https://www.coursera.org/learn/engineering-mechanics-statics-2,Applications in Engineering Mechanics,Georgia Institute of Technology,"74,283",4.8,,2 weeks to complete,"Structural Engineering, Engineering, Mechanics, Engineering Analysis, Mechanical Engineering, Structural Analysis","1,193",Physical Science and Engineering
https://www.coursera.org/learn/agroforestry5,"Agroforestry V: Ecosystem Services, Food and Sustainability",University of Florida,"3,043",4.8,Intermediate level,,"Water Resources, Water Resource Management, Biology, Environment, Land Management, Systems Thinking, Natural Resource Management, Sustainable Development, Sustainable Systems, Environmental Science, Sustainability Standards, Environment and Resource Management",28,Physical Science and Engineering
https://www.coursera.org/learn/understanding-modern-physics-2-quantum-mechanics-and-atoms,Understanding Modern Physics II: Quantum Mechanics and Atoms,The Hong Kong University of Science and Technology,"11,493",4.6,Beginner level,1 week to complete,"Informatics, Physics, Physical Science, Mathematical Modeling, Experimentation, Mechanics, Advanced Mathematics",67,Physical Science and Engineering
https://www.coursera.org/learn/spacecraft-relative-motion-kinematics-and-kinetics,Spacecraft Relative Motion Kinematics and Kinetics,University of Colorado Boulder,,4.9,Advanced level,3 weeks to complete,"Engineering Analysis, Advanced Mathematics, Trigonometry, Calculus, Differential Equations, Linear Algebra, Applied Mathematics, Mechanics, Mathematical Modeling, Physics",11,Physical Science and Engineering
https://www.coursera.org/learn/rigid-body-dynamics,Rigid Body Dynamics,Korea Advanced Institute of Science and Technology(KAIST),"4,633",4.6,Intermediate level,1 week to complete,"Mechanics, Mechanical Engineering, Engineering Analysis, Applied Mathematics, Torque (Physics), Calculus, Vibrations, Physics",27,Physical Science and Engineering
https://www.coursera.org/learn/electrical-power-generation-an-industrial-outlook,Electrical Power Generation - An Industrial Outlook,L&T EduTech,"16,345",4.5,Beginner level,1 week to complete,"Automation Engineering, Basic Electrical Systems, Plant Operations and Management, Power Electronics, Three-Phase, Electrical Systems, Electrical Engineering, Electrical Substation, High Voltage, Electric Power Systems, Electrical Power, Control Systems, Energy and Utilities, Process Control, Electrical Equipment",142,Physical Science and Engineering
https://www.coursera.org/learn/intro-to-environmental-science,Introduction to Environmental Science,O.P. Jindal Global University,,4.7,Beginner level,,"Biology, Community Health, Pollution Prevention, Climate Change Mitigation, Social Impact, Water Quality, Chemistry, Case Studies, Climate Change Adaptation, Sustainable Development, Environment, Natural Resource Management, Environmental Issue, Environmental Science",12,Physical Science and Engineering
https://www.coursera.org/learn/two-phase-pipe-hydraulics-and-pipe-sizing,Two-Phase Pipe Hydraulics and Pipe Sizing,L&T EduTech,"2,469",4.8,Intermediate level,1 week to complete,"Chemical Engineering, Petroleum Industry, Engineering Analysis, Hydraulics, Oil and Gas, Process Analysis, Process Engineering, Mechanical Engineering, Engineering Calculations, Mathematical Modeling",14,Physical Science and Engineering
https://www.coursera.org/learn/electron-and-ion-beam-characterization,Electron and Ion Beam Characterization,Arizona State University,"1,662",4.8,Intermediate level,,"Failure Analysis, Materials science, Analytical Testing, Image Analysis, Analytical Chemistry, Quantitative Research, Engineering, Scientific, and Technical Instruments, Electronics, Laboratory Testing, Scientific Visualization, Laboratory Equipment, Electronic Components, Qualitative Research, Semiconductors",17,Physical Science and Engineering
https://www.coursera.org/learn/pavement-materials-and-design,Pavement Materials and Design (IRC and MoRTH),L&T EduTech,,,Advanced level,1 week to complete,"Civil Engineering, Civil and Architectural Engineering, Laboratory Testing, Materials science, Construction, Engineering Software, Engineering Analysis, Construction Engineering, Engineering Design Process, Structural Analysis, Engineering Calculations, Technical Standard",,Physical Science and Engineering
https://www.coursera.org/learn/hydrogen-key-concepts-and-use-in-green-technologies,Hydrogen: Key Concepts and Use in Green Technologies,Technical University of Denmark (DTU),"1,588",4.7,Intermediate level,8 weeks to complete,"Sustainable Technologies, Case Studies, Mathematical Modeling, Research Reports, Production Process, Engineering Calculations, Materials science",15,Physical Science and Engineering
https://www.coursera.org/learn/basic-electronics-odc,Basic Electronics,"Birla Institute of Technology & Science, Pilani","4,325",,Beginner level,4 weeks to complete,"Electronics, Control Systems, Power Electronics, Applied Mathematics, Electrical Systems, Electronics Engineering, Network Analysis, Semiconductors, Electrical Engineering, Electronic Systems, Engineering Analysis, Engineering Calculations, Basic Electrical Systems, Electronic Components",,Physical Science and Engineering
https://www.coursera.org/learn/engineering-and-product-design-processes,Engineering and Product Design Processes,Arizona State University,"7,015",4.6,Beginner level,,"Product Design, User Feedback, Design Specifications, Research and Design, Engineering Drawings, Product Development, Hardware Design, Engineering Design Process, Prototyping, Ideation",87,Physical Science and Engineering
https://www.coursera.org/learn/gis-data,"GIS Data Formats, Design and Quality","University of California, Davis","49,983",4.8,Intermediate level,3 weeks at 10 hours a week,"Geospatial Mapping, Spatial Analysis, Data Manipulation, Data Quality, Data Sharing, Data Modeling, Data Management, Data Mapping, ArcGIS, Data Storage, Analytics","2,108",Physical Science and Engineering
https://www.coursera.org/learn/modeling-simulation-natural-processes,Simulation and modeling of natural processes,University of Geneva,"47,319",4.3,,2 weeks to complete,"Simulations, Numerical Analysis, Mathematical Modeling, Physics, Statistical Methods, Mechanics, Probability Distribution",412,Physical Science and Engineering
https://www.coursera.org/learn/power-electronics,Introduction to Power Electronics,University of Colorado Boulder,"132,811",4.7,Intermediate level,1 week at 10 hours a week,"Electrical Systems, Electronic Systems, Simulations, USB, Power Electronics, Simulation and Simulation Software, Electronics, Electrical Engineering, Electric Power Systems","3,542",Physical Science and Engineering
https://www.coursera.org/learn/agroforestry1,Agroforestry I: Principles and Practices,University of Florida,"5,533",4.8,Intermediate level,2 weeks to complete,"Environment, Sustainability Standards, Environmental Science, Natural Resource Management, Research, Biology, Land Management, Sustainable Development, Environment and Resource Management, Climate Change Mitigation",66,Physical Science and Engineering
https://www.coursera.org/learn/pavement-construction-practices-irc-and-morth,Pavement Construction Practices  (IRC and MoRTH),L&T EduTech,,,Advanced level,,"Laboratory Testing, Construction, Civil and Architectural Engineering, Construction Engineering, Construction Management, Building Codes, Engineering Plans And Specifications, Safety Standards, Engineering Practices, Plant Operations and Management, Construction Inspection, Civil Engineering",,Physical Science and Engineering
https://www.coursera.org/specializations/electric-vehicle-systems-and-technologies,Electric Vehicle Systems and Technologies Specialization,Coursera,"2,316",4.3,Intermediate level,4 weeks to complete,"Basic Electrical Systems, Electric Power Systems, Electrical Engineering, Electrical Power, Electrical Safety, Electrical Systems, Electronic Components, Electronic Systems, Energy and Utilities, Environment and Resource Management, Environmental Engineering and Restoration, Environmental Issue, Environmental Regulations, Geospatial Information and Technology, HVAC, Maintenance, Repair, and Facility Services, Power Electronics, Safety Standards, Sustainable Technologies, Thermal Management",258,Physical Science and Engineering
https://www.coursera.org/learn/material-jetting-and-stereolithography,Material Jetting and Stereolithography,Arizona State University,"1,824",4.8,Intermediate level,,"Materials science, Process Engineering, Analytical Testing, Equipment Design, Manufacturing Processes, Process Development, Experimentation, Manufacturing Operations, Production Process, Prototyping, Laboratory Experience",26,Physical Science and Engineering
https://www.coursera.org/learn/particle-physics,Particle Physics: an Introduction,University of Geneva,"87,200",4.4,,4 weeks to complete,"Physical Science, Radiation Protection, Mechanics, Physics, Research, Materials science, Experimentation, Laboratory Equipment",962,Physical Science and Engineering
https://www.coursera.org/learn/cyber-physical-systems-1,Cyber-Physical Systems: Modeling and Simulation,"University of California, Santa Cruz","12,275",4.6,Intermediate level,1 week to complete,"Systems Design, Mathematical Modeling, Embedded Systems, Systems Analysis, Simulations, Digital Communications, Control Systems, Computational Logic, Cyber Engineering, Model Based Systems Engineering",53,Physical Science and Engineering
https://www.coursera.org/specializations/energy-industry,"Energy Production, Distribution & Safety Specialization",The State University of New York,"67,707",4.7,Beginner level,4 weeks to complete,"Basic Electrical Systems, Billing, Electric Power Systems, Electrical Equipment, Electrical Power, Electrical Substation, Electrical Systems, Energy and Utilities, Environmental Regulations, Hazard Analysis, Occupational Safety and Health Administration (OSHA), Oil and Gas, Personal protective equipment, Regulatory Affairs, Safety Standards, Safety Training, Supply Chain, Sustainable Development, Sustainable Technologies, Workforce Development","11,051",Physical Science and Engineering
https://www.coursera.org/learn/lift-flight-mechanics,Flight mechanics - Lift and trajectory,ISAE-SUPAERO,"4,590",4.7,Intermediate level,,"Mechanics, Vibrations, Risk Control, Engineering Analysis, Hazard Analysis, Mathematical Modeling, Engineering Calculations",73,Physical Science and Engineering
https://www.coursera.org/learn/modelling-simulation-mechanical-systems,Modelling and simulation of mechanical systems,Università di Napoli Federico II,"4,131",4.4,Intermediate level,1 week to complete,"Automation, Robotics, Electronic Systems, Laboratory Experience, Mechanical Design, Computer Vision, Mathematical Modeling, Control Systems, Experimentation, Hydraulics, Mechanical Engineering, Vibrations, Simulation and Simulation Software, Equipment Design",26,Physical Science and Engineering
https://www.coursera.org/learn/energy-industry-overview,Energy: The Enterprise,University at Buffalo,"24,379",4.8,Beginner level,2 weeks at 10 hours a week,"Emerging Technologies, Operational Efficiency, Sustainable Technologies, Environmental Science, Workforce Development, Sustainable Development, Innovation, Electric Power Systems, Market Dynamics, Climate Change Mitigation, Environment and Resource Management, Energy and Utilities","1,111",Physical Science and Engineering
https://www.coursera.org/learn/electric-power-systems,Electric Power Systems,University at Buffalo,"136,892",4.7,Beginner level,1 week at 10 hours a week,"High Voltage, Electrical Substation, Sustainable Technologies, Electrical Systems, Low Voltage, Energy and Utilities, Basic Electrical Systems, Electrical Equipment, Electric Power Systems, Electrical Power, Electrical Safety","7,708",Physical Science and Engineering
https://www.coursera.org/learn/physics-102-electric-charges-fields,Physics 102 - Electric Charges and Fields,Rice University,"25,493",4.7,Intermediate level,2 weeks at 10 hours a week,"Mechanics, Calculus, Basic Electrical Systems, Electrical Engineering, Problem Solving, Engineering Calculations, Trigonometry, Physics, Mathematical Modeling, Applied Mathematics",200,Physical Science and Engineering
https://www.coursera.org/learn/materials-structures,"Mechanics of Materials IV: Deflections, Buckling, Combined Loading & Failure Theories",Georgia Institute of Technology,"31,965",4.8,Intermediate level,,"Civil Engineering, Structural Analysis, Engineering Design Process, Failure Analysis, Engineering Analysis, Mechanics, Calculus, Engineering Calculations, Mechanical Engineering",807,Physical Science and Engineering
https://www.coursera.org/specializations/metro-rail-systems-and-construction,Metro Rail Systems and Construction  Specialization,L&T EduTech,,4.7,Intermediate level,4 weeks to complete,"Architectural Design, Building Codes, Building Information Modeling, Civil Engineering, Construction, Construction Engineering, Construction Inspection, Construction Management, Electrical Systems, Emerging Technologies, Engineering Analysis, Engineering Design Process, Engineering Practices, Laboratory Testing, Planning, Quality Assurance, Simulation and Simulation Software, Structural Analysis, Structural Engineering, Transportation Operations",26,Physical Science and Engineering
https://www.coursera.org/learn/intro-astronomy-nju,走进天文学,Nanjing University,"2,829",4.9,Beginner level,1 week to complete,"General Science and Research, Engineering, Scientific, and Technical Instruments, Mechanics, Physical Science, Scientific Methods, Research, Physics, Laboratory Equipment",237,Physical Science and Engineering
https://www.coursera.org/learn/seismology-to-earthquakes,Seismology to Earthquake Engineering,École Polytechnique,"7,177",4.2,Intermediate level,2 weeks to complete,"Experimentation, Mathematical Modeling, Hazard Analysis, Structural Engineering, Physical Science, Simulation and Simulation Software, Structural Analysis, Laboratory Testing, Mechanics, Engineering Analysis, Civil Engineering, Engineering, Vibrations, Engineering Calculations",39,Physical Science and Engineering
