url,title,partner,enroll,rating,level,duration,skills,reviews
https://www.coursera.org/learn/zhexue-daolun,哲学导论（中文版）,The University of Edinburgh,"23,287",4.8,,2 weeks to complete,"Scientific Methods, Artificial Intelligence, Deductive Reasoning, Liberal Arts",206
https://www.coursera.org/learn/modpo,Modern & Contemporary American Poetry (“ModPo”),University of Pennsylvania,"98,472",4.8,Beginner level,2 months at 10 hours a week,"Language Interpretation, Translation, and Studies, World History, Literacy, Performing Arts, English Language, Liberal Arts",668
https://www.coursera.org/learn/bulletproof-3-communication-surgery,Bulletproof 3. Communication Surgery,SAE Institute México,,,Advanced level,,"Non-Verbal Communication, Overcoming Obstacles, Interpersonal Communications, Social Skills, Verbal Communication Skills, Empathy, Communication, Composure, Resilience, Active Listening",
https://www.coursera.org/learn/music-ensembles,Fundamentals of Rehearsing Music Ensembles,The University of North Carolina at Chapel Hill,"20,408",4.9,,2 weeks to complete,"Music, Choral Music, Music Performance, Instrumental Music, Classical Music, Coordination, Oral Expression, Music Theory",420
https://www.coursera.org/learn/transmedia-writing,Transmedia Writing,Michigan State University,"17,145",4.4,Beginner level,2 weeks to complete,"Storytelling, Peer Review, Video Game Development, Storyboarding, Active Listening, Writing, Creative Thinking, Game Design, Content Creation, Constructive Feedback",66
https://www.coursera.org/learn/philosophy-science-religion-2,"Philosophy, Science and Religion: Philosophy and Religion",The University of Edinburgh,"39,882",4.6,Beginner level,3 weeks at 10 hours a week,"Psychology, Social Sciences, Anthropology, Cultural Diversity, Scientific Methods, Sociology, Research, Discussion Facilitation",528
https://www.coursera.org/specializations/affinity-photo-editing-mastery,Affinity Photo Editing Mastery Specialization,Skillshare,,,Beginner level,4 weeks to complete,"Automation, Color Theory, Editing, File Management, Graphic and Visual Design, Image Quality, Photo Editing, Photography, Post-Production, Storytelling, Typography",
https://www.coursera.org/learn/jazz-improvisation,Jazz Improvisation,Berklee,"74,263",4.8,Intermediate level,1 week at 10 hours a week,"Musical Composition, Oral Expression, Music, Music Performance, Music Theory, Storytelling",789
https://www.coursera.org/learn/importance-power-music-our-society,The Importance and Power of Music in our Society,Universiteit Leiden,"13,574",4.6,Beginner level,2 weeks at 10 hours a week,"Socioeconomics, Sociology, Social Impact, Ethical Standards And Conduct, Psychology, Economics, Policy, and Social Studies, Culture, Liberal Arts, Political Sciences, Social Studies, Social Sciences, Music",72
https://www.coursera.org/specializations/level-up-inaffinity-photo-intermediate-to-advanced-skills,Level Up in Affinity Photo: Intermediate to Advanced Skills Specialization,Skillshare,,,Beginner level,4 weeks to complete,"Color Matching, Color Theory, Computer Graphic Techniques, Editing, Graphic and Visual Design, Image Quality, Photo Editing, Photography",
https://www.coursera.org/learn/ancient-greeks,The Ancient Greeks,Wesleyan University,"117,283",4.7,,2 weeks to complete,"World History, Ancient History, Scientific Methods, Political Sciences, European History, Governance, Anthropology, Cultural Sensitivity, Art History","2,107"
https://www.coursera.org/learn/the-red-chamber-dream,紅樓夢(The Red Chamber Dream),National Taiwan University,"9,633",4.8,"It is a good chance to improve the ability to learn Chinese's culture,how to know the past people's life in the different level degree,from gongqin wang to qinhuan lindaiyu,and so on.",2 weeks to complete,"Storytelling, Interpersonal Communications, Socioeconomics, Sociology, Psychology, Culture, Empathy & Emotional Intelligence, World History, Cultural Diversity, Aesthetics",61
https://www.coursera.org/learn/davinci-resolve-19-masterclass-video-editing-basics,DaVinci Resolve 19 Masterclass: Video Editing Basics,Skillshare,"5,472",4.3,,,"Video Production, Color Matching, Timelines, Animations, Video Editing, Data Import/Export, Configuration Management, Typography, File Management, Motion Graphics, Post-Production, Editing",24
https://www.coursera.org/learn/the-american-renaissance-and-harriet-beecher-stowe,The American Renaissance and Harriet Beecher Stowe,Dartmouth College,,,,,"Liberal Arts, Storytelling, World History, Writing",
https://www.coursera.org/learn/christianity-ecology,Christianity & Ecology,Yale University,"2,992",4.2,Beginner level,2 weeks to complete,"Climate Change Adaptation, Environmental Issue, World History, Social Justice, Ethical Standards And Conduct, Climate Change Mitigation, Culture, Community Development, Sustainable Development, Anthropology",18
https://www.coursera.org/learn/music-theory,Getting Started With Music Theory,Michigan State University,"120,396",4.5,Beginner level,1 week at 10 hours a week,"Musical Composition, Classical Music, Music Theory, Music",758
https://www.coursera.org/learn/historia-de-las-relaciones-internacionales,Historia de las Relaciones Internacionales,Universidad de Palermo,,4.9,Beginner level,2 weeks to complete,"Economics, European History, Political Sciences, Diplomacy, Security Strategy, International Relations, World History",11
https://www.coursera.org/learn/music-theory-essentials-of-music-theory-for-modern-music,Music Theory: Essentials of Music Theory for Modern Music,Skillshare,,,Beginner level,,"Musical Composition, Music Theory, Instrumental Music, Media Production, Music",
https://www.coursera.org/learn/adobe-lightroom-essentials-pt-3-advanced-edits-presets,Adobe Lightroom Essentials Pt. 3: Advanced Edits & Presets,Skillshare,,,Beginner level,1 week to complete,"Post-Production, Video Editing, Photography, Image Quality, Photo Editing, Creative Design, Color Theory",
https://www.coursera.org/learn/davinci-resolve-19-masterclass-advanced-effects--exporting,DaVinci Resolve 19 Masterclass: Advanced Effects & Exporting,Skillshare,,,,,"Image Quality, Video Production, Photo/Video Production and Technology, Motion Graphics, Video Editing, Cinematography, Color Theory, Animations, Post-Production",
https://www.coursera.org/specializations/singer-songwriter,The Singer Songwriter Specialization,Berklee,"29,260",4.8,Beginner level,4 weeks to complete,"Automation, Creativity, Editing, File Management, Instrumental Music, Media Production, Music, Music Performance, Music Theory, Musical Composition, Performing Arts, Self-Awareness, Technical Support, Verbal Communication Skills","4,304"
https://www.coursera.org/learn/360-vr-video-production,VR and 360 Video Production,Google AR & VR,"37,679",4.7,Beginner level,1 week at 10 hours a week,"Augmented and Virtual Reality (AR/VR), Video Production, Editing, Virtual Reality, Post-Production, Cinematography, Virtual Environment, Photo/Video Production and Technology, Media Production",897
https://www.coursera.org/learn/musicianship-harmony,"Musicianship: Tensions, Harmonic Function, and Modal Interchange",Berklee,"29,262",4.9,Intermediate level,,"Music Performance, Music Theory, Music, Musical Composition",403
https://www.coursera.org/learn/structuring-values-modern-china,Structuring Values in Modern China,The Chinese University of Hong Kong,"5,273",4.7,,3 weeks to complete,"Social Studies, Ancient History, World History, Culture, Political Sciences, Science and Research, Sociology, Economics, Cultural Diversity, Social Sciences, Research",36
https://www.coursera.org/learn/technology-of-music-production,The Technology of Music Production,Berklee,"77,163",4.8,Beginner level,2 weeks at 10 hours a week,"Creativity, File Management, Media Production, System Configuration, Music, Digital Signal Processing, Editing","1,083"
https://www.coursera.org/learn/discover-acting,Discover Acting,University of London,"18,621",4.9,Beginner level,1 week at 10 hours a week,"Literacy, Self-Awareness, Adaptability, Performing Arts, Creativity, Oral Expression, Analytical Skills, Mindfulness, Verbal Communication Skills, Storytelling",217
https://www.coursera.org/learn/historical-fiction,"Plagues, Witches, and War: The Worlds of Historical Fiction",University of Virginia,"112,052",4.6,Beginner level,2 weeks at 10 hours a week,"World History, European History, Creativity, Writing, Storytelling, Liberal Arts, Public History, Writing and Editing",630
https://www.coursera.org/learn/visual-literary-culture-in-japan,Words Spun Out of Images: Visual and Literary Culture in Nineteenth Century Japan,The University of Tokyo,"29,854",4.8,Beginner level,3 weeks at 10 hours a week,"Art History, Research",770
https://www.coursera.org/learn/produccion-musical,Introducción a la producción de música,Berklee,"17,798",4.7,,2 weeks to complete,"Music, System Configuration, Editing, Musical Composition, Instrumental Music, File Management, Media Production",264
https://www.coursera.org/learn/how-to-read-a-novel,How to Read a Novel,The University of Edinburgh,"7,448",4.7,Beginner level,,Writing,22
https://www.coursera.org/learn/street-photography-foundations--creative-mindsets,Street Photography: Foundations & Creative Mindsets,Skillshare,,,Beginner level,,"Aesthetics, Adaptability, Creative Thinking, Photo Editing, Patience, Curiosity, Self-Awareness, Creativity, Photography, Storytelling",
https://www.coursera.org/learn/introduction-to-korean-philosophy-and-culture,Introduction to Korean Philosophy and Culture,Sungkyunkwan University,"19,292",4.8,Beginner level,1 week at 10 hours a week,"Language Learning, Research, Liberal Arts, Culture, Intercultural Competence, Cultural Diversity",218
https://www.coursera.org/learn/preserving-cultural-heritage,Recovering the Humankind's Past and Saving the Universal Heritage,Sapienza University of Rome,"18,762",4.4,,1 week to complete,"Case Studies, Data Management, Ancient History, Anthropology, Investigation, Data Modeling, 3D Modeling, Scientific Methods, Timelines, Research, Art History, Cultural Diversity",309
https://www.coursera.org/learn/graphic-elements-design,Graphic Elements of Design: Color Theory and Image Formats,University of Colorado Boulder,"36,435",4.7,Beginner level,1 week at 10 hours a week,"Design, Color Theory, Graphic Design, File Management, Graphic and Visual Design, Image Quality, Digital Design, Design Elements And Principles, Logo Design",594
https://www.coursera.org/learn/kennedy,The Kennedy Half Century,University of Virginia,"27,078",4.7,Beginner level,,"Policy Analysis, Economics, Policy, and Social Studies, Political Sciences, International Relations, Public Policies, Media and Communications, Social Sciences, Public History",504
https://www.coursera.org/learn/3d-character-design-workshop-with-nomad-sculpt,3D Character Design Workshop with Nomad Sculpt,Skillshare,,,Beginner level,,"Computer Graphics, 3D Modeling, Visualization (Computer Graphics), 3D Assets, Color Theory, Animations, Creative Design",
https://www.coursera.org/learn/surface-pattern-design-key-principles-for-amazing-patterns,Surface Pattern Design: Key Principles for Amazing Patterns,Skillshare,,,Intermediate level,,"Graphic and Visual Design Software, Creative Design, Layout Design",
https://www.coursera.org/learn/street-photography-gear-style--on-the-street-skills,"Street Photography: Gear, Style & On-the-Street Skills",Skillshare,,,Beginner level,,"Decision Making, Persistence, Adaptability, Photography, Storytelling, Photo/Video Production and Technology, Resilience, Style Guides, Creativity, Ethical Standards And Conduct, Interpersonal Communications",
https://www.coursera.org/learn/paesaggi-roma-antica,Paesaggi di Roma Antica. Archeologia e storia del Palatino.,Sapienza University of Rome,"4,868",4.8,Beginner level,,"Investigation, World History, Research Methodologies, Spatial Analysis, Ancient History, Culture, Cultural Responsiveness, Scientific Methods, Research, Information Systems, Data Integration, Art History",147
https://www.coursera.org/learn/hd,Introducción a las humanidades digitales,Universidad Nacional Autónoma de México,"3,450",4.7,Beginner level,1 week to complete,"Research Methodologies, Program Development, Human Computer Interaction, Project Planning, Data Mapping, Community Development, Computer Science, Design Thinking, Technical Communication, digital literacy, Intellectual Property, Data Analysis Software, Open Source Technology, Liberal Arts",58
https://www.coursera.org/learn/perspectivas-musica-colaborativa,Perspectivas de música colaborativa,Universidad Nacional Autónoma de México,,,Intermediate level,,"Musical Composition, Content Creation, Music History, Computer Programming Tools, Open Source Technology, Music, Creativity, Aesthetics, Data Sharing, Digital Publishing",
https://www.coursera.org/learn/fundamentals-of-graphic-design-fr,Fondamentaux de l’infographie,California Institute of the Arts,"8,340",4.4,Beginner level,2 weeks at 10 hours a week,"Visualization (Computer Graphics), Design Elements And Principles, Typography, Infographics, Graphic Design, Design, Image Analysis, Computer Graphics, Creativity, Graphic and Visual Design, Color Theory",20
https://www.coursera.org/learn/craft-of-setting-and-description,Creative Writing: The Craft of Setting and Description,Wesleyan University,"69,574",4.7,,,"Writing, Creativity, Content Creation, Writing and Editing, Storytelling","1,408"
https://www.coursera.org/learn/americalatina,América Latina: una introducción,Universidad Nacional Autónoma de México,,,Beginner level,,"Demography, Economics, International Relations, Culture, Environment and Resource Management, European History, Cultural Diversity, Political Sciences, World History, Social Studies",
https://www.coursera.org/learn/the-american-renaissance-and-frederick-douglass,The American Renaissance and Frederick Douglass,Dartmouth College,,,,,"Oral Expression, Liberal Arts, Social Justice, Culture, Storytelling, Writing, Social Studies, Cultural Diversity, Research",
https://www.coursera.org/learn/science-and-religion-101,Science & Religion 101,University of Alberta,"13,462",4.5,,2 weeks to complete,"Ancient History, Science and Research, Research, Anthropology, Physics, Biology",168
https://www.coursera.org/learn/global-affairs-explained-fundamentals,Global Affairs Explained: The Fundamentals,Council on Foreign Relations,,,Beginner level,1 week to complete,"Social Sciences, Political Sciences, Socioeconomics, World History, Analysis, Economics, Policy Analysis, Culture, Governance, Public Policies, Strategic Decision-Making, International Relations",
https://www.coursera.org/learn/poetry-workshop,Sharpened Visions: A Poetry Workshop,California Institute of the Arts,"151,243",4.8,Beginner level,1 week at 10 hours a week,"Peer Review, Music, Creativity, Editing","1,880"
https://www.coursera.org/learn/film-off-ground,Getting Your Film off the Ground,Michigan State University,"16,195",4.5,Beginner level,3 weeks to complete,"Social Media, Proposal Writing, Stakeholder Engagement, Brand Marketing, Campaign Management, Digital Media Strategy, Content Strategy, Fundraising, Content Creation, Social Media Strategy, Fundraising and Crowdsourcing, Grant Writing",57
https://www.coursera.org/learn/guitar-chords,Guitar Chord Voicings: Playing Up The Neck,Berklee,"14,461",4.7,Intermediate level,1 week to complete,"Music, Music Theory, Musical Composition, Instrumental Music, Music Performance",55
https://www.coursera.org/learn/philosophy-physical-sciences,Philosophy and the Sciences: Introduction to the Philosophy of Physical Sciences,The University of Edinburgh,"47,823",4.7,,1 week to complete,"General Science and Research, Science and Research, Physical Science, Research, Research Methodologies, Physics, Scientific Methods",957
https://www.coursera.org/learn/gestion-musical,Gestión musical en América Latina,Universidad Nacional Autónoma de México,,,Beginner level,,"Promotional Strategies, Content Management, Production Management, Cultural Diversity, Music, Digital Publishing, World Music, Social Media Management, Production Planning, Target Audience, Team Management",
https://www.coursera.org/learn/qin-shi-huang,中國古代歷史與人物：秦始皇（Qin Shi Huang),National Taiwan University,"16,033",4.9,,2 weeks to complete,"Culture, Governance, Liberal Arts, Political Sciences, Art History, World History, Ancient History, Case Studies, Public History",228
https://www.coursera.org/learn/egypt-sapienza,Egypt before and after pharaohs.,Sapienza University of Rome,"8,221",4.5,Beginner level,,"Art History, World History, Ancient History, Culture, Cultural Diversity, Anthropology",164
https://www.coursera.org/learn/journey-of-the-universe,Journey of the Universe: The Unfolding of Life,Yale University,"28,277",4.7,,2 weeks to complete,"Anthropology, Creativity, Biology, Environment, Systems Thinking, Environmental Science, Liberal Arts, Physics, Social Studies, Scientific Methods, Timelines, Culture",441
https://www.coursera.org/learn/interdisciplinarity-in-thought-and-practice,Interdisciplinarity in Thought and Practice,Michigan State University,,,Beginner level,1 week to complete,"Creative Thinking, Storytelling, Cognitive flexibility, Brainstorming, Multimedia, Communication, Aesthetics, Critical Thinking, Systems Thinking, Video Editing, Photo Editing, Music",
https://www.coursera.org/learn/egypt,Egiptología (Egyptology),Universitat Autònoma de Barcelona,"81,788",4.9,Beginner level,4 weeks at 10 hours a week,"Art History, Writing, World History, Economics, Cultural Diversity, Ancient History, Anthropology, Timelines","1,506"
https://www.coursera.org/learn/archaeology-heritage-africa,Archaeology and Heritage of Africa,Universitat Autònoma de Barcelona,"2,973",4.7,Beginner level,2 weeks to complete,"Ancient History, Social Sciences, Case Studies, Surveys, Sustainable Development, Cultural Responsiveness, Scientific Methods, Community Development, Culture, Sustainable Systems, Research, Research Methodologies, Environment, Art History, Cultural Diversity, Anthropology",41
https://www.coursera.org/learn/visualizing-womens-work-using-art-media-for-social-justice,Visualizing Women's Work: Using Art Media for Social Justice,University of Michigan,"3,408",4.7,Beginner level,2 weeks to complete,"Public History, Advocacy, Social Impact, Social Justice, Art History, Research, Cultural Diversity, Multimedia, Performing Arts, Creativity",98
https://www.coursera.org/learn/self-reflection-meditation,Meditation: A way to achieve your goals in your life,Korea Advanced Institute of Science and Technology(KAIST),"108,692",4.6,Beginner level,1 week at 10 hours a week,"Self-Awareness, Stress Management, Emotional Intelligence, Mental Concentration, Goal Setting, Personal Development, Positivity, Mindfulness, Relationship Building, Resilience","1,050"
https://www.coursera.org/learn/exploration-to-korean-philosophy-2,EKP2: Formation of Korean Neo-Confucianism,Sungkyunkwan University,,,Intermediate level,1 week to complete,"Culture, Diagram Design, Liberal Arts, Discussion Facilitation, Cultural Diversity",
https://www.coursera.org/learn/deductive-reasoning,Think Again II: How to Reason Deductively,Duke University,"50,887",4.3,Beginner level,1 week at 10 hours a week,"Diagram Design, Information Architecture, Deductive Reasoning, Logical Reasoning",413
https://www.coursera.org/specializations/play-guitar,How to Play Guitar Specialization,Berklee,"41,423",4.8,Beginner level,4 weeks to complete,"Coordination, Creativity, Instrumental Music, Mental Concentration, Music, Music Performance, Music Theory, Musical Composition","2,591"
https://www.coursera.org/learn/introduccin-a-la-produccin-y-apreciacin-musical,Introducción a la Producción y Apreciación musical,SAE Institute México,,,Beginner level,,"Musical Composition, Media Production, Post-Production, Music, Music Theory",
https://www.coursera.org/learn/composicao-escrevendo-letra,Composição: Escrevendo a letra,Berklee,"2,283",4.9,Beginner level,1 week to complete,"Music, Writing and Editing, Music Performance, Writing, Peer Review, Music Theory, Musical Composition, Creativity",25
https://www.coursera.org/learn/black-lives-matter,Black Lives Matter,Johns Hopkins University,"5,365",4.5,Beginner level,2 weeks to complete,"Cultural Diversity, Policy Analysis, Social Sciences, Social Justice, Advocacy, Sociology, Cultural Responsiveness, World History, International Relations, Political Sciences, Demography",82
https://www.coursera.org/learn/color-grading-an-absolute-beginners-crash-course,Color Grading: An Absolute Beginner's Crash Course,Skillshare,,,Beginner level,,"Color Matching, Cinematography",
https://www.coursera.org/learn/cinematography--videography-guide-shot--expert-tips,Cinematography & Videography Guide: Shot & Expert Tips,Skillshare,,,Beginner level,,"Storytelling, Creativity, Content Creation, Videography, Storyboarding, Video Production, Photo/Video Production and Technology, Cinematography",
https://www.coursera.org/specializations/davinciresolve,DaVinci Resolve Specialization,Skillshare,"4,538",4.3,Beginner level,4 weeks to complete,"Animations, Cinematography, Color Matching, Color Theory, Configuration Management, Data Import/Export, Editing, File Management, Image Quality, Motion Graphics, Music, Photo/Video Production and Technology, Post-Production, Storytelling, Timelines, Typography, Video Editing, Video Production, Web Content Accessibility Guidelines",31
https://www.coursera.org/learn/reconstructing-americas-story,Reconstructing America's Story,University of Pennsylvania,"1,628",4.8,Beginner level,3 weeks to complete,"Case Law, Policy Analysis, Storytelling, World History, Political Sciences, Social Justice, Diversity Awareness",24
https://www.coursera.org/learn/race-gender-and-culture,"Race, Gender, and Culture",University of Colorado Boulder,,,Beginner level,,"Diversity Awareness, Cultural Diversity, Social Justice, Socioeconomics, Sociology, World History, Political Sciences, Culture, Social Sciences",
https://www.coursera.org/learn/cinematography--videography-guide-audio--story,Cinematography & Videography Guide: Audio & Story,Skillshare,,,Beginner level,,"Music, Storytelling, Cinematography, Videography, Content Creation, Podcasting, Post-Production, Photo/Video Production and Technology, Video Production",
https://www.coursera.org/learn/the-foundation-of-video-editing,The Foundation of Video Editing,University of Colorado Boulder,"4,875",4.0,Beginner level,2 weeks to complete,"Video Editing, Editing, Video Production, Storytelling, Cinematography",10
https://www.coursera.org/learn/activism-social-movements,ART of the MOOC: Activism and Social Movements,Duke University,"22,313",4.6,,1 week to complete,"Performing Arts, Social Justice, Cultural Diversity, Research, Community Organizing, Advocacy, Creativity, Student Engagement, Social Sciences, Social Impact, Liberal Arts",152
https://www.coursera.org/learn/songwriting-lyrics,Songwriting: Writing the Lyrics,Berklee,"144,299",4.8,Beginner level,1 week at 10 hours a week,"Music, Performing Arts, Musical Composition",909
https://www.coursera.org/learn/exploration-to-korean-philosophy-1,EKP1: Modernity and the Emergence of Korean Philosophy,Sungkyunkwan University,,,Intermediate level,1 week to complete,"Ancient History, World History, Research, Culture, Intercultural Competence, Cultural Diversity",
https://www.coursera.org/learn/philosophy-cognitive-sciences,Philosophy and the Sciences: Introduction to the Philosophy of Cognitive Sciences,The University of Edinburgh,"85,748",4.6,,1 week to complete,"Robotics, Artificial Intelligence, Human Factors, Science and Research, Anthropology, Psychology, Human Learning","1,452"
https://www.coursera.org/learn/premiere-pro-pt-2-transitions-graphics-animation,"Premiere Pro Pt. 2 — Transitions, Graphics & Animation",Skillshare,,,Beginner level,,"Animations, Adobe Premiere, Video Editing, Video Production, Post-Production, Motion Graphics, Graphic and Visual Design",
https://www.coursera.org/learn/altruism,Effective Altruism,Princeton University,"60,720",4.7,Beginner level,1 week at 10 hours a week,"Philanthropy, Program Evaluation, Social Justice, Business Ethics, Ethical Standards And Conduct, Social Impact, Decision Making, Economics",815
https://www.coursera.org/learn/youxi-chanye-gailun,游戏产业概论,Fudan University,"4,334",3.6,Beginner level,2 weeks to complete,"Art History, Augmented and Virtual Reality (AR/VR), Video Game Development, New Product Development, Product Management, Innovation, Product Planning, Game Design, Production Process, Legal Risk, Business, Entrepreneurship, Product Marketing, Regulation and Legal Compliance, Case Studies, Animation and Game Design, Intellectual Property, Corporate Strategy, Global Marketing, Computer Hardware",69
https://www.coursera.org/learn/kunqu,崑曲之美,The Chinese University of Hong Kong,"11,660",4.9,Beginner level,2 weeks to complete,"Classical Music, Music, Art History, Music Performance, Performing Arts, Music History, Liberal Arts, Aesthetics, World Music",705
https://www.coursera.org/learn/kunqu-opera,The Beauty of Kunqu Opera,The Chinese University of Hong Kong,"8,993",4.8,,1 week to complete,"Music, Music Performance, Classical Music, Aesthetics, Music History, Performing Arts, Design, World Music, Art History",206
https://www.coursera.org/learn/guitar-scales-chord-progressions,Guitar Scales and Chord Progressions,Berklee,"51,575",4.7,Intermediate level,1 week at 10 hours a week,"Music Performance, Musical Composition, Music Theory, Music, Instrumental Music, Creativity",392
