url,title,partner,enroll,rating,level,duration,skills,reviews,category
https://www.coursera.org/learn/solar-cell,Organic Solar Cells - Theory and Practice,Technical University of Denmark (DTU),"74,335",4.7,,2 weeks to complete,"Sustainable Technologies, Product Testing, Materials science, Product Lifecycle Management, Technical Standard, Laboratory Testing, Chemistry, Electrical Power, Manufacturing Processes","1,238",Physical Science and Engineering
https://www.coursera.org/learn/oceanografia,Oceanografía: una clave para entender mejor nuestro mundo,Universitat de Barcelona,"20,142",4.6,,3 weeks to complete,"Chemistry, Climate Change Adaptation, Environmental Science, Environment, Water Quality, Physical Science, Remote Access Systems, Water Resources, Geospatial Information and Technology, Spatial Data Analysis, Global Positioning Systems",357,Physical Science and Engineering
https://www.coursera.org/learn/slope-engineering,Slope Engineering,The Hong Kong University of Science and Technology,"2,528",4.7,Beginner level,1 week to complete,"Mechanics, Failure Analysis, Hazard Analysis, Physical Science, Geospatial Information and Technology, Structural Analysis, Engineering Analysis, Experimentation, Risk Control, Civil Engineering, Augmented and Virtual Reality (AR/VR)",65,Physical Science and Engineering
https://www.coursera.org/learn/ceramics-and-composites,Ceramics and Composites,Arizona State University,"3,149",4.4,Intermediate level,2 weeks to complete,"Materials science, Manufacturing Processes, Chemical Engineering, Mechanical Engineering, Structural Analysis, Engineering Calculations, Failure Analysis",50,Physical Science and Engineering
https://www.coursera.org/learn/geometrical-physical-optics,Physics of Geometrical and Physical Optics,Rice University,"1,605",,Intermediate level,2 weeks to complete,"Problem Solving, Calculus, Algebra, Geometry, Physics, Physical Science, Mathematical Modeling, Engineering Analysis, Applied Mathematics, Trigonometry, Mathematical Theory & Analysis, Advanced Mathematics",,Physical Science and Engineering
https://www.coursera.org/learn/modeling-ic-processes-emerging-microtechnology,"Modeling, IC Processes and Emerging Microtechnology",University of Minnesota,,,,1 week to complete,"Mathematical Modeling, Artificial Intelligence, Simulation and Simulation Software, Computer Architecture, Process Engineering, Semiconductors, Finite Element Methods, Electronic Components, Electronic Systems, Manufacturing Processes, Emerging Technologies, Scalability, Micrometer",,Physical Science and Engineering
https://www.coursera.org/learn/macroscopic-microscopic-thermodynamics,Fundamentals of Macroscopic and Microscopic Thermodynamics,University of Colorado Boulder,"18,088",4.3,Advanced level,,"Calculus, Probability Distribution, Physics, Engineering, Statistical Methods, Physical Science, Mechanical Engineering, Chemistry",270,Physical Science and Engineering
https://www.coursera.org/learn/systems-engineering-fundamentals-part-2,Systems Engineering Fundamentals Part 2,University of Colorado System,,,Intermediate level,,"Systems Architecture, Systems Development Life Cycle, Risk Management, Verification And Validation, Systems Integration, Systems Analysis, Systems Design, Configuration Management, Systems Development, Requirements Analysis, Maintainability, Reliability, Systems Engineering, Risk Management Framework",,Physical Science and Engineering
https://www.coursera.org/learn/climate-resilience-and-urban-sustainability,Climate Resilience and Urban Sustainability,University of Colorado Boulder,,5.0,Beginner level,2 weeks to complete,"Land Development, Social Justice, Sustainable Design, Social Impact, Climate Change Mitigation, Energy and Utilities, Community Development, Environmental Laws, Environmental Science, Systems Thinking, Socioeconomics, Sustainable Development, Environmental Policy, Climate Change Adaptation",10,Physical Science and Engineering
https://www.coursera.org/learn/microcontrollers-basic-architecture-and-design,Microcontrollers: Basic Architecture and Design,University of Colorado Boulder,"1,612",,Intermediate level,3 weeks to complete,"Computer Architecture, Peripheral Devices, Digital Design, Electronic Components, Hardware Design, Electronics, Electronics Engineering, Application Design, Microarchitecture, Debugging, System Configuration, Electronic Systems, Embedded Systems, Electronic Hardware, Hardware Architecture",,Physical Science and Engineering
https://www.coursera.org/learn/extinctions-past-present-and-future,"Extinctions: Past, Present, & Future",Emory University,"10,693",4.8,Beginner level,2 weeks at 10 hours a week,"Climate Change Adaptation, Environmental Issue, Natural Resource Management, Environment, Environmental Science, Timelines, World History, Environment and Resource Management, Physical Science, Biology, Ancient History",138,Physical Science and Engineering
https://www.coursera.org/learn/statistical-thermodynamics-cm,Statistical Thermodynamics: Molecules to Machines,Carnegie Mellon University,"14,178",3.9,Intermediate level,1 week to complete,"Mechanical Engineering, Chemical Engineering, Mathematical Modeling, Biology, Molecular, Cellular, and Microbiology, Materials science, Physical Science, Chemistry, Engineering, Physics",52,Physical Science and Engineering
https://www.coursera.org/learn/mbse,MBSE: Model-Based Systems Engineering,University at Buffalo,"34,854",4.4,Beginner level,2 weeks at 10 hours a week,"Manufacturing Processes, Product Lifecycle Management, Process Analysis, Verification And Validation, Enterprise Architecture, Internet Of Things, Model Based Systems Engineering, Industrial Engineering, Simulation and Simulation Software, Systems Engineering",903,Physical Science and Engineering
https://www.coursera.org/learn/basics-of-electrical-protection-system,Basics of Electrical Protection System,L&T EduTech,"12,364",4.5,Beginner level,1 week to complete,"Basic Electrical Systems, Electrical Engineering, High Voltage, Electrical Power, Electrical Systems, Low Voltage, Coordination, Electrical Safety, Electrical Equipment, Electric Power Systems, Three-Phase",75,Physical Science and Engineering
https://www.coursera.org/learn/leds-semiconductor-lasers,Light Emitting Diodes and Semiconductor Lasers,University of Colorado Boulder,"12,541",3.7,Advanced level,3 weeks at 10 hours a week,"Electronics, Display Devices, Semiconductors, Physics, Materials science, Applied Mathematics, Mathematical Modeling, Electronic Components, Electrical Engineering, Engineering Calculations",51,Physical Science and Engineering
https://www.coursera.org/learn/astrobiology,Astrobiology and the Search for Extraterrestrial Life,The University of Edinburgh,"92,320",4.8,,1 week to complete,"Scientific Methods, Biology, Environmental Science, Microbiology, Research, Environment, Biochemistry, Life Sciences, Chemistry","2,684",Physical Science and Engineering
https://www.coursera.org/learn/wind-energy,Wind Energy,Technical University of Denmark (DTU),"172,563",4.7,,3 weeks to complete,"Energy and Utilities, Structural Analysis, Failure Analysis, Sustainable Engineering, Electrical Power, Forecasting, Mechanical Engineering, Systems Engineering, Materials science, Financial Analysis, Environmental Monitoring, Engineering, Engineering Calculations, High Voltage, Financial Forecasting","7,289",Physical Science and Engineering
https://www.coursera.org/learn/vlsi-chip-design-and-simulation-with-electric-vlsi-eda-tool,VLSI Chip Design and Simulation with Electric VLSI EDA Tool,L&T EduTech,"6,402",4.5,Intermediate level,1 week to complete,"Simulation and Simulation Software, Electronics Engineering, Hardware Design, Software Installation, Computer Architecture, Computational Logic, Electronic Components, Electronic Systems, Semiconductors, Diagram Design, Electrical Engineering, Low Voltage, Verification And Validation, Schematic Diagrams",38,Physical Science and Engineering
https://www.coursera.org/learn/modeling-with-simulink,Modeling and Simulation with Simulink,MathWorks,"7,395",4.8,Beginner level,1 week to complete,"Model Based Systems Engineering, Performance Tuning, Test Case, Mathematical Modeling, Engineering Analysis, Simulation and Simulation Software, Automation Engineering, Systems Design, Engineering Design Process, Control Systems, Systems Analysis",55,Physical Science and Engineering
https://www.coursera.org/learn/electricity,Electric Industry Operations and Markets,Duke University,"56,761",4.8,Beginner level,,"Operational Efficiency, Plant Operations and Management, Basic Electrical Systems, Environmental Regulations, Market Dynamics, Electric Power Systems, Dispatching, Electrical Power, Regulatory Compliance, Energy and Utilities, Operating Cost, Capacity Management","1,567",Physical Science and Engineering
https://www.coursera.org/learn/journey-knowledge-action,Journey Conversations: Weaving Knowledge and Action,Yale University,"7,561",4.8,,4 weeks to complete,"Liberal Arts, Environment, Systems Thinking, Storytelling, Community Development, Physics, Environmental Science, Anthropology, Cultural Diversity, Biology, Teaching, Sustainable Development",164,Physical Science and Engineering
https://www.coursera.org/learn/gis-mapping-spatial-analysis-capstone,"GIS, Mapping, and Spatial Analysis Capstone",University of Toronto,"19,088",4.9,Beginner level,1 week at 10 hours a week,"Data Visualization, ArcGIS, Geospatial Mapping, Metadata Management, Data Integration, Data Management, Data Mapping, Data Compilation, Spatial Analysis, Data Storytelling",324,Physical Science and Engineering
https://www.coursera.org/learn/working-for-a-sustainable-future,Working for a sustainable future: concepts and approaches,Lund University,"8,253",4.7,Beginner level,2 weeks at 10 hours a week,"Environmental Science, Environment, Mathematical Modeling, Sustainability Standards, Environmental Policy, Climate Change Mitigation, Natural Resource Management, Innovation, Sustainable Technologies, Climate Change Adaptation, Policy Development, Sustainable Development, Systems Thinking, Geospatial Information and Technology, Sustainable Business",124,Physical Science and Engineering
https://www.coursera.org/learn/history-of-rocket-science,The History of Rocket Science,University of Michigan,,4.9,Beginner level,1 week to complete,"Emerging Technologies, Aerospace Basic Quality System Standards, International Relations, World History, Timelines, Engineering Design Process, Manufacturing and Production, Political Sciences",24,Physical Science and Engineering
https://www.coursera.org/learn/circular-economy,Circular Economy - Sustainable Materials Management,Lund University,"82,546",4.8,Beginner level,2 weeks at 10 hours a week,"Supply Management, Sustainable Development, Environmental Science, Stakeholder Engagement, Policy Analysis, Environmental Policy, Strategic Sourcing, Environment and Resource Management, Sustainable Design, Innovation, Social Impact, Environmental Engineering, Sustainable Business, Business Analysis","2,072",Physical Science and Engineering
https://www.coursera.org/specializations/intro-semiconductor-micro-electromechanical-systems,Introduction to Semiconductor and MEMS Fabrication Specialization,University of Minnesota,,4.9,Intermediate level,4 weeks to complete,"Biomedical Engineering, Computer Architecture, Electrical Engineering, Electronic Components, Electronic Systems, Electronics, Electronics Engineering, Emerging Technologies, Finite Element Methods, Laboratory Testing, Manufacturing Processes, Materials science, Mechanical Design, Mechanical Engineering, Medical Devices, Process Control, Process Engineering, Product Testing, Quality Assurance, Semiconductors",10,Physical Science and Engineering
https://www.coursera.org/specializations/health-safety-environmental-hse-engineering,"Health, Safety, and Environmental (HSE) Engineering Specialization",Khalifa University,"7,141",4.7,Beginner level,4 weeks to complete,"Accident Prevention, Accident Reporting, Engineering, Engineering Management, Environment and Resource Management, Environment Health And Safety, Environmental Engineering, Environmental Engineering and Restoration, Environmental Laws, Environmental Management Systems, Environmental Monitoring, Environmental Regulations, Environmental Resource Management, Fire And Life Safety, Hazardous Waste Operations And Emergency Response Standard (HAZWOPER), Occupational Health, Risk Analysis, Risk Management, Risk Management Framework, Safety Training",213,Physical Science and Engineering
https://www.coursera.org/learn/engineering-of-structures-tension,Engineering of Structures: Tension,Dartmouth College,"6,228",4.9,Beginner level,1 week to complete,"Mechanics, Civil Engineering, Materials science, Engineering Analysis, Structural Analysis, Engineering Design Process, Structural Engineering, Construction",78,Physical Science and Engineering
https://www.coursera.org/learn/flight-mecha-balance,Flight mechanics - Propulsive balance and energy,ISAE-SUPAERO,"4,060",4.7,Intermediate level,,"Engineering, Thermal Management, Control Systems, Engineering Calculations, Mathematical Modeling, Energy and Utilities, Physics, Engineering Analysis, Mechanics",62,Physical Science and Engineering
https://www.coursera.org/specializations/power-electronics,Power Electronics Specialization,University of Colorado Boulder,"83,470",4.7,Intermediate level,2 months to complete,"Control Systems, Design Specifications, Electric Power Systems, Electrical Engineering, Electrical Power, Electrical Systems, Electronic Components, Electronic Systems, Electronics, Electronics Engineering, Engineering Design Process, Engineering Documentation, Hardware Design, Power Electronics, Semiconductors, Simulation and Simulation Software, Simulations, Technical Communication, USB","4,284",Physical Science and Engineering
https://www.coursera.org/learn/neutrino-physics,Introduction to Neutrino Physics,Universitat Autònoma de Barcelona,,,Beginner level,,"Engineering, Scientific, and Technical Instruments, Laboratory Research, Physical Science, General Science and Research, Experimentation, Physics",,Physical Science and Engineering
https://www.coursera.org/learn/teach-light-color,Exploring Light: Hands-on Activities and Strategies for Teachers,Exploratorium,"10,863",4.8,Intermediate level,,"Visualization (Computer Graphics), Constructive Feedback, Physics, Learning Strategies, Scientific Methods, Experimentation, Instructional Design, Laboratory Experience, Investigation, Educational Materials, Collaboration",56,Physical Science and Engineering
https://www.coursera.org/learn/solidworks-assemblies-and-exam-level-part-modeling,SOLIDWORKS Assemblies and Exam Level Part Modeling,Dassault Systèmes,"2,454",4.6,Beginner level,1 week to complete,"Computer-Aided Design, Mechanical Design, Engineering Drawings, 3D Modeling, Assembly Drawing",52,Physical Science and Engineering
https://www.coursera.org/learn/material-science-engineering,Material Processing,Georgia Institute of Technology,"33,831",4.8,,1 week to complete,"Engineering, Manufacturing Processes, Physical Science, Structural Analysis, Chemistry, Mechanical Engineering, Chemical Engineering, Materials science","1,076",Physical Science and Engineering
https://www.coursera.org/learn/health-safety-and-environmental-engineering-course-two,Risk Management and Industrial Safety,Khalifa University,"4,732",4.7,,,"Root Cause Analysis, Risk Modeling, Hazard Analysis, Investigation, Risk Management, Regulation and Legal Compliance, Occupational Safety And Health, Emergency Response, Accident Reporting, Fire And Life Safety, Human Factors, Accident Prevention, Safety Standards, Risk Mitigation, Risk Analysis, Safety Training",50,Physical Science and Engineering
https://www.coursera.org/learn/xdesign-revolution-and-cut-features,xDesign Revolution and Cut Features,Dassault Systèmes,,,Beginner level,,"3D Modeling, Mechanical Engineering, Computer-Aided Design, Mechanical Design",,Physical Science and Engineering
https://www.coursera.org/learn/nonlinear-kalman-filters-parameter-estimation,Nonlinear Kalman Filters (and Parameter Estimation),University of Colorado System,,,Intermediate level,2 weeks to complete,"Computer Programming Tools, Calculus, Model Evaluation, Control Systems, Estimation, Applied Mathematics, Mathematical Modeling, Numerical Analysis, Simulation and Simulation Software, Derivatives",,Physical Science and Engineering
https://www.coursera.org/learn/qualitative-and-quantitative-analysis-of-disaster-risk,Qualitative and Quantitative Analysis of Disaster Risk,Banco Interamericano de Desarrollo,"8,396",4.7,Advanced level,1 week to complete,"Project Risk Management, Qualitative Research, Vulnerability Assessments, Risk Analysis, Climate Change Adaptation, Resilience, Analysis, Failure Analysis, Risk Modeling, Simulation and Simulation Software, Risk Management, Data Analysis Software",69,Physical Science and Engineering
https://www.coursera.org/learn/analyze,Analyzing the Universe,Rutgers the State University of New Jersey,"20,140",4.8,Beginner level,2 weeks at 10 hours a week,"Science and Research, Data Analysis Software, Applied Mathematics, Spatial Data Analysis, General Science and Research, Estimation, Physical Science, Scientific Visualization, Image Analysis, Scientific Methods, Engineering, Scientific, and Technical Instruments, Physics",234,Physical Science and Engineering
https://www.coursera.org/learn/ingnuclear-principiantes,Ingeniería nuclear para principiantes,Universidad Nacional Autónoma de México,,4.9,Beginner level,3 weeks to complete,"Physics, Materials science, Chemistry, Environmental Engineering, Engineering, Energy and Utilities, Radiation Protection, Control Systems, Safety Standards, Thermal Management",10,Physical Science and Engineering
https://www.coursera.org/learn/origensdavida,Origens da Vida no Contexto Cósmico,Universidade de São Paulo,"72,251",4.8,Beginner level,,"Physics, Biology, Chemistry, General Science and Research, Physical Science, Life Sciences, Environmental Science, Biochemistry, Experimentation","2,114",Physical Science and Engineering
https://www.coursera.org/specializations/sustainable-cities,Sustainable Cities and Communities Specialization,Lund University,"6,990",4.7,Beginner level,4 weeks to complete,"Business Modeling, Case Studies, Climate Change Adaptation, Climate Change Mitigation, Community Development, Environment, Environmental Issue, Environmental Science, Governance, Innovation, Multimedia, Social Impact, Socioeconomics, Sustainable Business, Sustainable Design, Sustainable Development, Sustainable Technologies, Systems Thinking, Water Resources, Water Sustainability","3,026",Physical Science and Engineering
https://www.coursera.org/learn/oilandgas,Oil & Gas Industry Operations and Markets,Duke University,"165,351",4.8,,"The oil and gas industry has an enormous impact on all aspects of daily life. Individuals, corporations, and national governments make financial and policy decisions based on the cost, use, and availability of these two natural resources. This two-week course looks at the two most fundamental aspects of the oil and gas industry, its operations and markets, each of which is addressed as a separate module in the course. In the operations module, the course provides an overview of the production of oil and gas, from initial exploration to final transport. The second module focuses on the forces that drive the industry's operations, the oil and gas markets, including the cost of wells, seasonal impacts on prices, and the role of oil reserves. After every lesson, learners will take short quizzes to test their newly acquired knowledge, participant in crowd-sourced discussions about global markets, and complete a final project.","Transportation Operations, Operations, Cost Estimation, Production Process, Market Analysis, Oil and Gas, Market Dynamics, Energy and Utilities, Natural Resource Management, Market Trend","6,570",Physical Science and Engineering
https://www.coursera.org/specializations/materials-science-for-advanced-technological-applications,Materials Science for Advanced Technological Applications Specialization,Arizona State University,"4,275",4.5,Intermediate level,2 months to complete,"Chemical Engineering, Chemistry, Electrical Engineering, Electronic Components, Electronics, Electronics Engineering, Engineering Calculations, Failure Analysis, Manufacturing Processes, Materials science, Mechanical Engineering, Process Control, Semiconductors, Structural Analysis, Thermal Management",200,Physical Science and Engineering
https://www.coursera.org/learn/emergent-phenomena,Emergent Phenomena in Science and Everyday Life,"University of California, Irvine","17,163",4.4,,2 weeks to complete,"Physics, Materials science, Psychology, Computational Logic, Applied Mathematics, General Science and Research, Systems Thinking, Simulations, Mathematical Modeling, Mechanics, Biology, Analysis",168,Physical Science and Engineering
https://www.coursera.org/learn/environmental-issues-policies-and-practice-1,"Environmental Issues, Policies, and Practice",O.P. Jindal Global University,,,Beginner level,3 weeks to complete,"Water Quality, Sustainable Development, Pollution Prevention, Environmental Policy, Public Health, Epidemiology, Water Resources, Sanitation, Climate Change Adaptation, Environment, Risk Analysis, Environmental Issue, Environmental Monitoring, Hazard Analysis, Environmental Laws",,Physical Science and Engineering
https://www.coursera.org/specializations/rocket-science-101,Rocket Science 101 Specialization,University of Michigan,"3,053",4.9,Beginner level,4 weeks to complete,"Aerospace Basic Quality System Standards, Calculus, Chemical Engineering, Climate Change Programs, Emerging Technologies, Engineering, Environment, Environmental Monitoring, Global Positioning Systems, International Relations, Manufacturing and Production, Mechanics, Physical Science, Physics, Political Sciences, Research, Scientific Methods, Trigonometry, World History",59,Physical Science and Engineering
https://www.coursera.org/learn/light-materials,Physics of Light and Materials,Rice University,"1,846",,Intermediate level,2 weeks to complete,"Materials science, Problem Solving, Differential Equations, Physical Science, Physics, Vibrations, Mathematical Modeling, Advanced Mathematics, Engineering Analysis, Mechanics, Trigonometry, Linear Algebra, Applied Mathematics",,Physical Science and Engineering
https://www.coursera.org/learn/major-engineering-project-performance,Major Engineering Project Performance,University of Leeds,"28,907",4.7,Intermediate level,2 weeks at 10 hours a week,"Cost Management, Project Performance, Timelines, Project Risk Management, Program Management, Project Estimation, Research, Stakeholder Management, Portfolio Management, Forecasting, Engineering Management, Case Studies, Presentations, Project Management, Project Management Life Cycle",996,Physical Science and Engineering
https://www.coursera.org/learn/general-physics-odc,General Physics,"Birla Institute of Technology & Science, Pilani","1,567",,Beginner level,5 weeks to complete,"Critical Thinking and Problem Solving, Mechanical Engineering, Physics, Analytical Skills, Trigonometry, Problem Solving, Vibrations, Engineering, Critical Thinking, Science and Research, Engineering Analysis, Research, Software Development, Physical Science, Computer Science, Logical Reasoning, Mathematical Theory & Analysis, Applied Mathematics, Mechanics",,Physical Science and Engineering
https://www.coursera.org/learn/fundamental-skills-in-engineering-design,Fundamental Skills in Engineering Design,University of Leeds,"15,871",4.7,Beginner level,,"Conceptual Design, Requirements Elicitation, Product Lifecycle Management, New Product Development, Product Development, Product Requirements, Engineering Design Process, Engineering Practices, Product Design, Engineering Management, Problem Solving",230,Physical Science and Engineering
https://www.coursera.org/learn/energy-management-for-real-estate,Energy management for real estate. Methods and digital tools,Politecnico di Milano,"4,289",4.5,Beginner level,,"Property Management, Auditing, Analysis, Building Services Engineering, Simulation and Simulation Software, Real Estate, Digital Assets, HVAC, Energy and Utilities, Facility Management, Building Design, Case Studies, Sustainable Architecture",177,Physical Science and Engineering
https://www.coursera.org/learn/climate-change-in-water-and-sanitation-utilities,Climate Change in Water and Sanitation Utilities,Banco Interamericano de Desarrollo,"1,635",4.9,Beginner level,2 weeks to complete,"Risk Management, Water Resource Management, Energy and Utilities, Environmental Science, Innovation, Finance, Sustainable Business, Climate Change Mitigation, Climate Change Adaptation, Environmental Monitoring, Environmental Policy",56,Physical Science and Engineering
https://www.coursera.org/learn/ai-for-autonomous-vehicles-and-robotics,AI for Autonomous Vehicles and Robotics,University of Michigan,"5,979",4.4,Intermediate level,,"Reinforcement Learning, Transfer Learning, Control Systems, Machine Learning, Algorithms, Artificial Intelligence, Artificial Intelligence and Machine Learning (AI/ML), Deep Learning, Robotics, Computer Vision, Machine Learning Algorithms, Machine Learning Methods",56,Physical Science and Engineering
https://www.coursera.org/learn/audio-engineering,Fundamentals of Audio and Music Engineering: Part 1 Musical Sound & Electronics,University of Rochester,"93,778",4.6,Intermediate level,1 week at 10 hours a week,"Vibrations, Electronic Components, Basic Electrical Systems, Instrumental Music, Electrical Engineering, Electronics Engineering, Electrical Systems, Electronics, Music, Electronic Systems",593,Physical Science and Engineering
